id,question,answer
138,"Some people firmly believe that there are other advanced civilizations other than human civilization in the universe, because there is no theory and evidence to prove that such a civilization cannot exist. Which of the following options is the same as the argument in the question stem?
(A) There are savages in the Shennongjia area because someone has seen the savages. (B) Since you can't prove that ghosts don't exist, so ghosts exist. (C) Scientists are not born smart, for example, Einstein did not seem very smart when he was a child. (D) A scholastic philosopher does not believe that human nerves converge in the brain. The reason is that in Aristotle's writings, nerves are generated from the heart.","Reformatted_Question: Some people <fact1>firmly believe</fact1> that there are <fact2>other advanced civilizations</fact2> other than <fact3>human civilization in the universe</fact3>, because there is <fact4>no theory and evidence</fact4> to prove that such a civilization <fact5>cannot exist</fact5>. Which of the following options is the same as the argument in the question stem?\n(A) There are <fact6>savages</fact6> in the <fact7>Shennongjia area</fact7> because <fact8>someone has seen the savages</fact8>. (B) Since you <fact9>can't prove that ghosts don't exist</fact9>, so <fact10>ghosts exist</fact10>. (C) <fact11>Scientists are not born smart</fact11>, for example, <fact12>Einstein did not seem very smart when he was a child</fact12>. (D) A <fact13>scholastic philosopher</fact13> does not believe that <fact14>human nerves converge in the brain</fact14>. The reason is that in <fact15>Aristotle's writings</fact15>, <fact16>nerves are generated from the heart</fact16>.

Answer_Reasoning: The argument in the question stem is based on the premise that because there is no evidence disproving the existence of something, it might exist. This is similar to the logic presented in option B, where it's asserted that because you can't prove ghosts don't exist, they must exist. Both arguments are based on a lack of disproof rather than positive evidence.

Final_Answer: {B}"
139,"There are four assertions about a criminal case? (1) There is evidence that Chen Hu did not commit the crime; (2) The perpetrator is either Wang Guang, Chen Hu, or Zhu Tong; (3) There is also evidence that Wang Guang did not commit the crime; (4) The TV screen showed? At the time of the incident, Zhu Tong was in the auditorium of a football game away from the crime scene. Which of the following is a correct description of the four assertions in the stem?
(A) It can be deduced from the above assertion? there is only one crime. (B) At least one of the above assertions is false. (C) From these assertions, it can be concluded that the evidence that Wang Guang did not commit the crime is false. (D) Zhu Tong is definitely not in the audience of the football match.","Reformatted_Question: There are four assertions about a criminal case: (1) There is evidence that <fact1>Chen Hu did not commit the crime</fact1>; (2) The <fact2>perpetrator is either Wang Guang, Chen Hu, or Zhu Tong</fact2>; (3) There is also evidence that <fact3>Wang Guang did not commit the crime</fact3>; (4) The <fact4>TV screen showed that at the time of the incident, Zhu Tong was in the auditorium of a football game away from the crime scene</fact4>. 

Which of the following is a correct description of the four assertions in the stem?  
(A) It can be deduced from the above assertion that <fact5>there is only one crime</fact5>.  
(B) <fact6>At least one of the above assertions is false</fact6>.  
(C) From these assertions, it can be concluded that <fact7>the evidence that Wang Guang did not commit the crime is false</fact7>.  
(D) <fact8>Zhu Tong is definitely not in the audience of the football match</fact8>.

Answer_Reasoning: Based on the assertions, we have three possible suspects according to fact2: Wang Guang, Chen Hu, or Zhu Tong. However, fact1 and fact3 claim that both Chen Hu and Wang Guang did not commit the crime. Furthermore, fact4 states that Zhu Tong was at a football game away from the crime scene. 

This creates a contradiction because all suspects are accounted for as not committing the crime given the evidence. Therefore, at least one of these assertions must be false because if all evidence were true, there would be no perpetrator left to commit the crime, violating the premise in fact2. Thus, correct answer is (B) At least one of the above assertions is false.

Final_Answer: {B}"
140,"TV commercial? Well, this wine should be a little longer and the craft should be more refined. Good wine, you can drink a little. (Advertisers looked at Bancheng Shaoguo in their hands) Well, Bancheng Shaoguo, you can drink a little. In order to make the last sentence in the subject a logical inference from the previous sentences, which of the following premises needs to be added?
(A) Moutai is the most famous good wine in China. (B) Wuliangye and Bancheng Shaojiao are good wines. (C) It's been a long time for Bancheng casserole wine. (D) The craft of Bancheng casserole is excellent.","Reformatted_Question: TV commercial? Well, this wine should be a little longer and the <fact1>craft should be more refined</fact1>. <fact2>Good wine, you can drink a little</fact2>. (Advertisers looked at <fact3>Bancheng Shaoguo in their hands</fact3>) Well, <fact4>Bancheng Shaoguo, you can drink a little</fact4>. In order to make the last sentence in the subject a logical inference from the previous sentences, which of the following premises needs to be added?\n(A) <fact5>Moutai is the most famous good wine in China</fact5>. (B) <fact6>Wuliangye and Bancheng Shaojiao are good wines</fact6>. (C) <fact7>It's been a long time for Bancheng casserole wine</fact7>. (D) <fact1>The craft of Bancheng casserole is excellent</fact1>.

Answer_Reasoning: The conclusion of the TV commercial is that Bancheng Shaoguo, which is in the hands of the advertiser, can be considered as ""good wine"" because ""you can drink a little"" of it. The premise that needs to be added should logically connect the idea that Bancheng Shaoguo is good wine, based on previous statements. One statement mentions that ""the craft should be more refined,"" which implies craft is essential for its quality. Therefore, if we add the information that ""The craft of Bancheng casserole is excellent"" (Option D), it logically supports the conclusion that Bancheng Shaoguo is a good wine. Thus, the needed premise is option D.

Final_Answer: {D}"
141,"European fern is a poisonous wild grass that has spread and destroyed many pastures in the northern hemisphere in recent years. One way to deal with this wild grass is to spend less money and be self-sustaining by introducing the natural enemy of this plant. Therefore, some scientists suggested that the moths that feed on the European fern produced in the southern hemisphere were released into the northern hemisphere affected by this wild grass to control the growth of the European fern. If the scientist ’s proposal to control the European fern is adopted, which of the following is necessary for its success?
(A) This northern fern of the northern hemisphere also grows in areas with similar climate and soil conditions in the southern hemisphere. (B) In addition to eating European ferns, the moths they stock also eat other wild grasses that grow in the northern hemisphere. (C) The stocked moths can survive in the northern hemisphere and can form a large enough group to reduce the number of European ferns and prevent their growth. (D) When the number of European ferns decreases, livestock will become immune to diseases caused by this wild grass.","Reformatted_Question: The <fact1>European fern</fact1> is a <fact2>poisonous wild grass</fact2> that has <fact3>spread and destroyed many pastures in the northern hemisphere</fact3> in recent years. One way to <fact4>deal with this wild grass</fact4> is to <fact5>spend less money and be self-sustaining</fact5> by <fact6>introducing the natural enemy of this plant</fact6>. Therefore, some scientists <fact7>suggested that the moths</fact7> that feed on the <fact1>European fern</fact1> <fact8>produced in the southern hemisphere</fact8> were <fact9>released into the northern hemisphere</fact9> affected by this wild grass to <fact10>control the growth of the European fern</fact10>. If the scientist’s proposal to <fact10>control the European fern</fact10> is adopted, which of the following is necessary for its success?\n(A) This <fact11>northern fern of the northern hemisphere</fact11> also grows in areas with <fact12>similar climate and soil conditions in the southern hemisphere</fact12>. (B) In addition to <fact13>eating European ferns</fact13>, the <fact7>moths</fact7> they stock also eat <fact14>other wild grasses that grow in the northern hemisphere</fact14>. (C) The <fact7>stocked moths can survive in the northern hemisphere</fact7> and can <fact15>form a large enough group to reduce the number of European ferns and prevent their growth</fact15>. (D) When the <fact16>number of European ferns decreases</fact16>, livestock will become <fact17>immune to diseases caused by this wild grass</fact17>.

Answer_Reasoning: The scientists' proposal is reliant on the ability of the moths, which are natural predators of the European fern, to be successful in controlling the growth of the fern in the northern hemisphere. Therefore, critical factors for success would include the moths' ability to survive in the new environment, the ability to reproduce and form a large enough population, and effectively reduce the number of European ferns. Option C, which states that the stocked moths can survive in the northern hemisphere and can form a large enough group to reduce the number of European ferns and prevent their growth, directly addresses these critical factors and therefore is necessary for the proposal's success.

Final_Answer: {C}"
142,"Koreans love sauerkraut and Cuihua loves sauerkraut, so Cuihua is Korean. Which of the following options most clearly shows the absurdity of the above reasoning?
(A) All Cretans are lying, John is Cretan, so John is lying. (B) Walking animals have legs, and tables have legs, so tables are walking animals. (C) Nishimura loves Cuihua. Cuihua loves pickled cabbage. Therefore, Nishimura loves pickled cabbage. (D) All gold glitters, so some glitters are gold.","Reformatted_Question: <fact1>Koreans love sauerkraut</fact1> and <fact2>Cuihua loves sauerkraut</fact2>, so <conclusion>Cuihua is Korean</conclusion>. Which of the following options most clearly shows the absurdity of the above reasoning?\n(A) <comparison1>All Cretans are lying</comparison1>, <comparison2>John is Cretan</comparison2>, so <conclusion>John is lying</conclusion>. (B) <comparison3>Walking animals have legs</comparison3>, and <comparison4>tables have legs</comparison4>, so <conclusion>tables are walking animals</conclusion>. (C) <comparison5>Nishimura loves Cuihua</comparison5>. <comparison6>Cuihua loves pickled cabbage.</comparison6> Therefore, <conclusion>Nishimura loves pickled cabbage.</conclusion> (D) <comparison7>All gold glitters</comparison7>, so <conclusion>some glitters are gold</conclusion>.

Answer_Reasoning: The original statement assumes that because Cuihua loves something (sauerkraut) that is commonly liked by Koreans, Cuihua must also be Korean. This is a classic example of faulty logic known as affirming the consequent, where a specific condition being true leads to an erroneous generalization. Option (B) makes a similar logical error: just because tables share a characteristic with walking animals (having legs), it does not imply that tables are walking animals. This mirrors the mistake in the original reasoning, where a shared characteristic leads to an incorrect categorical inclusion.

Final_Answer: {B}"
143,"Workers of state-owned enterprises are laid off and migrant workers enter the city, causing a high unemployment rate and a great threat to social stability. Therefore, we must increase the scale of economic development and accelerate the speed of economic development. Which of the following provides the strongest support for the argument in the question stem?
(A) Only by increasing the scale of economic development and accelerating the speed of economic development can more jobs be created. (B) There is a certain relationship between the scale and speed of economic development and the social employment rate. (C) If a person is unemployed, it will affect the life of himself and his family. (D) Unemployed people are easily irritable, emotionally depressed, and deviant.","Reformatted_Question: <fact1>Workers of state-owned enterprises</fact1> are <fact2>laid off</fact2> and <fact3>migrant workers</fact3> enter the city, <fact4>causing a high unemployment rate and a great threat to social stability</fact4>. Therefore, we must <fact5>increase the scale of economic development and accelerate the speed of economic development</fact5>. Which of the following provides the strongest support for the argument in the question stem?\n(A) Only by <fact5>increasing the scale of economic development and accelerating the speed of economic development</fact5> can <fact6>more jobs be created</fact6>. (B) There is a certain relationship between the scale and speed of economic development and the <fact7>social employment rate</fact7>. (C) If a person is unemployed, it will affect the life of himself and his family. (D) Unemployed people are easily irritable, emotionally depressed, and deviant.

Answer_Reasoning: The question stem suggests that in response to <fact2>unemployment</fact2> and the threat to <fact4>social stability</fact4>, there needs to be an effort to <fact5>increase economic growth</fact5>. To support this argument, the option should reinforce the idea that increasing economic growth directly addresses the issue of <fact4>high unemployment</fact4>. Option (A) states that only by increasing economic growth can <fact6>more jobs be created</fact6>, which directly links economic growth to solving the unemployment issue and thereby supporting the argument most strongly.

Final_Answer: {A}"
144,"There are six switches S, T, W, X, Y, and Z in a circuit. The following conditions must be met when using these switches? (1) If W is on, then X must be on; (2) Only off Turn on S to turn off T; (3) T and X cannot be connected at the same time, nor can they be turned off at the same time; (4) If Y and Z are turned on at the same time, then W must also be turned on. If S and Z are now connected at the same time, which of the following must be true?
(A) T is the on state and Y is the off state. (B) Both T and Y are off. (C) Both W and T are on. (D) X is the on state and Y is the off state.","Reformatted_Question: There are <fact1>six switches S, T, W, X, Y, and Z in a circuit</fact1>. The following <fact2>conditions must be met</fact2> when using these switches: (1) If <fact3>W is on</fact3>, then <fact4>X must be on</fact4>; (2) Only <fact5>off Turn on S</fact5> to <fact6>turn off T</fact6>; (3) <fact7>T and X cannot be connected at the same time</fact7>, nor can they be turned off at the same time; (4) If <fact8>Y and Z are turned on at the same time</fact8>, then <fact9>W must also be turned on</fact9>. If <fact10>S and Z are now connected at the same time</fact10>, which of the following must be true? \n(A) <fact11>T is the on state and Y is the off state</fact11>. (B) <fact12>Both T and Y are off</fact12>. (C) <fact13>Both W and T are on</fact13>. (D) <fact14>X is the on state and Y is the off state</fact14>.

Answer_Reasoning: Given that <fact10>S and Z are connected at the same time</fact10> and the following considerations:

- If <fact5>S is turned on</fact5>, it may not necessarily impact T directly unless it's used to turn off T, but we also need to consider that it might be part of how the circuit operates.
- If <fact8>Y and Z are on together</fact8>, then <fact9>W must also be on</fact9>.
  
Given the third condition where <fact7>T and X cannot be on or off at the same time</fact7>, and knowing Z is on, the possible combination prevents T from being on. Therefore, <fact11>T is off</fact11>.

Now, consider options:

- (A) T is the on state and Y is the off state: T cannot be on because it contradicts the conditions with Z being on.
- (B) Both T and Y are off: With <fact10>S and Z being on</fact10>, T must be off due to the inability to turn it on simultaneously with Z being on and complying with other conditions.
- (C) Both W and T are on: T cannot be on when Z is on due to the Z→W dependency in the circuit logic.
- (D) X is the on state and Y is the off state: Given conditions (1) W on requires X to be on, and the dependency W→Y in part bypasses Y being needed to on.

Considering these factors, particularly the implications of the switches and compliance with conditions, the correct answer is that when S and Z are connected, T and Y both must be off.

Final_Answer: {B}"
145,"There are 7 heart disease patients E, F, G, H, I, J, K to be assigned to 4 doctors for treatment, they are Dr. Zhang, Dr. Li, Dr. Wang and Dr. Liu. Only one doctor is responsible for each patient, and each doctor is responsible for the treatment of up to two patients. Among the patients, J and K are children, and the remaining 5 are adults; E, F, and J are males, and the remaining 4 are females. The following conditions must be met? (1) Dr. Zhang is only responsible for treating male patients. (2) Dr. Li can only be responsible for the treatment of 1 patient. (3) If a doctor is responsible for treating a child patient, then he must be responsible for the treatment of an adult patient of the same sex as the child. Based on the above conditions, which of the following must be true?
(A) Doctor F is responsible for treatment. (B) J is treated by Dr. Zhang. (C) C is treated by Dr. Liu. (D) H is treated by Dr. Wang.","Reformatted_Question: There are 7 <fact1>heart disease patients</fact1> E, F, G, H, I, J, and K to be <fact2>assigned to 4 doctors</fact2> for treatment; they are Dr. Zhang, Dr. Li, Dr. Wang, and Dr. Liu. Only <fact3>one doctor is responsible for each patient</fact3>, and each doctor is responsible for treating <fact4>up to two patients</fact4>. Among the patients, <fact5>J and K are children</fact5>, and the remaining <fact6>5 are adults</fact6>; <fact7>E, F, and J are males</fact7>, and the remaining <fact8>4 are females</fact8>. The following conditions must be met: (1) <fact9>Dr. Zhang is only responsible for treating male patients</fact9>. (2) <fact10>Dr. Li can only be responsible for the treatment of 1 patient</fact10>. (3) If a doctor is responsible for treating a <fact5>child</fact5> patient, then he must be responsible for the treatment of an <fact11>adult patient of the same sex as the child</fact11>. Based on the above conditions, which of the following must be true?\n(A) Doctor F is responsible for treatment. (B) J is treated by Dr. Zhang. (C) C is treated by Dr. Liu. (D) H is treated by Dr. Wang.

Answer_Reasoning: 

- According to <fact9>condition (1)</fact9>, Dr. Zhang can only treat male patients. Hence, patients E, F, or J can be treated by Dr. Zhang.
- According to <fact10>condition (2)</fact10>, Dr. Li can only be responsible for the treatment of 1 patient.
- According to <fact11>condition (3)</fact11>, if a doctor treats a child, they must also treat an adult of the same sex. Therefore, if a doctor treats J (male child), they must also treat either E or F (male adults). Similarly, if a doctor treats K (female child), they must also treat G, H, or I (female adults).

Now, analyzing these conditions:

1. Since <fact5>J is a male child</fact5> and <fact9>Dr. Zhang only treats males</fact9>, Dr. Zhang can treat J. If he treats J, he must also treat either E or F (both adults and male). Hence, J must be treated by Dr. Zhang.
2. For Dr. Li, he has only one patient slot according to <fact10>condition (2)</fact10>, so he won't treat a child (as he'd need a second patient for that condition to be met).
3. Since <fact3>each doctor can only treat two patients</fact3>, and given these restrictions, it’s reasonable to deduce based on the constraints above.

Therefore, the fact that is certainly true from the available options given these conditions is:  
Final_Answer: {B}"
146,"There are 7 heart disease patients E, F, G, H, I, J, K to be assigned to 4 doctors for treatment, they are Dr. Zhang, Dr. Li, Dr. Wang and Dr. Liu. Only one doctor is responsible for each patient, and each doctor is responsible for the treatment of up to two patients. Among the patients, J and K are children, and the remaining 5 are adults; E, F, and J are males, and the remaining 4 are females. The following conditions must be met? (1) Dr. Zhang is only responsible for treating male patients. (2) Dr. Li can only be responsible for the treatment of 1 patient. (3) If a doctor is responsible for treating a child patient, then he must be responsible for the treatment of an adult patient of the same sex as the child. Each of the following patients can be treated by Dr. Li, except which one?
(A) E. (B) G. (C) I. (D) K.","Reformatted_Question: There are <fact1>7 heart disease patients E, F, G, H, I, J, K</fact1> to be assigned to <fact2>4 doctors for treatment</fact2>, they are <fact3>Dr. Zhang, Dr. Li, Dr. Wang and Dr. Liu</fact3>. <fact4>Only one doctor is responsible for each patient</fact4>, and <fact5>each doctor is responsible for the treatment of up to two patients</fact5>. Among the patients, <fact6>J and K are children</fact6>, and the <fact7>remaining 5 are adults</fact7>; <fact8>E, F, and J are males</fact8>, and the <fact9>remaining 4 are females</fact9>. The following conditions must be met: (1) <fact10>Dr. Zhang is only responsible for treating male patients</fact10>. (2) <fact11>Dr. Li can only be responsible for the treatment of 1 patient</fact11>. (3) If a doctor is responsible for treating a child patient, then he must be responsible for the treatment of an adult patient of the same sex as the child. Each of the following patients can be treated by Dr. Li, except which one?\n(A) <fact12>E</fact12>. (B) <fact13>G</fact13>. (C) <fact14>I</fact14>. (D) <fact15>K</fact15>.

Answer_Reasoning: According to the conditions provided, we have the following insights:  
1. <fact11>Dr. Li can only be responsible for the treatment of 1 patient</fact11>.  
2. <fact3>Dr. Zhang</fact3> is not an option for <fact15>K</fact15> because <fact10>Dr. Zhang only treats male patients</fact10>.
3. If <fact15>K</fact15> is treated by <fact3>Dr. Li</fact3>, <fact3>Dr. Li</fact3> must also treat a male adult, but <fact3>Dr. Li</fact3> can only treat one patient, violating the condition.
4. <fact12>E</fact12>, <fact13>G</fact13>, and <fact14>I</fact14> do not violate any conditions by being treated by <fact3>Dr. Li</fact3>, as they are all single individuals without required additional treatment conditions.

Therefore, <fact15>K</fact15> is the patient who cannot be treated by <fact3>Dr. Li</fact3>, because it does not fulfill the condition for <fact11>Dr. Li to only treat one patient</fact11> due to the additional requirement of treating an adult of the same sex if <fact15>K</fact15> were treated.

Final_Answer: {D}"
