id,question,answer
91,"Crimes involving the use of firearms are more likely to lead to murder than other types of crimes. However, most crimes involving the use of firearms did not result in homicides. Therefore, there is no need to distinguish the illegal use of firearms as a serious criminal offense in the criminal law from other criminal offenses. The logic loophole in the above argument is most similar to the following one?
(A) Obese people are more likely to suffer from heart disease than people with normal weight. However, obese people make up a very small percentage of our population. Therefore, in our country, there is no need for the medical and health community to emphasize the risk of heart disease. (B) Unchecked sex is more likely to be infected with AIDS than checkpoint. However, among people with unchecked sex, only a small percentage of people are infected with AIDS. Therefore, there is no need to emphasize the harm of unchecked sex in the propaganda of AIDS prevention. (C) The prevailing view is that smoking is more likely to cause lung cancer than not smoking. However, in some countries, the proportion of people with lung cancer who have a history of smoking is not higher than the proportion of the total population who have a history of smoking. Therefore, the above popular opinion is likely to be a prejudice. (D) High-income people are more capable of enjoying life than low-income people. But there are many high-income earners who claim to be unhappy. Therefore, those who pursue a happy life need not pay attention to the level of income.","Reformatted_Question: Crimes involving the <fact1>use of firearms are more likely</fact1> to lead to <fact2>murder</fact2> than <fact3>other types of crimes</fact3>. However, most crimes involving the <fact1>use of firearms did not result in homicides</fact1>. Therefore, there is <fact4>no need to distinguish the illegal use of firearms as a serious criminal offense</fact4> in the criminal law from other criminal offenses. The logic loophole in the above argument is most similar to the following one?\n(A) <fact5>Obese people are more likely to suffer from heart disease</fact5> than people with normal weight. However, obese people make up a <fact6>very small percentage of our population</fact6>. Therefore, in our country, there is <fact7>no need for the medical and health community to emphasize the risk of heart disease</fact7>. (B) <fact8>Unchecked sex is more likely to be infected with AIDS</fact8> than checked sex. However, among people with unchecked sex, only a <fact9>small percentage of people are infected with AIDS</fact9>. Therefore, there is <fact10>no need to emphasize the harm of unchecked sex</fact10> in the propaganda of AIDS prevention. (C) The prevailing view is that <fact11>smoking is more likely to cause lung cancer than not smoking</fact11>. However, in some countries, the <fact12>proportion of people with lung cancer who have a history of smoking is not higher than the proportion of the total population who have a history of smoking</fact12>. Therefore, the above popular opinion is likely to be a prejudice. (D) <fact13>High-income people are more capable of enjoying life</fact13> than low-income people. But there are <fact14>many high-income earners who claim to be unhappy</fact14>. Therefore, those who pursue a happy life <fact15>need not pay attention to the level of income</fact15>.

Answer_Reasoning: The original question involves an argument with a logical flaw where a lower occurrence (most crimes involving firearms not resulting in murder) is used to conclude that an overall distinction is unnecessary. This flaw is mirrored in argument B, which states that a small percentage of unchecked sex leads to AIDS infection, thereby suggesting that there’s no need to emphasize its dangers in AIDS prevention propaganda. Both arguments dismiss a significant factor or risk due to the lower probability or smaller percentage of occurrence.

Final_Answer: {B}"
92,"Zhang Shan received a higher bonus than Li Si. After learning that Wang Wu's bonus was higher than Miao Xiaoqin, Zhang Shan's bonus was also higher than Miao Xiaoqin. The following assumptions can make the above inference hold, except.
(A) Wang Wu's bonus is higher than Li Si's. (B) Li Si's bonus is higher than Miao Xiaoqin's. (C) Li Si's bonus is higher than Wang Wu's. (D) Li Si's bonus is as high as Wang Wu's.","Reformatted_Question: <fact1>Zhang Shan received a higher bonus than Li Si</fact1>. <fact2>Wang Wu's bonus was higher than Miao Xiaoqin's</fact2>. <fact3>Zhang Shan's bonus was also higher than Miao Xiaoqin</fact3>. The following assumptions can make the above inference hold, except.\n(A) <assumption1>Wang Wu's bonus is higher than Li Si's</assumption1>. (B) <assumption2>Li Si's bonus is higher than Miao Xiaoqin's</assumption2>. (C) <assumption3>Li Si's bonus is higher than Wang Wu's</assumption3>. (D) <assumption4>Li Si's bonus is as high as Wang Wu's</assumption4>.

Answer_Reasoning: From the premises, we know that:<br>
- <fact1>Zhang Shan's bonus > Li Si's bonus</fact1>.
- <fact2>Wang Wu’s bonus > Miao Xiaoqin’s bonus</fact2>.
- <fact3>Zhang Shan’s bonus > Miao Xiaoqin’s bonus</fact3>.

To find out which assumption cannot make the statement hold, let's examine each option:<br>
- (A) <assumption1>Wang Wu's bonus is higher than Li Si's</assumption1>: This does not affect Zhang Shan's bonus directly, but it is possible if Zhang Shan has a higher bonus than Li Si, and Wang Wu also has a higher bonus than Miao Xiaoqin.
- (B) <assumption2>Li Si's bonus is higher than Miao Xiaoqin's</assumption2>: This fits the conclusion as it maintains the hierarchy Zhang Shan > Li Si > Miao Xiaoqin.
- (C) <assumption3>Li Si's bonus is higher than Wang Wu's</assumption3>: In this case, the conclusion may not hold because Zhang Shan might still have a higher bonus than Miao Xiaoqin through Li Si.
- (D) <assumption4>Li Si's bonus is as high as Wang Wu's</assumption4>: If Li Si has a bonus as high as Wang Wu's, it's possible for Zhang Shan to have a higher bonus than both, which doesn't contradict the main conclusion.

The exception is therefore option (C), as Li Si being greater than Wang Wu could create a conflict in the hierarchy of bonuses and might disrupt the ordering needed to ensure Zhang Shan's bonus is higher than Miao Xiaoqin's. Thus, option (C) is the assumption that does not necessarily support the conclusion.

Final_Answer: {C}"
93,"A laboratory has three types of robots, A. B, and C. Type A can recognize colors, type B can recognize shapes, and type C can neither recognize colors nor shapes. The laboratory experimented with robots 1 and 2 with red balls, blue balls, red squares, and blue squares, and ordered them to pick up the red balls, but number 1 picked up the red squares, and number 2 picked up the blue balls. Based on the above experiment, which of the following must be true?
(A) Both No.1 and No.2 are type C. (B) Only one of No.1 and No.2 is C type. (C) No.1 is type A and No.2 is type B. (D) No.1 is not Type B and No.2 is not Type A.","Reformatted_Question: A <fact1>laboratory has three types of robots, A, B, and C</fact1>. <fact2>Type A can recognize colors</fact2>, <fact3>type B can recognize shapes</fact3>, and <fact4>type C can neither recognize colors nor shapes</fact4>. The laboratory <fact5>experimented with robots 1 and 2</fact5> with <fact6>red balls, blue balls, red squares, and blue squares</fact6>, and <fact7>ordered them to pick up the red balls</fact7>, but <fact8>number 1 picked up the red squares</fact8>, and <fact9>number 2 picked up the blue balls</fact9>. Based on the above experiment, which of the following must be true?\n(A) Both <fact10>No.1 and No.2 are type C</fact10>. (B) Only one of <fact11>No.1 and No.2 is C type</fact11>. (C) <fact12>No.1 is type A and No.2 is type B</fact12>. (D) <fact13>No.1 is not Type B</fact13> and <fact14>No.2 is not Type A</fact14>.

Answer_Reasoning: Based on the information provided:
- Robot 1 picked up red squares. This suggests that robot 1 can recognize color (since it picked up red items) but not shape (since it picked up squares instead of balls). This implies it cannot be type B and may be type A.
- Robot 2 picked up blue balls. This suggests that robot 2 can recognize shapes (since it picked up balls) but not color (since it picked up the wrong color). This implies it cannot be type A and may be type B.

Thus, based on the actions of the two robots:
- Robot 1 is not type B (can recognize colors but not shapes).
- Robot 2 is not type A (can recognize shapes but not colors).

Therefore, the most suitable conclusion based on these observations is that Robot 1 is not Type B and Robot 2 is not Type A, which corresponds to option D.

Final_Answer: {D}"
94,"Statistics show that in car accidents, the proportion of cars with airbags is higher than that of cars without airbags. Therefore, installing an airbag in a car does not make the car owner safer. Which of the following most appropriately points out the loophole of the above argument?
(A) Assume without explanation? Any car equipped with airbags may experience a car accident. (B) Ignore this possibility? Owners without airbags pay more attention to driving cautiously. (C) Improper assumption? In any car accident, the airbag will automatically open. (D) Improperly equate the possibility of a car accident with the seriousness of the car owner ’s injury in the accident.","Reformatted_Question: Statistics show that in <fact1>car accidents</fact1>, the <fact2>proportion of cars with airbags</fact2> is <fact3>higher than that of cars without airbags</fact3>. Therefore, <fact4>installing an airbag in a car does not make the car owner safer</fact4>. Which of the following most appropriately points out the loophole of the above argument?\n(A) <fact5>Assume without explanation?</fact5> Any car equipped with airbags may experience a car accident. (B) <fact6>Ignore this possibility?</fact6> Owners without airbags pay more attention to driving cautiously. (C) <fact7>Improper assumption?</fact7> In any car accident, the airbag will automatically open. (D) <fact8>Improperly equate the possibility of a car accident</fact8> with the seriousness of the car owner’s injury in the accident.

Answer_Reasoning: The argument presented is that airbags do not increase safety because cars involved in accidents often have them. However, the conclusion fails to consider that airbags are intended to reduce injury severity rather than prevent accidents. This oversight forms a crucial error, since equating a car's likelihood of having an airbag with its owner's safety during an accident is misleading. Option D, which relates the <fact8>improper equation of accident likelihood to injury severity</fact8>, correctly highlights this flaw, noting the argument disregards how airbags mitigate injury rather than accident frequency.

Final_Answer: {D}"
95,"Some good goods are not cheap. Therefore, not all good goods are good goods. "". An analogy with which of the following inferences shows that the above inferences are not true?
(A) People in Hunan don't like chili. Therefore, some people who love chili are not Hunanese. (B) Some people are not selfish. Therefore, people are not all selfish. (C) A good motivation does not necessarily have a good effect. Therefore, good effects do not necessarily result from good motivation. (D) Some southerners are not Cantonese. Therefore, not all Cantonese are Southerners.","Reformatted_Question: Some <fact1>good goods</fact1> are <fact2>not cheap</fact2>. Therefore, <fact3>not all good goods</fact3> are <fact1>good goods</fact1>. An analogy with which of the following inferences shows that the above inferences are not true?\n(A) <fact4>People in Hunan</fact4> don't like <fact5>chili</fact5>. Therefore, <fact6>some people who love chili</fact6> are not <fact4>Hunanese</fact4>. (B) <fact7>Some people are not selfish</fact7>. Therefore, <fact8>people are not all selfish</fact8>. (C) A <fact9>good motivation</fact9> does not necessarily have a <fact10>good effect</fact10>. Therefore, <fact11>good effects</fact11> don't necessarily result from <fact9>good motivation</fact9>. (D) Some <fact12>southerners</fact12> are not <fact13>Cantonese</fact13>. Therefore, <fact14>not all Cantonese</fact14> are <fact12>Southerners</fact12>.

Answer_Reasoning: The original statement says that because some good goods are not cheap, it can be concluded that not all good goods are good (which seems to contain a logical error because it uses the term ""good goods"" twice but implies a contrast between two different concepts).

The analogous inference must show a similar structure or logical flaw. Option B (""Some people are not selfish. Therefore, people are not all selfish."") correctly matches this structure. It suggests a logical conclusion based on a valid inference: if some people are not selfish, then not all people can possibly be selfish. This is a logical truth and highlights that the original inference may be incorrectly using its premise to reach a conclusion that doesn't quite follow.

Final_Answer: {B}"
96,"A school classifies students' academic performance into four grades of excellent, good, middle and poor by grade level. In a school year, the top 10% of the total score of each exam is excellent; the latter 30% is poor, and the rest are good and medium. In the previous school year, more students with excellent grades in the second grade were more than those with excellent grades in the first grade. If the above determination is true, which of the following must be true?
(A) Students with poor grades in the second grade are less than those with poor grades in the first grade. (B) There are more students with poor grades in the second grade than those with poor grades in the first grade. (C) There are more students with good grades in the second grade than those with good grades in the first grade. (D) The students with good grades in the second grade are less than those with good grades in the first grade.","Reformatted_Question: A school <fact1>classifies students' academic performance into four grades</fact1>: <fact2>excellent, good, middle, and poor</fact2> by grade level. In a <fact3>school year</fact3>, the <fact4>top 10% of the total score</fact4> of each exam is <fact5>excellent</fact5>; the latter <fact6>30% is poor</fact6>, and the rest are <fact7>good and medium</fact7>. In the <fact8>previous school year</fact8>, <fact9>more students with excellent grades were in the second grade</fact9> than those <fact10>with excellent grades in the first grade</fact10>. If the above determination is true, which of the following must be true?\n(A) Students with <fact11>poor grades in the second grade</fact11> are less than those with poor grades in the first grade. (B) There are more <fact12>students with poor grades in the second grade</fact12> than those with poor grades in the first grade. (C) There are more <fact13>students with good grades in the second grade</fact13> than those <fact14>with good grades in the first grade</fact14>. (D) The students with <fact15>good grades in the second grade</fact15> are less than those with good grades in the first grade.

Answer_Reasoning: Since <fact9>more students with excellent grades were in the second grade</fact9> than in the first grade, and the top 10% of students are classified as <fact5>excellent</fact5>, it follows that there are more students in the second grade compared to the first grade. Given that the percentage of students classified as <fact5>excellent</fact5> or <fact6>poor</fact6> is standardized across both grades, the larger number of excellent students would require a correspondingly larger student body in the second grade. This increase affects the distribution of the other performance categories (<fact7>good and medium</fact7>, <fact6>poor</fact6>). Since there is no change in the thresholds (10% for excellent, 30% for poor), and more students are in the ""excellent"" category in second grade, there might not necessarily be a decrease in the ""poor"" category. The remaining students, therefore, must adjust into the ""good"" category such that the proportions are consistent. Therefore, there are more <fact13>students with good grades in the second grade</fact13> than <fact14>those with good grades in the first grade</fact14>. This would make answer (C) true. 

Final_Answer: {C}"
97,"There are 90 patients, all suffering from refractory disease T, who have taken the same conventional drugs. These patients were divided into two groups of equal numbers. The first group took W, an experimental drug used to treat T, and the second group took placebo without W. Statistics after 10 years show that 44 deaths occurred in both groups. Therefore, this test drug is ineffective. Which of the following, if true, would most weaken the above argument?
(A) Among the patients who died above, the average year of death of the second group was two years earlier than the first group. (B) Among the patients who died, the average life span of the second group was two years shorter than that of the first group. (C) Among the above living patients, the second group is more severely ill than the first group. (D) Among the above living patients, the second group is older than the first group.","Reformatted_Question: There are <fact1>90 patients</fact1>, all <fact2>suffering from refractory disease T</fact2>, who have taken the <fact3>same conventional drugs</fact3>. These <fact4>patients were divided into two groups of equal numbers</fact4>. The <fact5>first group took W</fact5>, an <fact6>experimental drug used to treat T</fact6>, and the <fact7>second group took placebo without W</fact7>. <fact8>Statistics after 10 years</fact8> show that <fact9>44 deaths occurred in both groups</fact9>. Therefore, this <fact10>test drug is considered ineffective</fact10>. Which of the following, if true, would most weaken the above argument?\n(A) Among the <fact11>patients who died</fact11>, the <fact12>average year of death of the second group was two years earlier than the first group</fact12>. (B) Among the <fact11>patients who died</fact11>, the <fact13>average life span of the second group was two years shorter than that of the first group</fact13>. (C) Among the <fact14>above living patients</fact14>, the <fact15>second group is more severely ill than the first group</fact15>. (D) Among the <fact14>above living patients</fact14>, the <fact16>second group is older than the first group</fact16>.

Answer_Reasoning: The argument states that the test drug W is ineffective because the number of deaths in both groups is the same. To weaken this argument, we need to find evidence that the drug W had a positive effect that is not reflected simply by the number of deaths. Options (A) and (B) both suggest differences in the timing or lifespan of patients who died, which implies that those differences could be due to the effect of W. Option (A) suggests that in the second group, deaths occurred earlier, which might indicate that those not taking W died sooner, possibly showing W had some benefit. Option (B) supports the same conclusion: if the lifespan of those not taking W was shorter, it suggests that W may have prolonged life, even if deaths still occurred. Therefore, option (B) would most weaken the argument by suggesting that W might help prolong the lives of patients taking it, thus indicating the drug may have some efficacy not shown by the final death counts alone.

Final_Answer: {B}"
98,"Kobayashi was refused to enter the deep pool because he did not wear a swimming cap. Kobayashi showed the deep water certificate? According to regulations, I can enter the deep pool. The regulations of the swimming pool are? those who do not wear swimming caps are not allowed to enter the swimming pool; only those with a deep water certificate can enter the deep pool. Kobayashi is most likely to understand the rules of swimming as?
(A) You cannot enter the deep pool unless you have a deep water certificate. (B) Only those who hold a deep water certificate need not wear a swimming cap. (C) If you have a deep water certificate, you can enter the deep pool. (D) Those who are allowed to enter the swimming pool may not be allowed to enter the deep pool.","Reformatted_Question: <fact1>Kobayashi was refused to enter the deep pool</fact1> because <fact2>he did not wear a swimming cap</fact2>. <fact3>Kobayashi showed the deep water certificate</fact3>? According to regulations, <fact4>I can enter the deep pool</fact4>. The <fact5>regulations of the swimming pool</fact5> are: <regulation1>those who do not wear swimming caps are not allowed to enter the swimming pool</regulation1>; <regulation2>only those with a deep water certificate can enter the deep pool</regulation2>. Kobayashi is most likely to understand the rules of swimming as?  
(A) <interpretation1>You cannot enter the deep pool unless you have a deep water certificate</interpretation1>.  
(B) <interpretation2>Only those who hold a deep water certificate need not wear a swimming cap</interpretation2>.  
(C) <interpretation3>If you have a deep water certificate, you can enter the deep pool</interpretation3>.  
(D) <interpretation4>Those who are allowed to enter the swimming pool may not be allowed to enter the deep pool</interpretation4>.

Answer_Reasoning: Based on the swimming pool's regulations, there are two key rules: first, <regulation1>those who do not wear swimming caps are not allowed to enter the swimming pool</regulation1>, and second, <regulation2>only those with a deep water certificate can enter the deep pool</regulation2>. Kobayashi was refused entrance to the deep pool because <fact2>he did not wear a swimming cap</fact2>, even though <fact3>he showed the deep water certificate</fact3>. This suggests that wearing a swimming cap is a prerequisite for entering any part of the swimming pool, including the deep pool. Hence, the correct interpretation that aligns with Kobayashi's situation and the regulations is <interpretation4>those who are allowed to enter the swimming pool may not be allowed to enter the deep pool</interpretation4>. Even with a certificate, failure to adhere to the swimming cap rule restricts pool access.

Final_Answer: {D}"
99,"The number of crocodiles in the North Atlantic Ocean has declined sharply, but the number of seals has increased significantly at almost the same time. Some people say that it is the seal that caused the reduction of crocodiles. This argument is difficult to establish because seals rarely feed on crocodiles. Which of the following, if true, would most weaken the above argument?
(A) Seawater pollution causes more damage to crocodiles than seals. (B) Despite the sharp decrease in the number of crocodiles and the increase in the number of seals, there are still fewer seals in the North Atlantic Ocean than crocodiles. (C) Before the number of seals increased, the number of crocodiles in the North Atlantic Ocean decreased. (D) Crocodiles only eat capelin, and capelin is also the main food for seals.","Reformatted_Question: The number of <fact1>crocodiles in the North Atlantic Ocean</fact1> has <fact2>declined sharply</fact2>, but the number of <fact3>seals has increased significantly</fact3> at almost the same time. Some people say that it is the <fact3>seal that caused the reduction of crocodiles</fact3>. This argument is difficult to establish because <fact4>seals rarely feed on crocodiles</fact4>. Which of the following, if true, would most weaken the above argument?
(A) <fact5>Seawater pollution causes more damage to crocodiles than seals</fact5>. 
(B) Despite the <fact2>sharp decrease in the number of crocodiles</fact2> and the <fact3>increase in the number of seals</fact3>, there are still <fact6>fewer seals in the North Atlantic Ocean than crocodiles</fact6>. 
(C) Before the <fact3>number of seals increased</fact3>, the <fact2>number of crocodiles in the North Atlantic Ocean decreased</fact2>. 
(D) <fact1>Crocodiles only eat capelin</fact1>, and <fact7>capelin is also the main food for seals</fact7>.

Answer_Reasoning: To weaken the argument that seals caused the reduction of crocodiles because seals rarely feed on crocodiles, we need to identify an alternate connection between the seals and the crocodile population decline outside of direct predation. Option D provides such a connection by introducing a competition for food. If both crocodiles and seals rely on capelin as their main food source, the increase in the seal population could lead to a shortage of capelin for crocodiles, indirectly causing the decline in crocodile numbers without requiring seals to feed on them directly. This scenario would weaken the original argument by providing an alternate explanation for the decline in crocodile numbers that is linked to the increase in seals.

Final_Answer: {D}"
