id,question,answer
46,"A certain online forum made a statistical comparison of posts about social issues published by netizens in the past year and 5 years ago, and found that posts such as money-gathering, poverty alleviation, and bravery have increased such posts by 50%. Posts related to evildoing, escaping evil, and killing more people have increased by 90%. This shows that the social atmosphere is rapidly deteriorating. Which of the following, if true, would weaken the above argument most?
(A) ""Good things don't go out, bad things spread thousands of miles. "" Throughout the ages. (B) The number of Internet users has quadrupled in the past 5 years. (C) In recent years, some people have used rumors online to achieve profit-making purposes. (D) The online forum is a legal forum.","Reformatted_Question: A certain <fact1>online forum</fact1> made a <fact2>statistical comparison of posts</fact2> about <fact3>social issues</fact3> published by <fact4>netizens in the past year and 5 years ago</fact4>, and found that posts such as <fact5>money-gathering, poverty alleviation, and bravery</fact5> have <fact6>increased by 50%</fact6>. Posts related to <fact7>evildoing, escaping evil, and killing more people</fact7> have <fact8>increased by 90%</fact8>. This shows that the <fact9>social atmosphere</fact9> is <fact10>rapidly deteriorating</fact10>. Which of the following, if true, would weaken the above argument most? (A) ""<fact11>Good things don't go out, bad things spread thousands of miles</fact11>. "" Throughout the ages. (B) The <fact12>number of Internet users has quadrupled</fact12> in the past 5 years. (C) In recent years, some people have used <fact13>rumors online to achieve profit-making purposes</fact13>. (D) The <fact1>online forum</fact1> is a <fact14>legal forum</fact14>.

Answer_Reasoning: The argument assumes that the increase in posts concerning negative social issues (fact7) reflects a rapid deterioration of the social atmosphere (fact10). However, if the number of users posting on the forum has significantly increased (fact12) over the last 5 years, then the growth in posts can be attributed to more overall activity rather than a change in social conditions or atmosphere. Thus, the percentage increase in posts related to negative issues could be a reflection of a larger user base rather than an actual deterioration of social atmosphere. Therefore, option B provides context that can explain the increase without implying a negatively changing social atmosphere, thus weakening the argument.

Final_Answer: {B}"
47,"On November 17, 2012, the ""Tianhe No.1"" supercomputer developed by the National University of Defense Technology became the world's fastest computing speed with a peak speed of 4700 trillion times and a continuous speed of 2568 trillion floating-point operations per second Computer. Less than three years later, at the 2013 International Supercomputer Conference in Leipzig, Germany on June 17, 2013, the international TOP500 organization announced the latest list of the world's top 500 supercomputers. The ""Tianhe 2"" developed by the National University of Defense Technology topped the list with its peak calculation speed of 549 million times per second and continuous calculation speed of 339 million times per second. Compared to the US ""Titanium"" supercomputer, which ranked first in the world, the calculation speed is twice that of the latter. Which of the following is most suitable as a corollary of the above discussion.
(A) Only the United States and China can make supercomputers in the world. (B) Only China National Defense University has successfully developed a supercomputer. (C) Only the supercomputers in the United States and China have been ranked first in the world in terms of computing speed. (D) China's ""Tianhe 2"" computing speed is clearly ahead of other supercomputers.","Reformatted_Question: On <fact1>November 17, 2012</fact1>, the <fact2>""Tianhe No.1"" supercomputer</fact2> developed by the <fact3>National University of Defense Technology</fact3> became the <fact4>world's fastest computing speed</fact4> with a <fact5>peak speed of 4700 trillion times</fact5> and a <fact6>continuous speed of 2568 trillion floating-point operations per second</fact6>. Less than <fact7>three years later</fact7>, at the <fact8>2013 International Supercomputer Conference in Leipzig, Germany on June 17, 2013</fact8>, the <fact9>international TOP500 organization</fact9> announced the latest list of the world's top 500 supercomputers. The <fact10>""Tianhe 2"" developed by the National University of Defense Technology</fact10> topped the list with its <fact11>peak calculation speed of 549 million times per second</fact11> and <fact12>continuous calculation speed of 339 million times per second</fact12>. Compared to the <fact13>US ""Titanium"" supercomputer</fact13>, which <fact14>ranked first in the world</fact14>, the calculation speed is <fact15>twice that of the latter</fact15>. Which of the following is most suitable as a corollary of the above discussion?\n(A) Only the <fact16>United States and China can make supercomputers in the world</fact16>. (B) Only <fact3>China National Defense University</fact3> has successfully developed a supercomputer. (C) Only the <fact16>supercomputers in the United States and China</fact16> have been ranked first in the world in terms of computing speed. (D) China's <fact10>""Tianhe 2""</fact10> computing speed is <fact17>clearly ahead of other supercomputers</fact17>.

Answer_Reasoning: According to the information, the <fact10>""Tianhe 2""</fact10> supercomputer developed by the <fact3>National University of Defense Technology</fact3> outperformed the <fact13>US ""Titanium"" supercomputer</fact13> by having <fact15>twice the calculation speed</fact15>. This indicates that <fact17>China's ""Tianhe 2"" computing speed is clearly ahead of other supercomputers</fact17> that were mentioned, making statement D a valid corollary based on the information provided. Options A and C make broader claims involving only the US and China's supercomputers, which is not directly supported by the details given, and option B incorrectly implies exclusivity in supercomputer development by the National University of Defense Technology.

Final_Answer: {D}"
48,"With the help of animal fossils and DNA retained in specimens, and using increasingly advanced cloning and genetic techniques, humans have been able to ""resurrect"" some already extinct animals, such as mammoths, dodos, dinosaurs, etc. At the same time, the scientific community also started a big discussion about whether humans should revive extinct animals. Supporters believe that reanimated animals are expected to restore the damaged ecological environment in some areas. For example, Mammoths live on the vast grasslands of Siberia, and their excrement is an excellent fertilizer to nourish the grasslands. After the mammoth became extinct, grasslands lacking fertilizer were gradually replaced by tundra. If the mammoth can be resurrected and returned to Siberia, it will help reduce the area of ​​tundra and gradually restore the grassland ecosystem. Which of the following, if true, would best refute the arguments of the above supporters?
(A) If you invest a lot of time, energy and cost to resurrect the disappeared creatures, it will inevitably contain and weaken the protection of existing endangered animals, and the result will not be worth the loss. (B) Merely cloning an individual of an extinct animal does not mean that humans have the ability to resurrect the entire population. (C) Even if the extinct animals can be resurrected in batches, the habitat suitable for their growth may have long since disappeared. If you can not give heavy organisms a suitable environment for survival, all efforts will be in vain. (D) The vast majority of these animals gradually disappeared in the course of human development. It was human activities that led to their extinction.","Reformatted_Question: With the help of <fact1>animal fossils and DNA retained in specimens</fact1>, and using <fact2>increasingly advanced cloning and genetic techniques</fact2>, <fact3>humans have been able to ""resurrect"" some already extinct animals</fact3>, such as <fact4>mammoths, dodos, dinosaurs, etc.</fact4> At the same time, the <fact5>scientific community also started a big discussion about whether humans should revive extinct animals</fact5>. Supporters believe that <fact6>reanimated animals are expected to restore the damaged ecological environment in some areas</fact6>. For example, <fact7>Mammoths live on the vast grasslands of Siberia</fact7>, and their <fact8>excrement is an excellent fertilizer to nourish the grasslands</fact8>. After the <fact9>mammoth became extinct</fact9>, <fact10>grasslands lacking fertilizer were gradually replaced by tundra</fact10>. If the <fact11>mammoth can be resurrected and returned to Siberia</fact11>, it will <fact6>help reduce the area of ​​tundra and gradually restore the grassland ecosystem</fact6>. Which of the following, if true, would best refute the arguments of the above supporters?\n(A) If you <fact12>invest a lot of time, energy and cost to resurrect the disappeared creatures</fact12>, it will <fact13>inevitably contain and weaken the protection of existing endangered animals</fact13>, and the result <fact14>will not be worth the loss</fact14>. (B) <fact15>Merely cloning an individual of an extinct animal</fact15> does not mean that humans have the ability to <fact16>resurrect the entire population</fact16>. (C) Even if the <fact17>extinct animals can be resurrected in batches</fact17>, the <fact18>habitat suitable for their growth may have long since disappeared</fact18>. If you <fact19>can not give heavy organisms a suitable environment for survival</fact19>, all efforts will be in vain. (D) The <fact20>vast majority of these animals gradually disappeared in the course of human development</fact20>. It was <fact21>human activities that led to their extinction</fact21>.

Answer_Reasoning: The supporters' argument is that resurrecting extinct animals, like the mammoth, will help restore the ecological environment, such as the Siberian grasslands. To refute this argument, an optimal counterpoint would address the viability and sustainability of such reintroduction efforts. Option C presents a strong counter-argument, highlighting the potential disappearance of suitable habitats for the resurrected species. This negates the supporters' claim that bringing back species like the mammoth would automatically aid in ecological restoration. Without suitable environments, the effort of reintroduction can fail, rendering the supporters' argument ineffective.

Final_Answer: {C}"
49,"Many pregnant women have symptoms of vitamin deficiency, but this is usually not due to the lack of vitamins in the diet of pregnant women, but because of the growth of babies in the abdomen, they have a higher demand for vitamins than others. Which of the following is most important for evaluating the above conclusion?
(A) Test the daily diet of some pregnant women who do not lack vitamins to determine the vitamin content. (B) Test pregnant women and other women who have enough vitamins in their daily diet to determine whether they lack vitamins. (C) Test pregnant women and other women with insufficient vitamins in their daily diet and determine whether they are deficient in vitamins. (D) Test the daily diet of some pregnant women who lack vitamins to determine the content of vitamins.","Reformatted_Question: Many pregnant women have <fact1>symptoms of vitamin deficiency</fact1>, but this is usually not due to the lack of <fact2>vitamins in the diet of pregnant women</fact2>, but because of the <fact3>higher demand for vitamins</fact3> by the babies growing in the abdomen. Which of the following is most important for evaluating the above conclusion?\n(A) Test the <fact4>daily diet of some pregnant women who do not lack vitamins</fact4> to determine the vitamin content. (B) Test <fact5>pregnant women and other women who have enough vitamins in their daily diet</fact5> to determine whether they lack vitamins. (C) Test <fact6>pregnant women and other women with insufficient vitamins in their daily diet</fact6> and determine whether they are deficient in vitamins. (D) Test the <fact7>daily diet of some pregnant women who lack vitamins</fact7> to determine the content of vitamins.

Answer_Reasoning: The conclusion states that the symptoms of vitamin deficiency in pregnant women are due to a higher demand for vitamins, not necessarily a lack of vitamins in the diet. Therefore, to evaluate this conclusion, it is important to compare pregnant women and other women who have sufficient vitamins in their diets to see if pregnant women still show signs of deficiency despite having adequate intake. This would help determine if the higher demand due to pregnancy is the reason for deficiency symptoms. Thus, option B, testing fact5 ""pregnant women and other women who have enough vitamins in their daily diet"" to determine whether they lack vitamins, provides the most relevant evaluation.

Final_Answer: {B}"
50,"The education system has two aspects, one is compulsory education and the other is higher education. A reasonable education system requires everyone to have the right to compulsory education and to have access to higher education through fair competition. Which of the following conclusions can be drawn from the above conclusions?
(A) An education system that does not allow everyone to go to college is unreasonable. (B) An education system that guarantees everyone to enjoy compulsory education is reasonable. (C) An education system that does not allow everyone to enjoy the right to compulsory education is unreasonable. (D) There should be more requirements for a reasonable education system.","Reformatted_Question: The <aspect1>education system</aspect1> has two aspects: <aspect2>compulsory education</aspect2> and <aspect3>higher education</aspect3>. A <quality1>reasonable education system</quality1> requires <requirement1>everyone to have the right to compulsory education</requirement1> and <requirement2>access to higher education through fair competition</requirement2>. Which of the following conclusions can be drawn from the above conclusions?\n(A) An <aspect1>education system</aspect1> that does not <requirement2>allow everyone to go to college through fair competition</requirement2> is unreasonable. (B) An <aspect1>education system</aspect1> that <requirement1>guarantees everyone to enjoy compulsory education</requirement1> is reasonable. (C) An <aspect1>education system</aspect1> that does not <requirement1>allow everyone to enjoy the right to compulsory education</requirement1> is unreasonable. (D) There should be <quality1>more requirements for a reasonable education system</quality1>.

Answer_Reasoning: Based on the premise, a <quality1>reasonable education system</quality1> should ensure that <requirement1>everyone has the right to compulsory education</requirement1>. Therefore, if an <aspect1>education system</aspect1> does not provide this right (i.e., <requirement1>allowing everyone to enjoy compulsory education</requirement1>), it would be deemed unreasonable. Option C directly reflects this requirement by stating that an <aspect1>education system</aspect1> that does not <requirement1>allow everyone to enjoy the right to compulsory education</requirement1> is unreasonable.

Final_Answer: {C}"
51,"A survey of traffic accidents has found that the incidence of traffic accidents is actually similar in cities where drunk driving is strictly investigated and those who do not. However, most experts believe that strict investigation of drunk driving can indeed reduce the occurrence of traffic accidents. Which of the following is most helpful in eliminating this inconsistency?
(A) Severe investigations of drunk driving have occurred in urban traffic accidents. (B) The city that implements strict investigation of drunk driving has not eliminated drunk driving. (C) It is more important to improve drivers' traffic safety awareness than strict management. (D) In addition to strict investigation of drunk driving, other traffic violations should also be stopped.","Reformatted_Question: A <fact1>survey of traffic accidents</fact1> has found that the <fact2>incidence of traffic accidents is actually similar</fact2> in <fact3>cities where drunk driving is strictly investigated</fact3> and <fact4>those who do not</fact4>. However, <fact5>most experts believe</fact5> that <fact6>strict investigation of drunk driving can indeed reduce the occurrence of traffic accidents</fact6>. Which of the following is most helpful in eliminating this inconsistency?\n(A) <fact7>Severe investigations of drunk driving have occurred</fact7> in urban traffic accidents. (B) The city that <fact8>implements strict investigation of drunk driving</fact8> has not eliminated drunk driving. (C) It is more important to <fact9>improve drivers' traffic safety awareness</fact9> than strict management. (D) In addition to <fact6>strict investigation of drunk driving</fact6>, <fact10>other traffic violations should also be stopped</fact10>.

Answer_Reasoning: The key inconsistency pointed out in the question relates to why the incidence of traffic accidents does not differ significantly between cities enforcing strict investigations on drunk driving and those that do not, despite experts believing that strict investigation reduces accidents. 

Option B directly addresses the inconsistency: If a city still has a high rate of drunk driving despite strict investigations, it suggests that the enforcement either isn't effective or isn't strong enough to deter the behavior fully. Therefore, the fact that the investigation has not successfully eliminated drunk driving could explain why traffic accident rates have not decreased as expected.

Final_Answer: {B}"
52,"On the eve of the Minsk talks of the Ukrainian authorities ’coordination group, the speakers of“ Donetsk People ’s Republic ”and“ Lugansk People ’s Republic ”announced their negotiating positions? if the Ukrainian authorities do not recognize their territories and the special status of Russian, And without stopping its military operations in the southeast, the conflict cannot be resolved. In addition, the two “Republics” insisted on pardoning all militia armed participants and political prisoners. Some Ukrainian observers commented? Do we recognize the special status of these two so-called ""Republics"" and can we resolve the conflict by pardoning the militia? The comments of Ukrainian observers are best used to refute which of the following?
(A) Even if the Ukrainian authorities recognize the special status of the two ""Republic"" territories and Russian language, and pardon all militia armed participants and political prisoners, the conflict may still not be resolved. (B) Even if the conflict is resolved, it is not necessarily because the Ukrainian authorities recognize the ""Republic"" territory and the special status of Russian. (C) If the conflict is to be resolved, the Ukrainian authorities must recognize the special status of the two ""Republic"" territories and the Russian language, and pardon all militia armed participants and political prisoners. (D) As long as the Ukrainian authorities recognize the special status of the two ""Republic"" territories and the Russian language, and pardon all militia armed participants and political prisoners, the conflict can be resolved.","Reformatted_Question: On the eve of the <fact1>Minsk talks of the Ukrainian authorities’ coordination group</fact1>, the <fact2>speakers of “Donetsk People’s Republic” and “Lugansk People’s Republic” announced their negotiating positions</fact2>: if the <fact3>Ukrainian authorities do not recognize their territories and the special status of Russian</fact3>, and <fact4>without stopping its military operations in the southeast</fact4>, <fact5>the conflict cannot be resolved</fact5>. In addition, the <fact2>two “Republics” insisted on pardoning all militia armed participants and political prisoners</fact2>. Some <fact6>Ukrainian observers commented</fact6>: Do we recognize the special status of these two so-called ""Republics"" and can we resolve the conflict by pardoning the militia? The comments of Ukrainian observers are best used to refute which of the following? (A) Even if the <fact3>Ukrainian authorities recognize the special status of the two ""Republic"" territories and Russian language</fact3>, and <fact2>pardon all militia armed participants and political prisoners</fact2>, <fact5>the conflict may still not be resolved</fact5>. (B) Even if the <fact5>conflict is resolved</fact5>, it is not necessarily because the <fact3>Ukrainian authorities recognize the ""Republic"" territory and the special status of Russian</fact3>. (C) If the <fact5>conflict is to be resolved</fact5>, the <fact3>Ukrainian authorities must recognize the special status of the two ""Republic"" territories and the Russian language</fact3>, and <fact2>pardon all militia armed participants and political prisoners</fact2>. (D) As long as the <fact3>Ukrainian authorities recognize the special status of the two ""Republic"" territories and the Russian language</fact3>, and <fact2>pardon all militia armed participants and political prisoners</fact2>, <fact5>the conflict can be resolved</fact5>.

Answer_Reasoning: The comments from the Ukrainian observers question whether recognizing the special status and pardoning militia would resolve the conflict, implying that these conditions alone are insufficient for peace. Therefore, these comments directly refute the idea that these actions guarantee conflict resolution. Fact5 suggests that these actions are necessary for conflict resolution, but not necessarily sufficient, thus refuting D which states that these actions can guarantee resolution of the conflict.

Final_Answer: {D}"
53,"With the rapid development of the Internet, it has become a reality to buy your favorite products without leaving home. Even in countries and regions with low economic development levels, people can satisfy their pursuit of material life through online shopping. Which of the following can most question the above view?
(A) As online shopping sales increase, related taxes and fees will also increase. (B) Even in the era when there is no Internet, people can still buy their favorite products through physical stores. (C) The display of goods on the Internet cannot fully reflect the real situation. (D) People's satisfaction with the pursuit of material life depends only on the level of economic development in the region.","Reformatted_Question: With the <fact1>rapid development of the Internet</fact1>, it has <fact2>become a reality to buy your favorite products without leaving home</fact2>. Even in <fact3>countries and regions with low economic development levels</fact3>, <fact4>people can satisfy their pursuit of material life through online shopping</fact4>. Which of the following can most question the above view?\n(A) As <fact5>online shopping sales increase</fact5>, <fact6>related taxes and fees will also increase</fact6>. (B) Even in the era when there was no Internet, <fact7>people can still buy their favorite products through physical stores</fact7>. (C) The <fact8>display of goods on the Internet</fact8> <fact9>cannot fully reflect the real situation</fact9>. (D) <fact10>People's satisfaction</fact10> with the pursuit of material life <fact11>depends only on the level of economic development in the region</fact11>.

Answer_Reasoning: To question the view that online shopping satisfies people's pursuit of material life even in regions with low economic development levels, we need a statement that directly challenges the effectiveness or the reality of this satisfaction. Option A, which mentions increased taxes and fees, doesn't directly challenge online shopping's ability to fulfill material desires. Option B states that people could still purchase products before the Internet, which also doesn't counter the notion of achieving satisfaction through online shopping. Option C addresses the potential shortcomings of online shopping, suggesting that the display of goods on the Internet may not accurately represent the real situation, thereby questioning if online shopping truly satisfies people's material needs. Option D directly contradicts the assertion by suggesting satisfaction depends solely on economic development, challenging the claim that online shopping can fulfill desires in less developed regions. Therefore, options C and D could potentially question the view, but C directly targets the mechanism (i.e., online display) affecting satisfaction, making it the best choice.

Final_Answer: {C}"
