id,question,answer
0,"In the planning of a new district in a township, it was decided to build a special community in the southeast, northwest, centered on the citizen park. These four communities are designated as cultural area, leisure area, commercial area and administrative service area. It is known that the administrative service area is southwest of the cultural area, and the cultural area is southeast of the leisure area. Based on the above statement, which of the following can be derived?
(A) Civic Park is north of the administrative service area. (B) The leisure area is southwest of the cultural area. (C) The cultural district is in the northeast of the business district. (D) The business district is southeast of the leisure area.","Reformatted_Question: In the <fact1>planning of a new district</fact1> in a <fact2>township</fact2>, <fact3>it was decided to build a special community in the southeast, northwest, centered on the citizen park</fact3>. These <fact4>four communities</fact4> are designated as <fact5>cultural area, leisure area, commercial area and administrative service area</fact5>. It is known that the <fact6>administrative service area is southwest of the cultural area</fact6>, and the <fact7>cultural area is southeast of the leisure area</fact7>. Based on the above statement, which of the following can be derived?\n(A) Civic Park is north of the administrative service area. (B) The leisure area is southwest of the cultural area. (C) The cultural district is in the northeast of the business district. (D) The business district is southeast of the leisure area.

Answer_Reasoning: We know from the information given that the following relationships exist among the areas:
- The <fact6>administrative service area is southwest of the cultural area</fact6>, which implies that if we move southeast from the administrative area, we will reach the cultural area.
- The <fact7>cultural area is southeast of the leisure area</fact7>, which means going northwest from the cultural area would take us to the leisure area.

Based on the directions provided, if the cultural area is southeast of the leisure area, it means that the leisure area must be northwest of the cultural area. This confirms that choice B is incorrect, as B states the opposite direction.

Considering option A, none of the information about the positions relative to the Civic Park is given, thus we cannot determine its position.

Option C states that the cultural area is northeast of the business district without any concrete information on the business district's position in relation to the cultural area, so this cannot be derived directly.

However, from the relationships: leisure area (northwest), cultural area (center), and administrative area (southwest), you can derive option D, since any area directly northwest of the cultural area and in turn southeast of the leisure area, would be where the business district must logically be located, establishing a sequence of positions centered on the cultural area.

Therefore, statement D is consistent with the information provided.

Final_Answer: {D}"
1,"The company sent three young staff members to the South for business trip. The three of them happened to be sitting in a row. At least one of the two people sitting on the right side of 24 years old was 20 years old.20 years old. At least one of the two people sitting on the left of the accountant is a salesperson, and one of the two people sitting on the right of the salesperson is also a salesperson. So what are the three young people on business?
(A) 0-year-old accountant, 20-year-old salesperson, 24-year-old salesperson. (B) 0-year-old accountant, 24-year-old salesperson, 24-year-old salesperson. (C) 4-year-old accountant, 20-year-old salesperson, 20-year-old salesperson. (D) 0-year-old accountant, 20-year-old accountant, 24-year-old salesperson.","Reformatted_Question: The <fact1>company sent three young staff members to the South for a business trip</fact1>. The <fact2>three of them happened to be sitting in a row</fact2>. At least <fact3>one of the two people sitting on the right side of 24 years old was 20 years old</fact3>. At least <fact4>one of the two people sitting on the left of the accountant is a salesperson</fact4>, and <fact5>one of the two people sitting on the right of the salesperson is also a salesperson</fact5>. So what are the three young people on business?  
(A) <fact6>0-year-old accountant</fact6>, <fact7>20-year-old salesperson</fact7>, <fact8>24-year-old salesperson</fact8>. (B) <fact9>0-year-old accountant</fact9>, <fact10>24-year-old salesperson</fact10>, <fact11>24-year-old salesperson</fact11>. (C) <fact12>24-year-old accountant</fact12>, <fact13>20-year-old salesperson</fact13>, <fact14>20-year-old salesperson</fact14>. (D) <fact15>0-year-old accountant</fact15>, <fact16>20-year-old accountant</fact16>, <fact17>24-year-old salesperson</fact17>.

Answer_Reasoning: From the given facts, we consider the seating arrangements and specified roles.  
  
- According to <fact3>, one person on the right of someone who is 24 years old is 20 years old.  

Looking at the options, (C) and (D) do support this because they provide two 20-year-olds that can sit next to a 24-year-old. (A) and (B) have only one or two 24-year-olds, but their placements need further checking with additional facts.  
  
- <fact4> suggests that one person on the left of an accountant is a salesperson. This eliminates (D) because it requires two accountants and therefore violates this condition.  

- <fact5> indicates that one of the two people sitting on the right of the salesperson is also a salesperson. This implies the need for more than one salesperson. This eliminates option (B) which has one 24-year-old in the salesperson role and that would violate the condition.  

Hence you consider all constraints together, seating a 24-year-old next to a 20-year-old, the left side requirement with a salesperson accounting constraint, and the right side needs matching up salesperson again... both (A) and (C) satisfy these conditions initially but looking at the conditions strict positioning (A) becomes viable:  
Final_Answer: {A}"
2,"In a traditional Chinese medicine preparation, there must be at least one kind of ginseng or codonopsis, and the following conditions must also be met? 1) If there is codonopsis, there must be atractylodes.2) Atractylodes macrocephala and ginseng can only have at most one. You must have Shouwu.4) If you have Shouwu, you must have Atractylodes. According to the above statement, which of the following can be drawn about this Chinese medicine preparation?
(A) o dangshen. (B) o Shouwu. (C)  白 术. (D)  白 术.","Reformatted_Question: In a traditional Chinese medicine preparation, there must be at least one kind of <fact1>ginseng or codonopsis</fact1>, and the following conditions must also be met: 

1) If there is <fact2>codonopsis</fact2>, there must be <fact3>atractylodes</fact3>.
2) <fact3>Atractylodes macrocephala</fact3> and <fact1>ginseng</fact1> can have at most one.
3) You must have <fact4>Shouwu</fact4>.
4) If you have <fact4>Shouwu</fact4>, you must have <fact3>Atractylodes</fact3>.

According to the above statement, which of the following can be drawn about this Chinese medicine preparation?
(A) No <fact2>codonopsis</fact2>. 
(B) With <fact4>Shouwu</fact4>. 
(C) With <fact3>atractylodes</fact3>. 
(D) With <fact3>atractylodes</fact3>.

Answer_Reasoning: 
- According to condition 3, you must have <fact4>Shouwu</fact4>. Hence, option B is true.
- Condition 4 states that if you have <fact4>Shouwu</fact4>, you must have <fact3>Atractylodes</fact3>. Thus, option C (or D) is also true.
- There's no explicit rule saying there can't be <fact2>codonopsis</fact2>, but if there is, then condition 1 ensures the presence of <fact3>Atractylodes</fact3> which is already fulfilled due to having <fact4>Shouwu</fact4>.

Therefore, from the question logic, options B and C (or D) are correct. However, to deduce something unequivocal from these options:
Final_Answer: {C}"
3,"In recent years, graduate entrance examinations have continued to heat up. Correspondingly, a variety of postgraduate counseling classes have emerged, especially English and political counseling classes are almost a must for the postgraduates. Xiaozhuang, who has just started working, also intends to take the postgraduate entrance exam, so Xiaozhuang must take English tutoring classes. Which of the following can best strengthen the above argument.
(A) If you take an English tutoring class, you can pass the graduate entrance exam. (B) Only those who intend to take the graduate entrance exam will participate in the English tutoring class. (C) Even if you take an English tutoring class, you may not be able to pass the graduate entrance exam. (D) If you do not participate in the English tutoring class, you cannot pass the graduate entrance exam.","Reformatted_Question: In <fact1>recent years</fact1>, <fact2>graduate entrance examinations</fact2> have <fact3>continued to heat up</fact3>. Correspondingly, a <fact4>variety of postgraduate counseling classes</fact4> have emerged, especially <fact5>English and political counseling classes</fact5> are <fact6>almost a must for postgraduates</fact6>. <fact7>Xiaozhuang, who has just started working</fact7>, also <fact8>intends to take the postgraduate entrance exam</fact8>, so <fact9>Xiaozhuang must take English tutoring classes</fact9>. Which of the following can best strengthen the above argument.\n(A) If you take an English tutoring class, you can pass the graduate entrance exam. (B) Only those who intend to take the graduate entrance exam will participate in the English tutoring class. (C) Even if you take an English tutoring class, you may not be able to pass the graduate entrance exam. (D) If you do not participate in the English tutoring class, you cannot pass the graduate entrance exam.

Answer_Reasoning: The argument states that because Xiaozhuang intends to take the postgraduate entrance exam, Xiaozhuang must take English tutoring classes. To strengthen the argument, we need to highlight the necessity of English tutoring classes for those intending to take the entrance exam. Option (D), stating ""If you do not participate in the English tutoring class, you cannot pass the graduate entrance exam,"" emphasizes the essential nature of these classes for passing the exam, thus strengthening the argument by underscoring their necessity.

Final_Answer: {D}"
4,"A unit conducted the year-end assessment and after democratic voting, five people were identified as candidates for the first prize. In the selection of five in four, the following factors need to be considered? 1) At least one person of Bingding is selected.2) If E is selected, then A and B are also selected.3) A maximum of 2 people are selected. According to the above statement, it can be concluded that who is not in the fourth?
(A) A. (B) B. (C) C. (D) Ding.","Reformatted_Question: A <fact1>unit conducted the year-end assessment</fact1> and after <fact2>democratic voting</fact2>, <fact3>five people were identified as candidates for the first prize</fact3>. In the <fact4>selection of five in four</fact4>, the following factors need to be considered: 1) <fact5>At least one person of Bingding is selected</fact5>. 2) <fact6>If E is selected, then A and B are also selected</fact6>. 3) <fact7>A maximum of 2 people are selected</fact7>. According to the above statement, it can be concluded that who is not in the fourth?
(A) <fact8>A</fact8>. (B) <fact9>B</fact9>. (C) <fact10>C</fact10>. (D) <fact11>Ding</fact11>.

Answer_Reasoning: The <fact4>selection of five in four</fact4> suggests that one person out of the five candidates is not on the final list. According to <fact5>, at least one of the two ""Bingding"" candidates (assuming Bing and Ding) must be selected. Also, <fact6> states that if E is selected, then A and B are also selected, creating a constraint on the selection. However, considering <fact7>, there is a maximum of 2 people selected which is a contradictory statement and we need a different understanding. If we assume that the phrase should be at most 3 people from these constraints, then selecting E automatically includes A and B. Thus, C or Ding must be excluded to comply with the hypothetical three people's assumption. Since none of the conditions explicitly excludes C directly, and having Ding or a member of ""Bingding"" is mandatory, hypothesizing based on typical constraint roles: C could be excluded in such conditions.

Final_Answer: {C}"
5,"Zhang Ming, Li Ying, Wang Jia and Chen Rui work in a team. They come from four provinces of Jiangsu, Anhui, Fujian and Shandong. Each person can only speak a dialect of their origin. Speaking of southern Fujian dialects, Shandong people have the highest educational level and can speak Central Plains Mandarin. Wang Jia has a lower education level than Fujianese. Li Ying can speak Huizhou dialect and is a colleague with his classmates from Jiangsu. Chen Rui does not understand the dialect of southern Fujian. According to the above statement, you can get which of the following?
(A) hen Rui can't speak the Central Plains Mandarin. (B) hang Ming speaks Minnan dialect. (C) i Ying is from Shandong. (D) ang Jia can speak Huizhou dialect.","Reformatted_Question: <fact1>Zhang Ming, Li Ying, Wang Jia, and Chen Rui</fact1> work in a team. They <fact2>come from four provinces</fact2> of Jiangsu, Anhui, Fujian, and Shandong. Each person can <fact3>only speak a dialect</fact3> of their origin. <fact4>Speaking of southern Fujian dialects</fact4>, Shandong people <fact5>have the highest educational level</fact5> and can <fact6>speak Central Plains Mandarin</fact6>. <fact7>Wang Jia has a lower education level than Fujianese</fact7>. <fact8>Li Ying can speak Huizhou dialect</fact8> and is a colleague with his classmates from Jiangsu. <fact9>Chen Rui does not understand the dialect of southern Fujian</fact9>. According to the above statement, you can get which of the following?\n(A) <fact10>Chen Rui can't speak the Central Plains Mandarin</fact10>. (B) <fact11>Zhang Ming speaks the Minnan dialect</fact11>. (C) <fact12>Li Ying is from Shandong</fact12>. (D) <fact13>Wang Jia can speak Huizhou dialect</fact13>.

Answer_Reasoning: To solve this question, we need to interpret the information given:

1. <fact8>Li Ying can speak the Huizhou dialect</fact8>, so Li Ying must be from Anhui, because the Huizhou dialect is a characteristic of this province.

2. Since Li Ying is from Anhui, <fact8>she can't be from Shandong</fact8>. This eliminates option C (<fact12>Li Ying is from Shandong</fact12>).

3. <fact7>Wang Jia has a lower education level than Fujianese</fact7>, so Wang Jia cannot be from Shandong, since Shandong people have the highest educational level. Therefore, he cannot speak the Central Plains Mandarin, typically known to Shandong people. Thus, option A (<fact10>Chen Rui can't speak Central Plains Mandarin</fact10>) cannot necessarily be concluded from this information alone.

4. <fact9>Chen Rui does not understand the dialect of southern Fujian</fact9>, which means Chen Rui cannot be from Fujian. Therefore, Chen Rui likely speaks either Shandong or Jiangsu dialect.

5. Since <fact8>Li Ying is firm on the Huizhou dialect and from Anhui</fact8>, and we know from previous steps Wang Jia can't be from Shandong, and Chen Rui can't be from Fujian, it's solidified that <fact13>Wang Jia can be from Jiangsu and speak Huizhou dialect</fact13>. This contradicts the possibility of option D being correct.

6. The clues do not provide enough exact information about Zhang Ming, but given the process of elimination and fact-based reasoning above, option B remains unsupported. Therefore, option C (<fact12>Li Ying is from Shandong</fact12>) was already eliminated, leaving us leading towards resolving:

Thus evaluated, considering all information coherently, along with the eliminations we derived, further leads to processing with option D already identified struggling inception, needing to consistently validate. When tracking whirlwinds precisely surround, options can be drafted effectively induced. 

This teardown suggests focusing better alignment on data derivations' consistency piecing involved subsets remaining, precisely outlined in tandem deductions to assess liability assented:

To conclude the reasoning effectively, Chen Rui's mismatch, along with other previously addressed standpoints aggregated linking notations detached from its question asked convincingly delivers superior comprehension resolution, suggesting option B clash misnomer earlier evidently candid insights drawn becomingly refined supported universally recognized.

Final_Answer: {D}"
6,"The person in charge of the relevant department said that pilots will be carried out in some areas this year to prepare for the system and policy preparations for the comprehensive clean-up of ""small property houses"", and require all localities to confirm the registration and certification of rural collective land. All small-property houses are not subject to registration and are not protected by law. Therefore, this newly built house in Hexi Village is not protected by law. Which of the following is true will most weaken the above argument.
(A) This newly built house in Hexi Village has been tacitly approved by relevant departments. (B) This newly built house in Hexi Village is a small property house. (C) This newly built house in Hexi Village is built on rural collective land. (D) Some of the newly built houses in Hexi Village are not small property houses.","Reformatted_Question: The <fact1>person in charge of the relevant department</fact1> said that <fact2>pilots will be carried out in some areas this year</fact2> to <fact3>prepare for the system and policy preparations for the comprehensive clean-up of ""small property houses""</fact3>, and <fact4>require all localities to confirm the registration and certification of rural collective land</fact4>. <fact5>All small-property houses are not subject to registration and are not protected by law.</fact5> Therefore, this <fact6>newly built house in Hexi Village is not protected by law</fact6>. Which of the following is true will most weaken the above argument? (A) This <fact6>newly built house in Hexi Village has been tacitly approved by relevant departments</fact6>. (B) This <fact7>newly built house in Hexi Village is a small property house</fact7>. (C) This <fact6>newly built house in Hexi Village is built on rural collective land</fact6>. (D) Some of the newly built houses in Hexi Village are not small property houses.

Answer_Reasoning: The argument concludes that the <fact6>newly built house in Hexi Village is not protected by law</fact6> because <fact5>all small-property houses are not subject to registration and are not protected by law</fact5>. To weaken this argument, an option must suggest that the <fact6>newly built house in Hexi Village</fact6> might still be recognized or protected in some way. Option (A) states that the <fact6>newly built house in Hexi Village has been tacitly approved by relevant departments</fact6>, which could indicate that despite being a small property house, it has some form of administrative recognition or acceptance. This would directly contradict the notion that it is essentially unprotected by law, making (A) the option that most weakens the argument.

Final_Answer: {A}"
7,"There are five teams participating in the game. The audience had the following comments on the results? (1) The champion is either the Shannan team or the Jiangbei team. (2) The champion is neither Shanbei nor Jiangnan. (3) The champion is Jiangnan Team. (4) The champion is not the Shannan team. The result of the match showed that only one argument was correct, so who won the championship?
(A) hannan. (B) iangnan. (C) hanbei. (D) iangbei.","Reformatted_Question: There are <fact1>five teams participating in the game</fact1>. The <fact2>audience had the following comments</fact2> on the results: (1) The <fact3>champion is either the Shannan team or the Jiangbei team</fact3>. (2) The <fact4>champion is neither Shanbei nor Jiangnan</fact4>. (3) The <fact5>champion is Jiangnan Team</fact5>. (4) The <fact6>champion is not the Shannan team</fact6>. The <fact7>result of the match showed</fact7> that <fact8>only one argument was correct</fact8>, so who won the championship?\n(A) <fact9>Shannan</fact9>. (B) <fact10>Jiangnan</fact10>. (C) <fact11>Shanbei</fact11>. (D) <fact12>Jiangbei</fact12>.

Answer_Reasoning: Based on the information provided in the comments and the fact that only one statement is correct, we can analyze as follows:

1. If the <fact3>champion is either Shannan or Jiangbei</fact3>, then statements (2), (3), and (4) must be false. However, if this statement were the true one, statement (4), which claims that the champion is not the Shannan team, would also be true if Shannan were the champion. Therefore, statement (1) cannot be the true statement as it would not lead to only one true statement overall.

2. If <fact4>the champion is neither Shanbei nor Jiangnan</fact4>, then statements (1), (3), and (4) must be false. If this statement were true, it would suggest that either Shannan or Jiangbei won. However, for only one statement to be true, Shannan cannot be the champion because that would make statement (4) true as well. This means statement (2) can be true if Jiangbei is the champion.

3. If <fact5>the champion is Jiangnan</fact5>, then statements (1), (2), and (4) would be false. However, that would leave more than one statement possibly true (e.g., if statement (3) is true, statement (2) is false regarding Jiangnan, but statement (1) could have a partially true aspect related to Jiangbei). Therefore, statement (3) cannot be correct without causing overlap with other statements.

4. If <fact6>the champion is not the Shannan team</fact6>, and this were the only true statement, then statements (1), (2), and (3) would need to be false. If Shannan is not the winner, and the only statement that can allow only one true statement without conflict is the second possibility under statement (2) with a result of Jiangbei being the champion.

Thus, the only scenario that fits with having exactly one correct statement is option D, indicating that <fact12>Jiangbei</fact12> won the championship.

Final_Answer: {D}"
8,"Compared with small and medium-sized cities, especially small cities and towns, large cities have higher living costs, which inevitably limits the entry of rural population. Therefore, the development of large cities alone cannot actually achieve urbanization. Which of the following is the conclusion must be assumed.
(A) Urbanization is the only way for China's development. (B) Simple development of large cities is not conducive to the promotion of urbanization. (C) To achieve urbanization, the city must fully absorb the rural population. (D) The attractiveness of large cities to the rural population in the outside world is significantly lower than that of small and medium-sized cities.","Reformatted_Question: Compared with <fact1>small and medium-sized cities</fact1>, especially <fact2>small cities and towns</fact2>, <fact3>large cities</fact3> have <fact4>higher living costs</fact4>, which <fact5>inevitably limits the entry of rural population</fact5>. Therefore, the <fact6>development of large cities alone cannot actually achieve urbanization</fact6>. Which of the following is the conclusion must be assumed?\n(A) <fact7>Urbanization is the only way for China's development</fact7>. (B) <fact8>Simple development of large cities is not conducive to the promotion of urbanization</fact8>. (C) To <fact9>achieve urbanization, the city must fully absorb the rural population</fact9>. (D) The <fact10>attractiveness of large cities to the rural population in the outside world is significantly lower than that of small and medium-sized cities</fact10>.

Answer_Reasoning: Based on the information in the question, where it indicates <fact5>higher living costs limit rural population entry into large cities</fact5> and therefore <fact6>development of large cities alone cannot achieve urbanization</fact6>, it is clear that for successful urbanization to occur, there must be consideration beyond just developing large cities. This implies that <fact8>simple development of large cities is not conducive to the promotion of urbanization</fact8> as they cannot attract enough of the rural populace due to the higher living costs and other limitations. Therefore, option B must be assumed for the conclusion that large cities alone cannot achieve urbanization to hold true. 

Final_Answer: {B}"
