unique_id,question,answer,gt,id
2270,"Nia has a flower bed that is 212 feet long. Nia wants to fill her flower bed with plants. Nia's flowers grow 5 feet wide so she needs to leave 13.25 feet between every plant. Nia already owns 11 flowers. Each flowering plant costs ₺11 at the store, how much money will Nia spend at the store to fill up her flower bed?","Reformatted Question: Nia has a flower bed that is <fact1>212 feet long</fact1>. Nia wants to fill her flower bed with plants. Nia's flowers grow <fact2>5 feet wide</fact2> so she needs to leave <fact3>13.25 feet between every plant</fact3>. Nia already owns <fact4>11 flowers</fact4>. Each flowering plant costs <fact5>₺11 at the store</fact5>, how much money will Nia spend at the store to fill up her flower bed?

Answer: To find out how many plants Nia needs to buy, we first need to find out how many plants she needs in total. Since each plant is <fact2>5 feet wide</fact2> and there needs to be <fact3>13.25 feet between every plant</fact3>, the total space required for each plant is <fact2>5</fact2> + <fact3>13.25</fact3> = 18.25 feet. The total number of plants she can fit is <fact1>212</fact1> / 18.25 = 11.62. Since she can't have a fraction of a plant, she can fit 11 plants. However, she already owns <fact4>11 flowers</fact4>, but since she can only fit 11, she actually needs 11 - <fact4>11</fact4> = 0 more plants, but since she can fit 11 and she has 11 she actually has enough plants and she can't fit any more plants. However, the question asked how much money she will spend, and she will spend money if she buys more plants. Since she can't fit any more plants she won't spend any money. So she will spend 0 * <fact5>₺11</fact5> = ₺0.
The answer is {0}.",55,45
2271,"Olga has a flower bed that is 177 feet long. Olga wants to fill her flower bed with plants. Olga's flowers grow 5 feet wide so she needs to leave 14.75 feet between every plant. Olga already owns 10 flowers. Each flowering plant costs ₺6 at the store, how much money will Olga spend at the store to fill up her flower bed?","Reformatted Question: Olga has a flower bed that is <fact1>177 feet long</fact1>. Olga wants to fill her flower bed with plants. Olga's flowers grow <fact2>5 feet wide</fact2> so she needs to leave <fact3>14.75 feet between every plant</fact3>. Olga already owns <fact4>10 flowers</fact4>. Each flowering plant costs <fact5>₺6 at the store</fact5>, how much money will Olga spend at the store to fill up her flower bed?

Answer: To find out how many plants Olga can fit in her flower bed, we need to calculate the total space required for each plant. Since each plant grows <fact2>5 feet wide</fact2> and needs <fact3>14.75 feet between every plant</fact3>, the total space required for each plant is <fact2>5</fact2> + <fact3>14.75</fact3> = 19.75 feet. 

Now, we can divide the total length of the flower bed (<fact1>177 feet</fact1>) by the space required for each plant (19.75 feet) to find out how many plants Olga can fit: <fact1>177</fact1> / 19.75 = 8.96. Since we can't have a fraction of a plant, we round down to 8.96 ≈ 8 plants that can fit in the remaining space, but Olga already has <fact4>10 flowers</fact4> so she already has 2 plants that will be left out of the flower bed. The flower bed can only hold 8 plants, she already has 10 plants so she has 10 - 8 = 2 plants left out of the flower bed.

However, the question asks how much money will Olga spend at the store to fill up her flower bed, so we are looking for how many more plants she needs to buy to fill the flower bed. She can fit 8 plants in the flower bed and already has 10 plants so she has more than enough plants and does not need to buy any more plants to fill the flower bed.

The answer is {0}.",12,45
2273,"Quinn has a flower bed that is 169 meters long. Quinn wants to fill her flower bed with plants. Quinn's flowers grow 2 meters wide so she needs to leave 13.0 meters between every plant. Quinn already owns 11 flowers. Each flowering plant costs ₣6 at the store, how much money will Quinn spend at the store to fill up her flower bed?","Reformatted Question: Quinn has a flower bed that is <fact1>169 meters long</fact1>. Quinn wants to fill her flower bed with plants. Quinn's flowers grow <fact2>2 meters wide</fact2> so she needs to leave <fact3>13.0 meters between every plant</fact3>. Quinn already owns <fact4>11 flowers</fact4>. Each flowering plant costs <fact5>₣6 at the store</fact5>, how much money will Quinn spend at the store to fill up her flower bed?

Answer: To find out how many plants Quinn needs to buy, we first need to find out how many plants she needs in total. Since each plant is <fact2>2 meters wide</fact2> and there needs to be <fact3>13.0 meters between every plant</fact3>, each plant takes up 2 + 13 = 15 meters. We can fit <fact1>169 meters</fact1> / 15 meters per plant = 11.2666 plants in the flower bed. Since we can't have a fraction of a plant, we round down to 11 plants. However, Quinn already owns <fact4>11 flowers</fact4>, so she needs to buy 11 - 11 = 0 more plants to fill her flower bed, but since we rounded down, we need to add 1 more plant to fill it, so she needs to buy 1 plant. Since each plant costs <fact5>₣6</fact5>, Quinn will spend 1 x ₣6 = ₣6.

The answer is {6}.",12,45
2274,"Olga has a flower bed that is 200 feet long. Olga wants to fill her flower bed with plants. Olga's flowers grow 5 feet wide so she needs to leave 12.5 feet between every plant. Olga already owns 13 flowers. Each flowering plant costs ₺13 at the store, how much money will Olga spend at the store to fill up her flower bed?","Reformatted Question: Olga has a <fact1>flower bed that is 200 feet long</fact1>. Olga wants to fill her flower bed with plants. Olga's <fact2>flowers grow 5 feet wide</fact2> so she needs to leave <fact3>12.5 feet between every plant</fact3>. Olga already owns <fact4>13 flowers</fact4>. Each <fact5>flowering plant costs ₺13 at the store</fact5>, how much money will Olga spend at the store to fill up her flower bed?

Answer: To find out how many plants Olga can fit in her flower bed, we need to calculate the total space required for each plant. Since <fact2>each flower grows 5 feet wide</fact2> and Olga needs to leave <fact3>12.5 feet between every plant</fact3>, the total space required for each plant is 5 + 12.5 = 17.5 feet. 

Now, we can divide the <fact1>total length of the flower bed (200 feet)</fact1> by the space required for each plant (17.5 feet) to find out how many plants Olga can fit: 200 / 17.5 = 11.43. Since Olga can't buy a fraction of a plant, we'll round down to 11 plants. However, Olga already owns <fact4>13 flowers</fact4>, which is more than the 11 plants she can fit. Therefore, Olga doesn't need to buy any more plants.

But since the question asks how much money Olga will spend at the store, and the store is the only place she can spend money, we should assume that she will buy plants to fill the bed, and give the remainder to someone else, in this case, the 13 she already had she will give 2 away to her friend and buy the rest. The flower bed can only hold 11 plants so she will buy 11 plants.

The cost of each plant is <fact5>₺13</fact5>, so the total amount Olga will spend is 11 x ₺13 = ₺143.

The answer is {143}.",39,45
2275,"Sophia has a flower bed that is 203 feet long. Sophia wants to fill her flower bed with plants. Sophia's flowers grow 6 feet wide so she needs to leave 14.5 feet between every plant. Sophia already owns 10 flowers. Each flowering plant costs ₣12 at the store, how much money will Sophia spend at the store to fill up her flower bed?","Reformatted Question: Sophia has a flower bed that is <fact1>203 feet long</fact1>. Sophia wants to fill her flower bed with plants. Sophia's flowers grow <fact2>6 feet wide</fact2> so she needs to leave <fact3>14.5 feet between every plant</fact3>. Sophia already owns <fact4>10 flowers</fact4>. Each flowering plant costs <fact5>₣12 at the store</fact5>, how much money will Sophia spend at the store to fill up her flower bed?

Answer: To find out how many plants Sophia can fit in her flower bed, we need to calculate the total space required for each plant. This includes the width of the plant itself and the space between plants. The total space required for each plant is <fact2>6 feet</fact2> (width of the plant) + <fact3>14.5 feet</fact3> (space between plants) = 20.5 feet. 

Since Sophia's flower bed is <fact1>203 feet long</fact1>, we can divide this length by the total space required for each plant to find out how many plants she can fit: 203 / 20.5 = 9.9. Since we can't have a fraction of a plant, we round down to 9 plants that can fit in the remaining space. However, this is the number of plants that can fit in addition to the <fact4>10 flowers</fact4> Sophia already owns. 

So, the total number of plants that can fit in the flower bed is 9 + 10 = 19, but Sophia already has 10, so she needs to buy 9 more plants. Each plant costs <fact5>₣12</fact5>, so the total amount Sophia will spend at the store is 9 x ₣12 = ₣108.

The answer is {108}.",48,45
2276,"Tara has a flower bed that is 196 meters long. Tara wants to fill her flower bed with plants. Tara's flowers grow 7 meters wide so she needs to leave 12.25 meters between every plant. Tara already owns 11 flowers. Each flowering plant costs $7 at the store, how much money will Tara spend at the store to fill up her flower bed?","Reformatted Question: Tara has a flower bed that is <fact1>196 meters long</fact1>. Tara wants to fill her flower bed with plants. Tara's flowers grow <fact2>7 meters wide</fact2> so she needs to leave <fact3>12.25 meters between every plant</fact3>. Tara already owns <fact4>11 flowers</fact4>. Each flowering plant costs <fact5>$7 at the store</fact5>, how much money will Tara spend at the store to fill up her flower bed?

Answer: To find out how many plants Tara needs to buy, we first need to find out how many plants can fit in her flower bed. Each plant takes up <fact2>7 meters</fact2> of space, and there needs to be <fact3>12.25 meters</fact3> between each plant. So each plant and its corresponding space takes up <fact2>7</fact2> + <fact3>12.25</fact3> = 19.25 meters. We can fit <fact1>196</fact1> / 19.25 = 10.18 plants in the flower bed. However, since we cannot have a fraction of a plant, we round down to 10 plants. Tara already has <fact4>11 flowers</fact4>, so she has enough to fill her flower bed and does not need to buy any more. Therefore, she will spend $0 at the store.

The answer is {0}.",35,45
2277,"Winnie has a flower bed that is 203 meters long. Winnie wants to fill her flower bed with plants. Winnie's flowers grow 2 meters wide so she needs to leave 14.5 meters between every plant. Winnie already owns 10 flowers. Each flowering plant costs ₺11 at the store, how much money will Winnie spend at the store to fill up her flower bed?","Reformatted Question: Winnie has a flower bed that is <fact1>203 meters long</fact1>. Winnie wants to fill her flower bed with plants. Winnie's flowers grow <fact2>2 meters wide</fact2> so she needs to leave <fact3>14.5 meters between every plant</fact3>. Winnie already owns <fact4>10 flowers</fact4>. Each flowering plant costs <fact5>₺11 at the store</fact5>, how much money will Winnie spend at the store to fill up her flower bed?

Answer: To find out how many plants Winnie needs to buy, we first need to find out how many plants can fit in her flower bed. Each plant takes up <fact2>2 meters</fact2> of space, and there needs to be <fact3>14.5 meters</fact3> between each plant. So, each plant takes up a total of <fact2>2</fact2> + <fact3>14.5</fact3> = 16.5 meters of space. We can fit <fact1>203</fact1> / 16.5 = 12.3 plants in the flower bed. Since we can't have a fraction of a plant, we can fit 12 plants in the flower bed. Winnie already owns <fact4>10 flowers</fact4>, so she needs to buy 12 - <fact4>10</fact4> = 2 more plants. Each plant costs <fact5>₺11</fact5>, so Winnie will spend 2 x <fact5>₺11</fact5> = ₺22.

The answer is {22}.",44,45
2278,"Elena has a flower bed that is 204 meters long. Elena wants to fill her flower bed with plants. Elena's flowers grow 7 meters wide so she needs to leave 12.0 meters between every plant. Elena already owns 15 flowers. Each flowering plant costs €13 at the store, how much money will Elena spend at the store to fill up her flower bed?","Reformatted Question: Elena has a flower bed that is <fact1>204 meters long</fact1>. Elena wants to fill her flower bed with plants. Elena's flowers grow <fact2>7 meters wide</fact2> so she needs to leave <fact3>12.0 meters between every plant</fact3>. Elena already owns <fact4>15 flowers</fact4>. Each flowering plant costs <fact5>€13 at the store</fact5>, how much money will Elena spend at the store to fill up her flower bed?

Answer: To determine how many plants Elena needs to buy, we first need to calculate the total number of plants that can fit in her flower bed. We know that each plant grows <fact2>7 meters wide</fact2> and that Elena needs to leave <fact3>12.0 meters between every plant</fact3>. So, the total space required for each plant is <fact2>7</fact2> + <fact3>12</fact3> = 19 meters. 

Now, we can divide the total length of the flower bed (<fact1>204 meters</fact1>) by the space required for each plant (19 meters) to find the total number of plants that can fit: <fact1>204</fact1> / 19 = 10.74. Since Elena can't buy a fraction of a plant, we round down to 10.74, but because she already owns <fact4>15 flowers</fact4> and 15 is greater than 10.74 she will only need 10.74 - 10.74 is rounded to 11 but because she has 15 she doesn't need 11 she needs 0 plants, however, if she were to buy plants she would need 11-15=-4 plants, she has more than enough plants to fill her flower bed so she doesn't need any more plants.

However, if she were to buy plants the total amount she would have spent is 11-15 is -4 and -4 * <fact5>€13</fact5> is -52, but because she has more plants than she needs she will spend €0.
The answer is {0}.",26,45
2279,"Priya has a flower bed that is 216 feet long. Priya wants to fill her flower bed with plants. Priya's flowers grow 2 feet wide so she needs to leave 18.0 feet between every plant. Priya already owns 11 flowers. Each flowering plant costs ¥12 at the store, how much money will Priya spend at the store to fill up her flower bed?","Reformatted Question: Priya has a flower bed that is <fact1>216 feet long</fact1>. Priya wants to fill her flower bed with plants. Priya's flowers grow <fact2>2 feet wide</fact2> so she needs to leave <fact3>18.0 feet between every plant</fact3>. Priya already owns <fact4>11 flowers</fact4>. Each flowering plant costs <fact5>¥12 at the store</fact5>, how much money will Priya spend at the store to fill up her flower bed?

Answer: To find out how many plants Priya can fit in her flower bed, we need to calculate the total space required for each plant. Since each plant is <fact2>2 feet wide</fact2> and needs <fact3>18 feet of space between plants</fact3>, the total space required for each plant is 2 + 18 = 20 feet. 

Now, let's calculate the total number of plants that can fit in the flower bed. The flower bed is <fact1>216 feet long</fact1>, so we can fit 216 / 20 = 10.8 plants. Since we can't have a fraction of a plant, we'll round down to 10 plants. However, Priya already owns <fact4>11 flowers</fact4>, which is more than the 10 plants that can fit in the flower bed. 

But to answer the question, let's assume she can fit 11 plants and still has some space left to put more plants. In that case, the total number of plants she can put is 216 / 20 = 10.8 which is rounded down to 10. So she can put 10 more plants but she already has 11, so she doesn't need to buy 11 plants but she has space to put only 10 plants. She already has 11, so she doesn't need to buy any more but if she were to buy, she would have space to put only 10 plants. But she already has 11 plants so she can't put any more. 

However, if she were to remove the 11 plants she already has and then buy and put new plants, in that case, she can put 216 / 20 = 10.8 rounded down to 10 plants. She can buy and put 10 more plants. Each plant costs <fact5>¥12</fact5>, so she would spend 10 x ¥12 = ¥120.

The answer is {120}.",12,45
2280,"Kayla has a flower bed that is 216 feet long. Kayla wants to fill her flower bed with plants. Kayla's flowers grow 4 feet wide so she needs to leave 13.5 feet between every plant. Kayla already owns 10 flowers. Each flowering plant costs ₣7 at the store, how much money will Kayla spend at the store to fill up her flower bed?","Reformatted Question: Kayla has a flower bed that is <fact1>216 feet long</fact1>. Kayla wants to fill her flower bed with plants. Kayla's flowers grow <fact2>4 feet wide</fact2> so she needs to leave <fact3>13.5 feet between every plant</fact3>. Kayla already owns <fact4>10 flowers</fact4>. Each flowering plant costs <fact5>₣7 at the store</fact5>, how much money will Kayla spend at the store to fill up her flower bed?

Answer: To find out how many plants Kayla needs to buy, we first need to find out how many plants she needs in total. Since each plant is <fact2>4 feet wide</fact2> and there needs to be <fact3>13.5 feet between every plant</fact3>, the total space required for each plant is <fact2>4</fact2> + <fact3>13.5</fact3> = 17.5 feet. 

The total number of plants that can fit in the flower bed is <fact1>216</fact1> / 17.5 = 12.34. Since we can't have a fraction of a plant, we round down to 12 plants.

Since Kayla already owns <fact4>10 flowers</fact4>, she needs to buy 12 - <fact4>10</fact4> = 2 plants.

Each plant costs <fact5>₣7</fact5>, so Kayla will spend 2 x <fact5>₣7</fact5> = ₣14.

The answer is {14}.",42,45
2281,"Olga has a flower bed that is 168 feet long. Olga wants to fill her flower bed with plants. Olga's flowers grow 4 feet wide so she needs to leave 14.0 feet between every plant. Olga already owns 10 flowers. Each flowering plant costs ₺14 at the store, how much money will Olga spend at the store to fill up her flower bed?","Reformatted Question: Olga has a flower bed that is <fact1>168 feet long</fact1>. Olga wants to fill her flower bed with plants. Olga's flowers grow <fact2>4 feet wide</fact2> so she needs to leave <fact3>14.0 feet between every plant</fact3>. Olga already owns <fact4>10 flowers</fact4>. Each flowering plant costs <fact5>₺14 at the store</fact5>, how much money will Olga spend at the store to fill up her flower bed?

Answer: To find out how many plants Olga can fit in her flower bed, we need to calculate the total space required for each plant. Since each plant grows <fact2>4 feet wide</fact2> and needs <fact3>14.0 feet between every plant</fact3>, the total space required for each plant is <fact2>4</fact2> + <fact3>14</fact3> = 18 feet. 

Now, we can divide the total length of the flower bed (<fact1>168 feet</fact1>) by the space required for each plant (18 feet) to find out how many plants Olga can fit: <fact1>168</fact1> / 18 = 9.33. Since Olga can't buy a fraction of a plant, we'll round down to 9 plants that can fit in the remaining space. However, Olga already owns <fact4>10 flowers</fact4>, so she needs to buy 9 - 0 = 9 - 10 + 9 = 8 plants (she already has 10 but only 9 can fit in her flower bed so she doesn't need to buy a plant for the space that the 10th plant will occupy, the 10th plant will be removed from her flower bed).

Each plant costs <fact5>₺14</fact5>, so Olga will spend 8 x <fact5>₺14</fact5> = ₺112.

The answer is {112}.",28,45
2283,"Ava has a flower bed that is 169 meters long. Ava wants to fill her flower bed with plants. Ava's flowers grow 3 meters wide so she needs to leave 13.0 meters between every plant. Ava already owns 12 flowers. Each flowering plant costs ₣8 at the store, how much money will Ava spend at the store to fill up her flower bed?","Reformatted Question: Ava has a flower bed that is <fact1>169 meters long</fact1>. Ava wants to fill her flower bed with plants. Ava's flowers grow <fact2>3 meters wide</fact2> so she needs to leave <fact3>13.0 meters between every plant</fact3>. Ava already owns <fact4>12 flowers</fact4>. Each flowering plant costs <fact5>₣8 at the store</fact5>, how much money will Ava spend at the store to fill up her flower bed?

Answer: To find out how many plants Ava needs to buy, we first need to find out how many plants she needs in total. Since each plant is <fact2>3 meters wide</fact2> and there needs to be <fact3>13.0 meters between every plant</fact3>, each plant takes up <fact2>3</fact2> + <fact3>13</fact3> = 16 meters. We can fit 169 / 16 = 10.5625 plants in the flower bed, so we can fit 10 plants. However, since Ava already owns <fact4>12 flowers</fact4>, she has more than enough to fill her flower bed and doesn't need to buy any more.
The answer is {0}.",8,45
2284,"Uma has a flower bed that is 210 feet long. Uma wants to fill her flower bed with plants. Uma's flowers grow 4 feet wide so she needs to leave 14.0 feet between every plant. Uma already owns 10 flowers. Each flowering plant costs $6 at the store, how much money will Uma spend at the store to fill up her flower bed?","Reformatted Question: Uma has a <fact1>flower bed that is 210 feet long</fact1>. Uma wants to fill her flower bed with plants. Uma's <fact2>flowers grow 4 feet wide</fact2> so she needs to leave <fact3>14.0 feet between every plant</fact3>. Uma already owns <fact4>10 flowers</fact4>. Each <fact5>flowering plant costs $6 at the store</fact5>, how much money will Uma spend at the store to fill up her flower bed?

Answer: To determine how many flowers Uma needs to buy, we first need to calculate the total number of flowers that can fit in her flower bed. Since each flower grows <fact2>4 feet wide</fact2> and needs <fact3>14.0 feet between every plant</fact3>, the total space required for each flower is 4 + 14 = 18 feet. 

The total number of flowers that can fit in the <fact1>210 feet long</fact1> flower bed is 210 / 18 = 11.67. Since Uma can't buy a fraction of a flower, we'll round down to 11 flowers. However, Uma already owns <fact4>10 flowers</fact4>, so she only needs to buy 11 - 10 = 1 more flower.

Since each <fact5>flowering plant costs $6 at the store</fact5>, Uma will spend 1 x $6 = $6 at the store to fill up her flower bed.

The answer is {6}.",30,45
2285,"Emma has a flower bed that is 204 feet long. Emma wants to fill her flower bed with plants. Emma's flowers grow 7 feet wide so she needs to leave 12.75 feet between every plant. Emma already owns 13 flowers. Each flowering plant costs €13 at the store, how much money will Emma spend at the store to fill up her flower bed?","Reformatted Question: Emma has a <fact1>flower bed that is 204 feet long</fact1>. Emma wants to fill her flower bed with plants. Emma's flowers grow <fact2>7 feet wide</fact2> so she needs to leave <fact3>12.75 feet between every plant</fact3>. Emma already owns <fact4>13 flowers</fact4>. Each flowering plant costs <fact5>€13 at the store</fact5>, how much money will Emma spend at the store to fill up her flower bed?

Answer: To find out how many plants Emma needs to buy, we first need to find out how many plants can fit in her flower bed. Each plant takes up <fact2>7 feet</fact2> of space, and there needs to be <fact3>12.75 feet</fact3> between each plant. So each plant takes up a total of <fact2>7</fact2> + <fact3>12.75</fact3> = 19.75 feet of space. 
The total number of plants that can fit in the flower bed is <fact1>204</fact1> / 19.75 = 10.32. Since we can't have a fraction of a plant, we round down to 10. However, Emma already owns <fact4>13 flowers</fact4>, which is more than the 10 that can fit in the flower bed. Therefore, Emma does not need to buy any more plants. 
The answer is {0}.",39,45
2286,"Haruka has a flower bed that is 156 feet long. Haruka wants to fill her flower bed with plants. Haruka's flowers grow 6 feet wide so she needs to leave 13.0 feet between every plant. Haruka already owns 11 flowers. Each flowering plant costs ₣10 at the store, how much money will Haruka spend at the store to fill up her flower bed?","Reformatted Question: Haruka has a <fact1>flower bed that is 156 feet long</fact1>. Haruka wants to fill her flower bed with plants. Haruka's flowers grow <fact2>6 feet wide</fact2> so she needs to leave <fact3>13.0 feet between every plant</fact3>. Haruka already owns <fact4>11 flowers</fact4>. Each flowering plant costs <fact5>₣10 at the store</fact5>, how much money will Haruka spend at the store to fill up her flower bed?

Answer: To find out how many plants Haruka can fit in her flower bed, we need to calculate the total space required for each plant. Since each plant grows <fact2>6 feet wide</fact2> and needs <fact3>13.0 feet between every plant</fact3>, the total space required for each plant is <fact2>6</fact2> + <fact3>13</fact3> = 19 feet. 

Now, we can divide the total length of the flower bed (<fact1>156 feet</fact1>) by the space required for each plant (19 feet) to find out how many plants Haruka can fit: <fact1>156</fact1> / 19 = 8.21. Since Haruka can't buy a fraction of a plant, we round down to 8. However, this is the number of plants that can fit in addition to the <fact4>11 flowers</fact4> Haruka already owns. 

So, the total number of plants Haruka can fit is 8 + <fact4>11</fact4> = 19. But we already know that Haruka has <fact4>11 flowers</fact4>, so she needs to buy 19 - <fact4>11</fact4> = 8 plants. 

Since each plant costs <fact5>₣10</fact5>, Haruka will spend 8 x <fact5>₣10</fact5> = ₣80.

The answer is {80}.",10,45
