unique_id,question,answer,gt,id
3942,There are 5 periods in the day for a normal student but Mateo has to take 2 extra classes. Each class is 40 minutes long. He goes to class for 6 days a week. He then spends 2/4 of his weekly minutes each on Saturday and Sunday as extra learning time. How many hours a week does he spend learning?,"Reformatted Question: There are <fact1>5 periods in the day for a normal student</fact1> but Mateo has to take <fact2>2 extra classes</fact2>. <fact3>Each class is 40 minutes long</fact3>. He goes to class for <fact4>6 days a week</fact4>. He then spends <fact5>2/4 of his weekly minutes</fact5> each on Saturday and Sunday as extra learning time. How many hours a week does he spend learning?

Answer: Mateo has <fact1>5 periods</fact1> + <fact2>2 extra classes</fact2> = 7 classes per day. Since <fact3>each class is 40 minutes long</fact3>, he spends 7 * <fact3>40 minutes</fact3> = 280 minutes per day in class. He goes to class for <fact4>6 days a week</fact4>, so he spends 280 * <fact4>6</fact4> = 1680 minutes per week in class. He spends an additional <fact5>2/4 of his weekly minutes</fact5> * 2 = <fact5>2/4</fact5> * 2 * 1680 = 840 minutes per week on extra learning time on Saturday and Sunday. In total, he spends 1680 + 840 = 2520 minutes per week learning. Converting this to hours, we get 2520 / 60 = 42 hours per week.

The answer is {42}.",56,78
3996,"Ravi finished 4/5 of a 395 piece puzzle, and then started and finished another 521 piece puzzle within an hour. How many puzzle pieces did Ravi place during that hour?","Reformatted Question: Ravi finished <fact1>4/5 of a 395 piece puzzle</fact1>, and then started and finished another <fact2>521 piece puzzle</fact2> within an hour. How many puzzle pieces did Ravi place during that hour?

Answer: Ravi finished <fact1>4/5 of a 395 piece puzzle</fact1>, which is (4/5) * 395 = 316 pieces. Then he finished a <fact2>521 piece puzzle</fact2>. So in total, he placed 316 + 521 = 837 pieces. However, this is not the total number of pieces he placed in the hour, because he had already started the 395 piece puzzle before the hour began. So, to find the total number of pieces he placed in the hour, we need to subtract the number of pieces he had already placed before the hour began. Since he had finished <fact1>4/5 of a 395 piece puzzle</fact1>, he had already placed 316 pieces before the hour began. This means he had 395 - 316 = 79 pieces left to place in the 395 piece puzzle. He placed these 79 pieces in the hour, in addition to the 521 pieces from the <fact2>521 piece puzzle</fact2>. So, the total number of pieces he placed in the hour is 79 + 521 = 600.

The answer is {600}.",837,79
4001,The vending machines sell popcorn for 75 cents and cookies for 125 cents. Mateo spent ₺1200 and got 9 bags of popcorn and had 6% of his money left in change. How many cookies did he buy?,"Reformatted Question: The vending machines sell <fact1>popcorn for 75 cents</fact1> and <fact2>cookies for 125 cents</fact2>. Mateo spent <fact3>₺1200</fact3> and got <fact4>9 bags of popcorn</fact4> and had <fact5>6% of his money left in change</fact5>. How many cookies did he buy?

Answer: Mateo spent <fact3>₺1200</fact3> and had <fact5>6% of his money left in change</fact5>, so he spent 1200 - (1200 * 0.06) = 1128 cents. He bought <fact4>9 bags of popcorn</fact4> for <fact1>75 cents</fact1> each, so he spent 9 * 75 = 675 cents on popcorn. This means he spent 1128 - 675 = 453 cents on cookies. Since each cookie costs <fact2>125 cents</fact2>, he bought 453 / 125 = 3.624 cookies. Since you can't buy a fraction of a cookie, we round down to 3 cookies.

The answer is {3}.",897,80
4009,The vending machines sell crackers for 50 cents and pretzels for 125 cents. Esteban spent ₣1200 and got 3 bags of crackers and had 3% of his money left in change. How many pretzels did he buy?,"Reformatted Question: The vending machines sell <fact1>crackers for 50 cents</fact1> and <fact2>pretzels for 125 cents</fact2>. Esteban spent <fact3>₣1200</fact3> and got <fact4>3 bags of crackers</fact4> and had <fact5>3% of his money left in change</fact5>. How many pretzels did he buy?

Answer: Esteban spent <fact3>₣1200</fact3> and had <fact5>3% of his money left in change</fact5>, so he spent 1200 - (1200 * 0.03) = 1164 cents. He bought <fact4>3 bags of crackers</fact4> for <fact1>50 cents</fact1> each, so he spent 3 * 50 = 150 cents on crackers. This means he spent 1164 - 150 = 1014 cents on pretzels. Since each pretzel costs <fact2>125 cents</fact2>, he bought 1014 / 125 = 8.112 pretzels. Since you can't buy a fraction of a pretzel, he must have bought 8 pretzels.
The answer is {8}.",930,80
4012,The vending machines sell popcorn for 35 cents and pretzels for 75 cents. Qasim spent ₣500 and got 5 bags of popcorn and had 8% of his money left in change. How many pretzels did he buy?,"Reformatted Question: The vending machines sell <fact1>popcorn for 35 cents</fact1> and <fact2>pretzels for 75 cents</fact2>. Qasim spent <fact3>₣500</fact3> and got <fact4>5 bags of popcorn</fact4> and had <fact5>8% of his money left in change</fact5>. How many pretzels did he buy?

Answer: Qasim spent <fact3>₣500</fact3> and had <fact5>8% of his money left in change</fact5>, so he spent 500 - (500 * 0.08) = 500 - 40 = 460 cents. He bought <fact4>5 bags of popcorn</fact4> for <fact1>35 cents</fact1> each, so he spent 5 * 35 = 175 cents on popcorn. This means he spent 460 - 175 = 285 cents on pretzels. Since each pretzel costs <fact2>75 cents</fact2>, he bought 285 / 75 = 3.8 pretzels. Since you can't buy a fraction of a pretzel, we round down to 3 pretzels.
The answer is {3}.",611,80
4014,The vending machines sell gum for 25 cents and popcorn for 75 cents. Umar spent €500 and got 2 bags of gum and had 9% of his money left in change. How many popcorn did he buy?,"Reformatted Question: The vending machines sell <fact1>gum for 25 cents</fact1> and <fact2>popcorn for 75 cents</fact2>. Umar spent <fact3>€500</fact3> and got <fact4>2 bags of gum</fact4> and had <fact5>9% of his money left in change</fact5>. How many popcorn did he buy?

Answer: Umar spent <fact3>€500</fact3> and had <fact5>9% of his money left in change</fact5>, so he spent 100% - <fact5>9%</fact5> = 91% of his money, which is 0.91 * <fact3>€500</fact3> = €455.50. He bought <fact4>2 bags of gum</fact4> for <fact1>25 cents</fact1> each, which is 2 * <fact1>0.25</fact1> = €0.50. So he spent €455.50 - €0.50 = €455 on popcorn. Since each popcorn costs <fact2>75 cents</fact2>, he bought €455 / <fact2>0.75</fact2> = 607 popcorn.

The answer is {607}.",606,80
4017,The vending machines sell gum for 75 cents and popcorn for 100 cents. Yusuf spent ¥900 and got 4 bags of gum and had 9% of his money left in change. How many popcorn did he buy?,"Reformatted Question: The vending machines sell <fact1>gum for 75 cents</fact1> and <fact2>popcorn for 100 cents</fact2>. Yusuf spent <fact3>¥900</fact3> and got <fact4>4 bags of gum</fact4> and had <fact5>9% of his money left in change</fact5>. How many popcorn did he buy?

Answer: First, we need to find out how much money Yusuf spent on gum. Since he bought <fact4>4 bags of gum</fact4> and each bag costs <fact1>75 cents</fact1>, he spent a total of <fact4>4</fact4> * <fact1>0.75</fact1> = $3 on gum.

Since Yusuf spent <fact3>¥900</fact3> in total and had <fact5>9% of his money left in change</fact5>, we can calculate the amount of money he spent on popcorn and gum. The amount of money he had left is <fact3>900</fact3> * <fact5>0.09</fact5> = $81. So, the amount of money he spent is <fact3>900</fact3> - $81 = $819.

Now, we subtract the amount of money he spent on gum from the total amount of money he spent to find out how much he spent on popcorn. $819 - $3 = $816.

Since each bag of popcorn costs <fact2>100 cents</fact2> or $1, we can divide the amount of money he spent on popcorn by the cost of each bag to find out how many bags he bought. $816 / $1 = 816 bags of popcorn, but this is in dollars and the question is in cents for the price of popcorn and the amount is in yen for the total amount he spent, so we need to convert the amount he spent into cents and then into dollars to keep the same units. However, the conversion rate from yen to dollars isn't given in the problem, so we can't give an accurate answer in the current state of the problem.

However, if we assume that the conversion rate is 100 yen per dollar, then we can solve the problem as follows:

Yusuf spent <fact3>¥900</fact3> which is equivalent to $9. He had <fact5>9% of his money left in change</fact5> which is $0.81. So, he spent $9 - $0.81 = $8.19.

He spent <fact4>4</fact4> * <fact1>0.75</fact1> = $3 on gum. So, he spent $8.19 - $3 = $5.19 on popcorn.

Since each bag of popcorn costs <fact2>100 cents</fact2> or $1, we can divide the amount of money he spent on popcorn by the cost of each bag to find out how many bags he bought. $5.19 / $1 = 5.19 bags of popcorn. Since we can't buy a fraction of a bag, we round down to 5 bags of popcorn.

The answer is {5}.",816,80
4019,The vending machines sell gum for 50 cents and pretzels for 75 cents. Yuki spent ₣600 and got 9 bags of gum and had 3% of his money left in change. How many pretzels did he buy?,"Reformatted Question: The vending machines sell <fact1>gum for 50 cents</fact1> and <fact2>pretzels for 75 cents</fact2>. Yuki spent <fact3>₣600</fact3> and got <fact4>9 bags of gum</fact4> and had <fact5>3% of his money left in change</fact5>. How many pretzels did he buy?

Answer: Yuki spent <fact3>₣600</fact3> and had <fact5>3% of his money left in change</fact5>, so he spent 600 - (600 * 0.03) = 582 cents. He bought <fact4>9 bags of gum</fact4> for <fact1>50 cents</fact1> each, so he spent 9 * 50 = 450 cents on gum. This means he spent 582 - 450 = 132 cents on pretzels. Since each pretzel costs <fact2>75 cents</fact2>, he bought 132 / 75 = 1.76 pretzels. Since you can't buy a fraction of a pretzel, we round down to 1 pretzel (but that would mean he had more than 3% of his money left over), or he bought 2 pretzels (which is more likely given the 3% leftover change).
The answer is {2}.",770,80
4020,The vending machines sell popcorn for 25 cents and crackers for 125 cents. Pavel spent ₺1400 and got 5 bags of popcorn and had 5% of his money left in change. How many crackers did he buy?,"Reformatted Question: The vending machines sell <fact1>popcorn for 25 cents</fact1> and <fact2>crackers for 125 cents</fact2>. Pavel spent <fact3>₺1400</fact3> and got <fact4>5 bags of popcorn</fact4> and had <fact5>5% of his money left in change</fact5>. How many crackers did he buy?

Answer: First, let's calculate how much money Pavel spent on popcorn. Since <fact1>popcorn costs 25 cents</fact1> per bag, and Pavel bought <fact4>5 bags of popcorn</fact4>, he spent <fact1>25 cents</fact1> * <fact4>5</fact4> = 125 cents on popcorn.

Now, let's calculate how much money Pavel had left after buying the popcorn. Pavel spent <fact3>₺1400</fact3> in total and had <fact5>5% of his money left in change</fact5>. This means he spent 95% of his money. To find the amount he spent, we can calculate 95% of <fact3>₺1400</fact3>, which is 0.95 * <fact3>1400</fact3> = 1330. 

So, Pavel spent 1330 cents in total. Since he spent 125 cents on popcorn, he spent 1330 - 125 = 1205 cents on crackers.

Since <fact2>crackers cost 125 cents</fact2> each, we can divide the amount Pavel spent on crackers (1205 cents) by the cost of one cracker (<fact2>125 cents</fact2>) to find out how many crackers he bought: 1205 / <fact2>125</fact2> = 9.64. Since we can't buy a fraction of a cracker, we round down to 9 crackers.

The answer is {9}.",1063,80
4022,The vending machines sell gum for 25 cents and crackers for 50 cents. Kai spent ¥1400 and got 6 bags of gum and had 3% of his money left in change. How many crackers did he buy?,"Reformatted Question: The vending machines sell <fact1>gum for 25 cents</fact1> and <fact2>crackers for 50 cents</fact2>. Kai spent <fact3>¥1400</fact3> and got <fact4>6 bags of gum</fact4> and had <fact5>3% of his money left in change</fact5>. How many crackers did he buy?

Answer: First, we need to convert the amount of money Kai spent into cents. Since 1 yen is equal to 1 cent, we can say that Kai spent <fact3>1400</fact3> cents. Since he had <fact5>3% of his money left in change</fact5>, we can calculate the amount of money he spent on gum and crackers as follows: <fact3>1400</fact3> - (<fact3>1400</fact3> * <fact5>0.03</fact5>) = 1400 - 42 = 1358 cents.

Kai bought <fact4>6 bags of gum</fact4> for <fact1>25 cents</fact1> each, so he spent a total of <fact4>6</fact4> * <fact1>25</fact1> = 150 cents on gum.

Now, we can subtract the amount of money he spent on gum from the total amount of money he spent to find out how much he spent on crackers: 1358 - 150 = 1208 cents.

Since each bag of crackers costs <fact2>50 cents</fact2>, we can divide the amount of money he spent on crackers by the cost of each bag to find out how many bags he bought: 1208 / <fact2>50</fact2> = 24.16. Since we can't buy a fraction of a bag, we can round down to 24 bags.

The answer is {24}.",2713,80
4025,The vending machines sell crackers for 50 cents and popcorn for 75 cents. Hiroshi spent ¥1200 and got 6 bags of crackers and had 9% of his money left in change. How many popcorn did he buy?,"Reformatted Question: The vending machines sell <fact1>crackers for 50 cents</fact1> and <fact2>popcorn for 75 cents</fact2>. Hiroshi spent <fact3>¥1200</fact3> and got <fact4>6 bags of crackers</fact4> and had <fact5>9% of his money left in change</fact5>. How many popcorn did he buy?

Answer: First, we need to find out how much money Hiroshi spent on crackers. Since <fact1>crackers cost 50 cents</fact1> and he bought <fact4>6 bags of crackers</fact4>, he spent <fact4>6</fact4> x <fact1>50 cents</fact1> = 300 cents or ¥300 on crackers.

Next, we need to find out how much money Hiroshi had left after buying the crackers. He spent <fact3>¥1200</fact3> in total and had <fact5>9% of his money left in change</fact5>, which is <fact5>9%</fact5> x <fact3>¥1200</fact3> = ¥108. So, he spent ¥1200 - ¥108 = ¥1092 on snacks.

Now, we subtract the cost of crackers from the total amount spent on snacks to find out how much he spent on popcorn. ¥1092 - ¥300 = ¥792.

Finally, we divide the amount spent on popcorn by the cost of one bag of popcorn to find out how many bags he bought. ¥792 ÷ <fact2>75 cents</fact2> (or ¥75) = 10.56, but since we can't buy a fraction of a bag, we round down to 10 bags.

The answer is {10}.",1452,80
4027,The vending machines sell crackers for 85 cents and pretzels for 125 cents. Santiago spent ¥900 and got 5 bags of crackers and had 3% of his money left in change. How many pretzels did he buy?,"Reformatted Question: The vending machines sell <fact1>crackers for 85 cents</fact1> and <fact2>pretzels for 125 cents</fact2>. Santiago spent <fact3>¥900</fact3> and got <fact4>5 bags of crackers</fact4> and had <fact5>3% of his money left in change</fact5>. How many pretzels did he buy?

Answer: First, we need to convert the amount spent from yen to cents. Since 1 yen is equal to 1 cent, we can directly use the value in cents. Santiago spent <fact3>900 cents</fact3> and had <fact5>3% of his money left in change</fact5>, which is 0.03 * <fact3>900 cents</fact3> = 27 cents. So, the total amount spent on snacks is <fact3>900 cents</fact3> - 27 cents = 873 cents.

Santiago bought <fact4>5 bags of crackers</fact4> for <fact1>85 cents</fact1> each, so the total amount spent on crackers is <fact4>5</fact4> * <fact1>85 cents</fact1> = 425 cents.

The remaining amount spent on pretzels is 873 cents - 425 cents = 448 cents. Since each pretzel costs <fact2>125 cents</fact2>, the number of pretzels bought is 448 cents / <fact2>125 cents</fact2> = 3.58. Since we can't buy a fraction of a pretzel, we round down to 3 pretzels.

The answer is {3}.",695,80
4030,The vending machines sell pretzels for 25 cents and cookies for 50 cents. Viktor spent ¥700 and got 2 bags of pretzels and had 8% of his money left in change. How many cookies did he buy?,"Reformatted Question: The vending machines sell <fact1>pretzels for 25 cents</fact1> and <fact2>cookies for 50 cents</fact2>. Viktor spent <fact3>¥700</fact3> and got <fact4>2 bags of pretzels</fact4> and had <fact5>8% of his money left in change</fact5>. How many cookies did he buy?

Answer: Viktor spent <fact3>¥700</fact3> and had <fact5>8% of his money left in change</fact5>, so he spent 100% - <fact5>8%</fact5> = 92% of his money, which is 0.92 * <fact3>¥700</fact3> = ¥644. 
Viktor bought <fact4>2 bags of pretzels</fact4> for <fact1>25 cents</fact1> each, which is 2 * <fact1>25 cents</fact1> = ¥50. 
So, Viktor spent ¥644 - ¥50 = ¥594 on cookies. 
Since each cookie costs <fact2>50 cents</fact2>, Viktor bought ¥594 / <fact2>50 cents</fact2> = 1188 cookies.
The answer is {1188}.",1287,80
4034,The vending machines sell popcorn for 70 cents and cookies for 125 cents. Gabriel spent ¥1200 and got 5 bags of popcorn and had 2% of his money left in change. How many cookies did he buy?,"Reformatted Question: The vending machines sell <fact1>popcorn for 70 cents</fact1> and <fact2>cookies for 125 cents</fact2>. Gabriel spent <fact3>¥1200</fact3> and got <fact4>5 bags of popcorn</fact4> and had <fact5>2% of his money left in change</fact5>. How many cookies did he buy?

Answer: First, we need to convert the amount of money Gabriel spent into cents. Since 1 yen is equal to 1 cent, Gabriel spent <fact3>1200</fact3> cents. Since he had <fact5>2% of his money left in change</fact5>, he spent 98% of his money. So, the amount of money he actually spent is <fact3>1200</fact3> * 0.98 = 1176 cents. 

Since Gabriel bought <fact4>5 bags of popcorn</fact4> for <fact1>70 cents</fact1> each, he spent <fact4>5</fact4> * <fact1>70</fact1> = 350 cents on popcorn. 

Now, we subtract the amount of money he spent on popcorn from the total amount of money he spent: 1176 - 350 = 826 cents. 

Since each cookie costs <fact2>125 cents</fact2>, we divide the remaining amount of money by the cost of a cookie to find out how many cookies he bought: 826 / <fact2>125</fact2> = 6.608. 

Since we can't buy a fraction of a cookie, we round down to the nearest whole number. Therefore, Gabriel bought 6 cookies.

The answer is {6}.",938,80
4036,The vending machines sell popcorn for 25 cents and pretzels for 100 cents. Liam spent ₣1000 and got 4 bags of popcorn and had 8% of his money left in change. How many pretzels did he buy?,"Reformatted Question: The vending machines sell <fact1>popcorn for 25 cents</fact1> and <fact2>pretzels for 100 cents</fact2>. Liam spent <fact3>₣1000</fact3> and got <fact4>4 bags of popcorn</fact4> and had <fact5>8% of his money left in change</fact5>. How many pretzels did he buy?

Answer: First, we need to find out how much money Liam spent on popcorn. Since <fact1>popcorn costs 25 cents</fact1> and he bought <fact4>4 bags of popcorn</fact4>, he spent <fact1>25 cents</fact1> * <fact4>4</fact4> = 100 cents on popcorn.

Since Liam spent <fact3>₣1000</fact3> and had <fact5>8% of his money left in change</fact5>, the amount he actually spent is <fact3>₣1000</fact3> - (<fact3>₣1000</fact3> * <fact5>0.08</fact5>) = ₣920.

Now, we subtract the cost of popcorn from the total amount spent to find out how much he spent on pretzels. So, ₣920 - 100 cents = ₣820.

Since <fact2>pretzels cost 100 cents</fact2>, we divide the amount spent on pretzels by the cost of one pretzel to find out how many pretzels he bought. Therefore, ₣820 / <fact2>100 cents</fact2> = 8.2. Since we can't buy a fraction of a pretzel, we round down to 8 pretzels.

The answer is {8}.",919,80
4037,The vending machines sell pretzels for 25 cents and gum for 75 cents. Theo spent ₣1300 and got 6 bags of pretzels and had 7% of his money left in change. How many gum did he buy?,"Reformatted Question: The vending machines sell <fact1>pretzels for 25 cents</fact1> and <fact2>gum for 75 cents</fact2>. <fact3>Theo spent ₣1300</fact3> and got <fact4>6 bags of pretzels</fact4> and had <fact5>7% of his money left in change</fact5>. How many gum did he buy?

Answer: First, we need to find out how much money Theo spent on pretzels. Since <fact1>pretzels cost 25 cents</fact1> and <fact4>he bought 6 bags</fact4>, he spent <fact1>25 cents</fact1> * <fact4>6</fact4> = ₣150 on pretzels. 

Since <fact5>he had 7% of his money left in change</fact5>, the amount he spent is <fact3>₣1300</fact3> - (<fact3>₣1300</fact3> * <fact5>7%</fact5>) = ₣1300 - ₣91 = ₣1209.

Now, we subtract the amount he spent on pretzels from the total amount he spent to find out how much he spent on gum: ₣1209 - ₣150 = ₣1059.

Finally, we divide the amount he spent on gum by the cost of gum to find out how many gum he bought: ₣1059 / <fact2>75 cents</fact2> = 14.12. Since we can't buy a fraction of gum, we round down to 14.

The answer is {14}.",1610,80
4038,The vending machines sell pretzels for 25 cents and popcorn for 125 cents. Arash spent ¥900 and got 6 bags of pretzels and had 9% of his money left in change. How many popcorn did he buy?,"Reformatted Question: The vending machines sell <fact1>pretzels for 25 cents</fact1> and <fact2>popcorn for 125 cents</fact2>. Arash spent <fact3>¥900</fact3> and got <fact4>6 bags of pretzels</fact4> and had <fact5>9% of his money left in change</fact5>. How many popcorn did he buy?

Answer: Arash spent <fact3>¥900</fact3> and had <fact5>9% of his money left in change</fact5>, so he spent 900 - (900 * 0.09) = 819 cents. He bought <fact4>6 bags of pretzels</fact4> for <fact1>25 cents</fact1> each, so he spent 6 * 25 = 150 cents on pretzels. This means he spent 819 - 150 = 669 cents on popcorn. Since each popcorn costs <fact2>125 cents</fact2>, he bought 669 / 125 = 5.35 popcorn. Since you can't buy a fraction of popcorn, we round down to 5 popcorn.

The answer is {5}.",654,80
4039,The vending machines sell cookies for 50 cents and pretzels for 100 cents. Jamal spent ₣600 and got 2 bags of cookies and had 3% of his money left in change. How many pretzels did he buy?,"Reformatted Question: The vending machines sell <fact1>cookies for 50 cents</fact1> and <fact2>pretzels for 100 cents</fact2>. Jamal spent <fact3>₣600</fact3> and got <fact4>2 bags of cookies</fact4> and had <fact5>3% of his money left in change</fact5>. How many pretzels did he buy?

Answer: Jamal spent <fact3>₣600</fact3> and had <fact5>3% of his money left in change</fact5>, so he spent 600 - (600 * 0.03) = 582 cents. He bought <fact4>2 bags of cookies</fact4> for 2 * <fact1>50 cents</fact1> = 100 cents. So, he spent 582 - 100 = 482 cents on pretzels. Since each pretzel costs <fact2>100 cents</fact2>, he bought 482 / 100 = 4.82 pretzels. Since you can't buy a fraction of a pretzel, we round down to 4 pretzels.
The answer is {4}.",581,80
4044,The vending machines sell gum for 30 cents and pretzels for 50 cents. Andre spent ₺1400 and got 5 bags of gum and had 3% of his money left in change. How many pretzels did he buy?,"Reformatted Question: The vending machines sell <fact1>gum for 30 cents</fact1> and <fact2>pretzels for 50 cents</fact2>. Andre spent <fact3>₺1400</fact3> and got <fact4>5 bags of gum</fact4> and had <fact5>3% of his money left in change</fact5>. How many pretzels did he buy?

Answer: First, we need to find out how much money Andre spent on gum. Since <fact1>gum costs 30 cents</fact1> and he bought <fact4>5 bags of gum</fact4>, he spent <fact1>30 cents</fact1> * <fact4>5</fact4> = ₺150 on gum. 

Since Andre had <fact5>3% of his money left in change</fact5>, he spent <fact3>₺1400</fact3> - (<fact3>₺1400</fact3> * <fact5>3%</fact5>) = ₺1400 - ₺42 = ₺1358. 

Now, we subtract the amount he spent on gum from the total amount he spent to find out how much he spent on pretzels. So, he spent ₺1358 - ₺150 = ₺1208 on pretzels. 

Since <fact2>pretzels cost 50 cents</fact2>, we can divide the amount he spent on pretzels by the cost of a pretzel to find out how many pretzels he bought. Therefore, he bought ₺1208 / <fact2>50 cents</fact2> = 2416 / 100 = 24.16. Since we can't buy a fraction of a pretzel, we round down to 24 pretzels.

The answer is {24}.",2713,80
4046,The vending machines sell pretzels for 50 cents and popcorn for 75 cents. Bodhi spent ¥1300 and got 3 bags of pretzels and had 1% of his money left in change. How many popcorn did he buy?,"Reformatted Question: The vending machines sell <fact1>pretzels for 50 cents</fact1> and <fact2>popcorn for 75 cents</fact2>. Bodhi spent <fact3>¥1300</fact3> and got <fact4>3 bags of pretzels</fact4> and had <fact5>1% of his money left in change</fact5>. How many popcorn did he buy?

Answer: Bodhi spent <fact3>¥1300</fact3> and had <fact5>1% of his money left in change</fact5>, so he spent 99% of his money, which is 0.99 * <fact3>1300</fact3> = 1287. He bought <fact4>3 bags of pretzels</fact4> for <fact1>50 cents</fact1> each, which is a total of <fact4>3</fact4> * <fact1>0.5</fact1> = 1.5 dollars = 150 cents. Subtracting this from the total amount spent, we get 1287 - 150 = 1137 cents spent on popcorn. Since each popcorn costs <fact2>75 cents</fact2>, the number of popcorn bought is 1137 / <fact2>75</fact2> = 15.16, which is approximately 15. 
The answer is {15}.",1714,80
