id,question,answer,gt_number
history_1601_841d8b22-68ec-450e-a6a9-17d23665d7e8,"In February 1479, a Portuguese army commanded by Garcia de Meneses, Bishop of Évora, penetrated into Extremadura. His objective was to occupy and reinforce the strongholds of Mérida and Medellín, controlled by Beatriz Pacheco, Countess of Medellin and supporter of Afonso V. According to Palencia, the Portuguese army was composed of about 1,000 Knights , plus infantry. 180 Knights of the Order of Santiago marched alongside him, commanded by their treasurer, Alfonso de Monroy. On February 24, near the hill of Albuera, the army was challenged by Isabellian forces commanded by Alonso de Cárdenas, Master of the Order of Santiago. The army consisted of 500 Knights of the Order, 400 Knights of the Hermandad , and 100 infantrymen. The battle was heavily contested. The Isabellian infantry suffered a severe blow from the Juanist cavalry and became disorganized, but intervention by the Master of Santiago aided the panicked infantry. The Portuguese were forced to retreat, leaving significant spoils of war on the battlefield, as well as around 85 dead Knights. Only 15 Isabellian Knights were killed. The bulk of the Portuguese army was able to take refuge in Mérida and from there continued its march to Medellín, which they occupied. Supporters of King Ferdinand placed Medellín and Mérida under siege. How many more Knights were in Portuguese army than the Isabellian army?","Reformatted Question: In February 1479, a Portuguese army commanded by Garcia de Meneses, Bishop of Évora, penetrated into Extremadura. His objective was to occupy and reinforce the strongholds of Mérida and Medellín, controlled by Beatriz Pacheco, Countess of Medellin and supporter of Afonso V. According to Palencia, the Portuguese army was composed of about <fact1>1,000 Knights</fact1>, plus infantry. <fact2>180 Knights of the Order of Santiago</fact2> marched alongside him, commanded by their treasurer, Alfonso de Monroy. On February 24, near the hill of Albuera, the army was challenged by Isabellian forces commanded by Alonso de Cárdenas, Master of the Order of Santiago. The army consisted of <fact3>500 Knights of the Order</fact3>, <fact4>400 Knights of the Hermandad</fact4>, and 100 infantrymen. The battle was heavily contested. The Isabellian infantry suffered a severe blow from the Juanist cavalry and became disorganized, but intervention by the Master of Santiago aided the panicked infantry. The Portuguese were forced to retreat, leaving significant spoils of war on the battlefield, as well as around 85 dead Knights. Only 15 Isabellian Knights were killed. The bulk of the Portuguese army was able to take refuge in Mérida and from there continued its march to Medellín, which they occupied. Supporters of King Ferdinand placed Medellín and Mérida under siege. How many more Knights were in Portuguese army than the Isabellian army?

Answer: According to the passage, the Portuguese army had <fact1>1,000 Knights</fact1> and <fact2>180 Knights of the Order of Santiago</fact2>, totaling <fact1>1,000</fact1> + <fact2>180</fact2> = 1,180 Knights. The Isabellian army had <fact3>500 Knights of the Order</fact3> and <fact4>400 Knights of the Hermandad</fact4>, totaling <fact3>500</fact3> + <fact4>400</fact4> = 900 Knights. 1,180 - 900 = 280. So the answer is {280}.",100.0
history_1276_3cf695a7-f48c-4a59-93a6-1475962ee4c8,"In May 1924, the French Army had established a line of out-posts north of the Oureghla River in disputed tribal territory. On 12 April 1925, an estimated 8,000 Rifians attacked this line and in two weeks over 40 of 66 French posts had been stormed or abandoned. French casualties exceeded 1,000 killed, 3,700 wounded and 1,000 missing - representing losses of over 20 percent of their forces deployed in the Rif. The French accordingly intervened on the side of Spain, employing up to 160,000 well trained and equipped troops from Metropolitan, Algerian, Senegalese and Foreign Legion units, as well as Moroccan regulars  and auxiliaries . With total Spanish forces now numbering about 90,000 the Rifian forces were now seriously outnumbered by their Franco-Spanish opponents. Final French deaths from battle and disease, in what had now become a major war, were to total 8,628. How many French out-posts were still there?","Reformatted Question: In May 1924, the French Army had established a line of <fact1>out-posts north of the Oureghla River</fact1> in disputed tribal territory. On 12 April 1925, an estimated 8,000 Rifians attacked this line and in two weeks <fact2>over 40 of 66 French posts had been stormed or abandoned</fact2>. French casualties exceeded 1,000 killed, 3,700 wounded and 1,000 missing - representing losses of over 20 percent of their forces deployed in the Rif. The French accordingly intervened on the side of Spain, employing up to 160,000 well trained and equipped troops from Metropolitan, Algerian, Senegalese and Foreign Legion units, as well as Moroccan regulars  and auxiliaries . With total Spanish forces now numbering about 90,000 the Rifian forces were now seriously outnumbered by their Franco-Spanish opponents. Final French deaths from battle and disease, in what had now become a major war, were to total 8,628. How many French out-posts were still there?

Answer: According to the passage, there were originally <fact1>66 French posts</fact1>, and <fact2>over 40 of 66 French posts had been stormed or abandoned</fact2>. To find the number of posts still there, we need to subtract the number of posts stormed or abandoned from the total number of posts. Since we are given a range (""over 40""), we can calculate the minimum number of posts still there by subtracting 40 from 66 and get 26. So the answer is {26}.",25.0
nfl_1873_30504e30-71aa-4643-98f3-8132de444b3b," Starting lineups: HOUSTON - OFFENSE: QB Matt Schaub, LT Duane Brown, LG Wade Smith, C Chris Myers, RG Mike Brisiel, RT Eric Winston, WR Andre Johnson, RB Arian Foster, FB Vonta Leach, TE Joel Dreessen, WR Kevin Walter. HOUSTON - DEFENSE: LDE Antonio Smith, DT Shaun Cody, DT Amobi Okoye, RDE Mario Williams, SLB Kevin Bentley, MLB Brian Cushing, WLB Zac Diles, CB Glover Quinn, CB Kareem Jackson, SS Bernard Pollard, FS Eugene Wilson. The Texans' eighth game was an AFC duel with the Chargers. In the first quarter the Texans took the early lead as RB Arian Foster got an 8-yard TD run. The Chargers replied with QB Philip Rivers making a 55-yard TD pass to WR Seyi Ajirotutu. The Texans led again with kicker Neil Rackers nailing a 27-yard field goal, but fell behind after Rivers got an 11-yard TD pass to TE Randy McMichael. They took the lead in the second quarter as Foster made a 2-yard TD run, followed by Rackers hitting a 21 and a 25-yard field goal. The Texans lost the lead with Rivers finding McMichael again on a 12-yard TD pass. This was followed in the 4th quarter by Rivers' 28-yard TD pass to Ajirotutu (With a successful 2-point conversion as FB Mike Tolbert ran to the endzone). How many different players scored two touchdowns?","Reformatted Question: The Texans' eighth game was an AFC duel with the Chargers. In the first quarter the Texans took the early lead as RB <fact1>Arian Foster got an 8-yard TD run</fact1>. The Chargers replied with QB Philip Rivers making a 55-yard TD pass to WR Seyi Ajirotutu. The Texans led again with kicker Neil Rackers nailing a 27-yard field goal, but fell behind after Rivers got an 11-yard TD pass to TE Randy McMichael. They took the lead in the second quarter as <fact1>Foster made a 2-yard TD run</fact1>, followed by Rackers hitting a 21 and a 25-yard field goal. The Texans lost the lead with Rivers finding <fact2>McMichael again on a 12-yard TD pass</fact2>. This was followed in the 4th quarter by Rivers' 28-yard TD pass to <fact3>Ajirotutu (With a successful 2-point conversion as FB Mike Tolbert ran to the endzone)</fact3>. How many different players scored two touchdowns?
Answer: According to the passage, <fact1>Arian Foster scored two touchdowns</fact1>, <fact2>Randy McMichael scored two touchdowns</fact2>, and <fact3>Seyi Ajirotutu scored two touchdowns</fact3>. So the answer is {3}.",2.0
history_254_69f0add7-09b8-4def-86f8-f196003f0159,"In 1997, Russia and Ukraine signed the Partition Treaty, establishing two independent national fleets and dividing armaments and bases between them. Ukraine also agreed to lease major parts of its facilities to the Russian Black Sea Fleet until 2017. However, the treaty appeared to be far from perfect: permanent tensions on the lease details  control continued. The Fleet's main base is still situated in the Crimean port city of Sevastopol. In 2009 the Yushchenko Ukrainian government declared that the lease would not be extended and that the fleet would have to leave Sevastopol by 2017.  In 2010 the Russian leasehold was renegotiated with an extension until 2042 and an option for an additional five years until 2047. How many years was the leasehold renegotiated for?","Reformatted Question: In 1997, Russia and Ukraine signed the Partition Treaty, establishing two independent national fleets and dividing armaments and bases between them. Ukraine also agreed to lease major parts of its facilities to the Russian Black Sea Fleet until <fact1>2017</fact1>. However, the treaty appeared to be far from perfect: permanent tensions on the lease details  control continued. The Fleet's main base is still situated in the Crimean port city of Sevastopol. In 2009 the Yushchenko Ukrainian government declared that the lease would not be extended and that the fleet would have to leave Sevastopol by <fact1>2017</fact1>.  In <fact2>2010</fact2> the Russian leasehold was renegotiated with an extension until <fact3>2042</fact3> and an option for an additional <fact4>five years</fact4> until <fact5>2047</fact5>. How many years was the leasehold renegotiated for?
Answer: According to the passage, the leasehold was renegotiated in <fact2>2010</fact2> for an extension until <fact3>2042</fact3>, which is <fact3>2042</fact3> - <fact2>2010</fact2> = 32 years, and an option for an additional <fact4>five years</fact4> until <fact5>2047</fact5>. So the answer is {32} for the main extension and {5} for the additional option, but if we consider the full possible extension, then the answer is {37}.",25.0
history_254_14720a39-5dd9-498d-a922-8b77af3a4dff,"In 1997, Russia and Ukraine signed the Partition Treaty, establishing two independent national fleets and dividing armaments and bases between them. Ukraine also agreed to lease major parts of its facilities to the Russian Black Sea Fleet until 2017. However, the treaty appeared to be far from perfect: permanent tensions on the lease details  control continued. The Fleet's main base is still situated in the Crimean port city of Sevastopol. In 2009 the Yushchenko Ukrainian government declared that the lease would not be extended and that the fleet would have to leave Sevastopol by 2017.  In 2010 the Russian leasehold was renegotiated with an extension until 2042 and an option for an additional five years until 2047. For how many years did Ukraine agree to lease its facilities?","Reformatted Question: In 1997, Russia and Ukraine signed the Partition Treaty, establishing two independent national fleets and dividing armaments and bases between them. Ukraine also agreed to <fact1>lease major parts of its facilities to the Russian Black Sea Fleet until 2017</fact1>. However, the treaty appeared to be far from perfect: permanent tensions on the lease details  control continued. The Fleet's main base is still situated in the Crimean port city of Sevastopol. In 2009 the Yushchenko Ukrainian government declared that the lease would not be extended and that the fleet would have to leave Sevastopol by 2017.  In 2010 the Russian leasehold was renegotiated with an extension <fact2>until 2042</fact2> and an option for an additional <fact3>five years until 2047</fact3>. For how many years did Ukraine agree to lease its facilities?

Answer: According to the passage, initially, Ukraine agreed to <fact1>lease its facilities until 2017</fact1>, which is from 1997 to 2017, that is 20 years. However, in 2010, the lease was renegotiated with an extension <fact2>until 2042</fact2>, which is from 1997 to 2042, that is 45 years. There is also an option for an additional <fact3>five years until 2047</fact3>, which would be 50 years in total. So the answer is {50}.",20.0
history_2187_32a8d1bc-8cba-4f9c-b219-43ac7d12b831,"As of the 2010 United States Census, there were 244,826 people, 90,218 households, and 66,335 families residing in the county. The population density was . There were 95,554 housing units at an average density of . The racial makeup of the county was 81.2% white, 12.7% black or African American, 2.4% Asian, 0.3% American Indian, 0.1% Pacific islander, 0.9% from other races, and 2.5% from two or more races. Those of Hispanic or Latino origin made up 3.5% of the population. In terms of ancestry, 28.1% were German, 19.8% were Irish, 12.2% were English, 9.9% were Italian, 6.8% were Polish, and 6.2% were American. How many percent of people were not Irish?","Reformatted Question: As of the 2010 United States Census, there were 244,826 people, 90,218 households, and 66,335 families residing in the county. The population density was . There were 95,554 housing units at an average density of . The racial makeup of the county was 81.2% white, 12.7% black or African American, 2.4% Asian, 0.3% American Indian, 0.1% Pacific islander, 0.9% from other races, and 2.5% from two or more races. Those of Hispanic or Latino origin made up 3.5% of the population. In terms of ancestry, <fact1>28.1% were German</fact1>, <fact2>19.8% were Irish</fact2>, <fact3>12.2% were English</fact3>, <fact4>9.9% were Italian</fact4>, <fact5>6.8% were Polish</fact5>, and <fact6>6.2% were American</fact6>. How many percent of people were not Irish?
Answer: According to the passage, <fact2>19.8% were Irish</fact2>. To find the percentage of people who were not Irish, we need to subtract this percentage from 100%. 100% - <fact2>19.8%</fact2> = 80.2%. So the answer is {80.2}.",81.2
nfl_1195_e5d90a83-6a57-4496-b1d7-6f0581044546," The Eagles faced off with the Baltimore Ravens in an interconference matchup.  Both defenses dominated the first quarter, and in the second quarter, Baltimore forced three turnovers (two interceptions and a fumble) from Donovan McNabb.  Ravens kicker Matt Stover booted a 44-yard field goal, while quarterback Joe Flacco completed a 1-yard touchdown pass to tight end Daniel Wilcox.  However, rookie  Quintin Demps returned the following kickoff 100 yards for a Philadelphia touchdown to make it 10-7 Ravens at halftime.  Andy Reid decided to bench McNabb (who was 8-for-18 for 59 yards and two interceptions) and put backup quarterback Kevin Kolb into the game.  Kolb also struggled with the Baltimore defense, and the Eagles fell behind 12-7 when linebacker Jameel McClain blocked Sav Rocca's punt into the back of the endzone for a safety. In the fourth, the Ravens kicked another field goal after a Kolb interception, then Mark Clayton took a short slant 53-yards for a touchdown to make it 22-7.  Kolb drove Philadelphia to the Raven 1-yard line, but was intercepted in the end zone by Ed Reed, who returned the ball an NFL-record 108 yards for the touchdown.  Le'Ron McClain added a 1-yard touchdown run as Baltimore won 36-7.  Kolb was 10-for-23 for 73 yards and two interceptions, and Brian Westbrook had 39 yards rushing on 14 carries.  The Eagles dropped to 5-5-1. How many touchdowns occurred in the 1st half?","Reformatted Question: The Eagles faced off with the Baltimore Ravens in an interconference matchup.  Both defenses dominated the <fact1>first quarter</fact1>, and in the <fact2>second quarter</fact2>, Baltimore forced three turnovers (two interceptions and a fumble) from Donovan McNabb.  Ravens kicker Matt Stover booted a 44-yard field goal, while quarterback Joe Flacco completed a <fact3>1-yard touchdown pass to tight end Daniel Wilcox</fact3>.  However, rookie  Quintin Demps returned the following kickoff 100 yards for a <fact4>Philadelphia touchdown</fact4> to make it 10-7 Ravens at halftime.  Andy Reid decided to bench McNabb (who was 8-for-18 for 59 yards and two interceptions) and put backup quarterback Kevin Kolb into the game.  Kolb also struggled with the Baltimore defense, and the Eagles fell behind 12-7 when linebacker Jameel McClain blocked Sav Rocca's punt into the back of the endzone for a safety. In the fourth, the Ravens kicked another field goal after a Kolb interception, then Mark Clayton took a short slant 53-yards for a touchdown to make it 22-7.  Kolb drove Philadelphia to the Raven 1-yard line, but was intercepted in the end zone by Ed Reed, who returned the ball an NFL-record 108 yards for the touchdown.  Le'Ron McClain added a 1-yard touchdown run as Baltimore won 36-7.  Kolb was 10-for-23 for 73 yards and two interceptions, and Brian Westbrook had 39 yards rushing on 14 carries.  The Eagles dropped to 5-5-1. How many touchdowns occurred in the 1st half?
Answer: According to the passage, in the <fact1>first quarter</fact1>, no touchdowns were scored. However, in the <fact2>second quarter</fact2>, there were two touchdowns: <fact3>1-yard touchdown pass to tight end Daniel Wilcox</fact3> and <fact4>Philadelphia touchdown</fact4> when Quintin Demps returned the kickoff 100 yards. So the answer is {2}.",1.0
nfl_2234_95d3a1ab-939a-4a83-a6c1-30aeff0cbef0," After a huge loss at the Saints, the Colts traveled to Nashville take on the Titans.  The Titans would score 20 unanswered points in the 1st half alone as Rob Bironas would kick a 51-yard field goal for a 3-0 lead in the first quarter.  In the 2nd quarter, Jason McCourty would recover a blocked punt in the end zone sending the game to 10-0, followed up by Bironas nailing a 50-yard field goal for 13-0 and eventual halftime lead of 20-0 when Nate Washington ran for a 3-yard touchdown.  The Colts would manage to get on the board as Adam Vinatieri would kick a 22-yard field goal for a 20-3 lead.  Donald Brown managed to increase his team's points with a 4-yard touchdown run for a 20-10 lead.  The Titans however wrapped the game up when Washington ran for a 14-yard touchdown for a final score of 27-10.With the loss, the Colts fell to 0-8. How many points for the latter was there after the McCourty touchdown?","Reformatted Question: After a huge loss at the Saints, the Colts traveled to Nashville take on the Titans.  The Titans would score 20 unanswered points in the 1st half alone as Rob Bironas would kick a <fact1>51-yard field goal for a 3-0 lead</fact1> in the first quarter.  In the 2nd quarter, Jason McCourty would recover a blocked punt in the end zone sending the game to <fact2>10-0</fact2>, followed up by Bironas nailing a 50-yard field goal for <fact3>13-0</fact3> and eventual halftime lead of <fact4>20-0</fact4> when Nate Washington ran for a 3-yard touchdown.  The Colts would manage to get on the board as Adam Vinatieri would kick a 22-yard field goal for a <fact5>20-3 lead</fact5>.  Donald Brown managed to increase his team's points with a 4-yard touchdown run for a <fact6>20-10 lead</fact6>.  The Titans however wrapped the game up when Washington ran for a 14-yard touchdown for a final score of <fact7>27-10</fact7>. With the loss, the Colts fell to 0-8. How many points for the latter was there after the McCourty touchdown?
Answer: According to the passage, after the McCourty touchdown, the score was <fact2>10-0</fact2>. So the answer is {10}.",0.0
history_2153_31523efd-03f9-4cd9-a3bc-b917ec096ede,"1% of those at school in the South-East gained no GCSE passes in 2010; Portsmouth was most with 2.5%, and Windsor and Maidenhead had the lowest with 0.2%. For school free school meals, the region has the lowest percentage in England with 7.2%; the highest percentage is Southampton with 17%, and the lowest is Wokingham with 3.5% (the second lowest in England after Rutland); Buckinghamshire is 4.3%, then Bracknell Forest and Surrey are 4.9%. For truancy, the highest is South Bucks at 7.0, then Canterbury 7.0, Portsmouth 6.9, Thanet 6.9, Southampton 6.4, and Rushmoor 6.1. The lowest truancy percentages are for Tandridge 2.5, Windsor & Maidenhead 2.5, and Slough 2.5. How many percent difference is there between the highest and lowest percentage of school free meals?","Reformatted Question: 1% of those at school in the South-East gained no GCSE passes in 2010; Portsmouth was most with 2.5%, and Windsor and Maidenhead had the lowest with 0.2%. For school free school meals, the region has the lowest percentage in England with 7.2%; the highest percentage is <fact1>Southampton with 17%</fact1>, and the lowest is <fact2>Wokingham with 3.5%</fact2> (the second lowest in England after Rutland); Buckinghamshire is 4.3%, then Bracknell Forest and Surrey are 4.9%. For truancy, the highest is South Bucks at 7.0, then Canterbury 7.0, Portsmouth 6.9, Thanet 6.9, Southampton 6.4, and Rushmoor 6.1. The lowest truancy percentages are for Tandridge 2.5, Windsor & Maidenhead 2.5, and Slough 2.5. How many percent difference is there between the highest and lowest percentage of school free meals?
Answer: According to the passage, <fact1>the highest percentage of school free meals is 17%</fact1>, and <fact2>the lowest is 3.5%</fact2>. <fact1>17%</fact1> - <fact2>3.5%</fact2> = 13.5%. So the answer is {13.5}.",9.8
history_1069_2bcbb94d-8866-49b9-a964-0ef6e8d998c2,"In 1688 the most powerful navies were the French, English, and Dutch; the Spanish and Portuguese navies had suffered serious declines in the 17th century. The largest French ships of the period were the Soleil Royal and the Royal Louis. Each rated for 120 guns, they never carried their full complement. These ships were too large for practical purposes. The former only sailed on one campaign and was destroyed at La Hogue; the latter languished in port until sold in 1694. By the 1680s, French ship-design was at least equal to its English and Dutch counterparts, and by the Nine Years' War the French fleet had surpassed ships of the Royal Navy, whose designs stagnated in the 1690s. Innovation in the Royal Navy, however, did not cease. At some stage in the 1690s, for example, English ships began to employ the steering wheel, greatly improving their performance, particularly in heavy weather. How many navies suffered serious declines in the 17th century?","Reformatted Question: In 1688 the most powerful navies were the French, English, and Dutch; the <fact1>Spanish and Portuguese navies had suffered serious declines in the 17th century</fact1>. The largest French ships of the period were the Soleil Royal and the Royal Louis. Each rated for 120 guns, they never carried their full complement. These ships were too large for practical purposes. The former only sailed on one campaign and was destroyed at La Hogue; the latter languished in port until sold in 1694. By the 1680s, French ship-design was at least equal to its English and Dutch counterparts, and by the Nine Years' War the French fleet had surpassed ships of the Royal Navy, whose designs stagnated in the 1690s. Innovation in the Royal Navy, however, did not cease. At some stage in the 1690s, for example, English ships began to employ the steering wheel, greatly improving their performance, particularly in heavy weather. How many navies suffered serious declines in the 17th century?

Answer: According to the passage, <fact1>the Spanish and Portuguese navies had suffered serious declines in the 17th century</fact1>. So the answer is {2}.",3.0
history_1954_2c054bf0-1177-4f44-865c-a6e02d20494e,"As of the census of 2000, there were 19,234 people, 7,473 households, and 4,954 families residing in the village. The population density was 10,337.3 people per square mile (3,992.6/km²). There were 7,650 housing units at an average density of 4,111.5/sq mi (1,588.0/km²). The racial makeup of the village was 82.39% White (U.S. Census), 1.03% African American (U.S. Census), 0.29% Native American (U.S. Census), 4.52% Asian (U.S. Census), 0.04% Pacific Islander (U.S. Census), 3.93% from Race (United States Census), and 3.79% from two or more races. 13.03% of the population is Hispanic (U.S. Census) or Latino (U.S. Census) of any race. How many more people, in terms of percentage, were in the two biggest racial groups combined compared to the two smallest groups combined?","Reformatted Question: As of the census of 2000, there were 19,234 people, 7,473 households, and 4,954 families residing in the village. The population density was 10,337.3 people per square mile (3,992.6/km²). There were 7,650 housing units at an average density of 4,111.5/sq mi (1,588.0/km²). The racial makeup of the village was <fact1>82.39% White (U.S. Census)</fact1>, <fact2>1.03% African American (U.S. Census)</fact2>, <fact3>0.29% Native American (U.S. Census)</fact3>, <fact4>4.52% Asian (U.S. Census)</fact4>, <fact5>0.04% Pacific Islander (U.S. Census)</fact5>, 3.93% from Race (United States Census), and 3.79% from two or more races. 13.03% of the population is Hispanic (U.S. Census) or Latino (U.S. Census) of any race. How many more people, in terms of percentage, were in the two biggest racial groups combined compared to the two smallest groups combined?

Answer: According to the passage, the two biggest racial groups are <fact1>White (82.39%)</fact1> and <fact4>Asian (4.52%)</fact4>, and the two smallest groups are <fact5>Pacific Islander (0.04%)</fact5> and <fact3>Native American (0.29%)</fact3>. The sum of the two biggest groups is <fact1>82.39%</fact1> + <fact4>4.52%</fact4> = 86.91%, and the sum of the two smallest groups is <fact5>0.04%</fact5> + <fact3>0.29%</fact3> = 0.33%. The difference between the two sums is 86.91% - 0.33% = 86.58%. So the answer is {86.58}.",95.09
