id,question,answer,gt_number
history_1043_620840b6-98e8-445b-925f-825de189621d,"The Treaty of Karlowitz, signed in January 1699, confirmed the Venetian possession of Kephalonia, and the Morea with the island of Aigina, which became organized as the ""Kingdom of the Morea"" , divided into four provinces: Romania, with seat at Nafplion , Laconia, with seat at Monemvasia , Messenia, with seat at Navarino, and Achaea, with seat at Patras . The war however had created a demographic and economic crisis in the Peloponnese. According to the first census conducted by the Venetians, there were 86,468 people in the peninsula compared to a pre-war population of around 200,000. Although the Venetians managed to restore some prosperity - the population allegedly rose to some 250,000 by 1708, probably driven by immigration - they failed to win the trust of their Greek Orthodox subjects, who were used to a relative autonomy under the Turks and resented the Venetian bureaucracy. The Venetians also launched a great fortification project throughout the Morea, whose results can still be seen today. Nevertheless, Venice itself was too weakened to effectively assert its authority, and in 1715 a swift Ottoman campaign  reclaimed the Morea. Give the population difference before and after the war?","Reformatted Question: The Treaty of Karlowitz, signed in January 1699, confirmed the Venetian possession of Kephalonia, and the Morea with the island of Aigina, which became organized as the ""Kingdom of the Morea"" , divided into four provinces: Romania, with seat at Nafplion , Laconia, with seat at Monemvasia , Messenia, with seat at Navarino, and Achaea, with seat at Patras . The war however had created a demographic and economic crisis in the Peloponnese. According to the first census conducted by the Venetians, there were <fact1>86,468 people in the peninsula</fact1> compared to a <fact2>pre-war population of around 200,000</fact2>. Although the Venetians managed to restore some prosperity - the population allegedly rose to some 250,000 by 1708, probably driven by immigration - they failed to win the trust of their Greek Orthodox subjects, who were used to a relative autonomy under the Turks and resented the Venetian bureaucracy. The Venetians also launched a great fortification project throughout the Morea, whose results can still be seen today. Nevertheless, Venice itself was too weakened to effectively assert its authority, and in 1715 a swift Ottoman campaign  reclaimed the Morea. Give the population difference before and after the war?

Answer: According to the passage, the population before the war was <fact2>around 200,000</fact2> and after the war was <fact1>86,468</fact1>. The difference is <fact2>200,000</fact2> - <fact1>86,468</fact1> = 113,532. So the answer is {113,532}.",0.43
history_148_a8caa28a-01ba-40a3-8e14-b396260afe00,"After successive defeats suffered in the revolutions of 1890 and 1893, and not having achieved free and fair elections, the Radical Civic Union entered a serious crisis, which deepened after 1896 with the suicide of Leandro N. Alem and the death of Aristóbulo del Valle. In 1897, Hipólito Yrigoyen, profoundly disagreeing with the direction of agreements imposed by Bernardo de Irigoyen, dissolved the Committee of the RCU in the province of Buenos Aires, due to which the radical party practically ceased to exist. The dissolution of the Radical Civic Union resulted in the formation of a core of radical elements that recognized as their leader Hipólito Yrigoyen. Onto this core - composed of young men, recruited from the middle class, professionals, businessmen, employees, ranchers of the old federal tradition, settlers and laborers from the countryside - was Yrigoyen able to impose discipline and enthusiasm. In this context, in 1903 Hipólito Yrigoyen began his revival and reorganization. On February 29 of 1904, after 7 years of inactivity, the National Committee of the Radical Civic Union said the electoral abstention of all the radicals of the Republic in the elections of representatives from the nation, senators from the capital, electors for president and vice president of the nation, and announced an armed resistance. How many years after the revolution of 1890 did the next revolution follow for the Radical Civic Union?","Reformatted Question: After successive defeats suffered in the revolutions of <fact1>1890</fact1> and <fact2>1893</fact2>, and not having achieved free and fair elections, the Radical Civic Union entered a serious crisis, which deepened after <fact3>1896</fact3> with the suicide of Leandro N. Alem and the death of Aristóbulo del Valle. In <fact4>1897</fact4>, Hipólito Yrigoyen, profoundly disagreeing with the direction of agreements imposed by Bernardo de Irigoyen, dissolved the Committee of the RCU in the province of Buenos Aires, due to which the radical party practically ceased to exist. The dissolution of the Radical Civic Union resulted in the formation of a core of radical elements that recognized as their leader Hipólito Yrigoyen. Onto this core - composed of young men, recruited from the middle class, professionals, businessmen, employees, ranchers of the old federal tradition, settlers and laborers from the countryside - was Yrigoyen able to impose discipline and enthusiasm. In this context, in <fact5>1903</fact5> Hipólito Yrigoyen began his revival and reorganization. On February 29 of <fact6>1904</fact6>, after 7 years of inactivity, the National Committee of the Radical Civic Union said the electoral abstention of all the radicals of the Republic in the elections of representatives from the nation, senators from the capital, electors for president and vice president of the nation, and announced an armed resistance. How many years after the revolution of 1890 did the next revolution follow for the Radical Civic Union?

Answer: According to the passage, the revolution of <fact1>1890</fact1> was followed by the next revolution in <fact2>1893</fact2>. To find the number of years between these two revolutions, we subtract the year of the first revolution from the year of the second revolution: <fact2>1893</fact2> - <fact1>1890</fact1> = 3. So the answer is {3}.",2.0
history_1356_de7546a7-717a-4e90-bbe1-c50cf0144fde,"As a result of these deaths, Prime Minister Antonio Maura increased the Spanish garrison at Melilla from 5,000 men to 22,000 in preparation for an offensive. All the Spanish forces involved were conscripts; at this stage, Spain had neither professional troops, nor indigenous troops under arms. The Spanish army was poorly trained and equipped and lacked basic maps. The next day, the Spanish troops were shot at by francs-tireurs and skirmishes occurred near Melilla. General Marina decided to post six companies at Ait Aixa, under command of Colonel Álvarez Cabrera. They left Melilla at nightfall but got lost and, in the morning, found themselves in the Alfer Canyon, where they were decimated by gunfire from the heights. Colonel Cabrera and 26 men were killed, and 230 were wounded. On 26 June, the Spanish suffered a second defeat at the Lobo Canyon, when Marina sent another force under General Pintos to protect Segunda Caseta. In this ambush, the Rifians killed General Pintos and 153 men, and wounded some 600 others. How many men died if Colonel Cabrera and 26 men were killed?","Reformatted Question: As a result of these deaths, Prime Minister Antonio Maura increased the Spanish garrison at Melilla from 5,000 men to 22,000 in preparation for an offensive. All the Spanish forces involved were conscripts; at this stage, Spain had neither professional troops, nor indigenous troops under arms. The Spanish army was poorly trained and equipped and lacked basic maps. The next day, the Spanish troops were shot at by francs-tireurs and skirmishes occurred near Melilla. General Marina decided to post six companies at Ait Aixa, under command of Colonel Álvarez Cabrera. They left Melilla at nightfall but got lost and, in the morning, found themselves in the Alfer Canyon, where they were decimated by gunfire from the heights. <fact1>Colonel Cabrera and 26 men were killed</fact1>, and 230 were wounded. On 26 June, the Spanish suffered a second defeat at the Lobo Canyon, when Marina sent another force under General Pintos to protect Segunda Caseta. In this ambush, <fact2>the Rifians killed General Pintos and 153 men</fact2>, and wounded some 600 others. How many men died if <fact1>Colonel Cabrera and 26 men were killed</fact1>?
Answer: According to the passage, <fact1>Colonel Cabrera and 26 men were killed</fact1> and <fact2>the Rifians killed General Pintos and 153 men</fact2>. To find the total number of men who died, we need to add the number of men killed in both incidents. <fact1>26</fact1> + <fact2>153</fact2> + 2 (Colonel Cabrera and General Pintos) = 181. So the answer is {181}.",27.0
history_241_39b1772e-28ba-44d4-be18-52f24d87bf09,"The popular uprising included large areas of Lower Bavaria, the Innviertel and eastern Bavaria. The lands adjoining towns and strongholds were captured by the rebels and the peasant uprising spread to the Bavarian Forest, parts of the Upper Palatinate and Kelheim on the Danube. A Braunau Parliament meeting was held in December 1705 in the then-Bavarian Braunau. Long before the French Revolution and early German parliamentarianism the meeting was held on 21 December 1705 in an inn belonging to the Baron von Paumgarten; representatives met of the four estates in Bavaria: aristocracy, clergy, burghers and peasants. The Braunau Parliament  is the name of the congress on the defence of the state of Bavaria held at Braunau am Inn convened on 21 December 1705. Following the initial uprising in November 1705, there was little response from the Austrians for nearly two months. However, that changed following an attempt by the rebels to capture the Bavarian capital, Munich. Following their unsuccessful attack, the night of 25 December 1705 saw an Austrian column encounter the peasant army near Sendling outside of Munich.  The battle was known as Sendling's Night of Murder  or the Sendling Christmas Day Massacre. The insurgents from the Bavarian Oberland were defeated and completely routed by Emperor Joseph I's troops. The number of deaths on the Bavarian side in this battle is estimated at around 1,100 men, but the Austrians lost only about 40. Some of the insurgents were killed after they had already surrendered.  About two weeks later, on 8 January 1706, the Battle of Aidenbach ended with the utter defeat of the insurgents and about 4,000 casualties on the Bavarian side. That led to the collapse of the uprising against Austria. what is the difference in casualty numbers between Bavarian and Austrian?","Reformatted Question: The popular uprising included large areas of Lower Bavaria, the Innviertel and eastern Bavaria. The lands adjoining towns and strongholds were captured by the rebels and the peasant uprising spread to the Bavarian Forest, parts of the Upper Palatinate and Kelheim on the Danube. A Braunau Parliament meeting was held in December 1705 in the then-Bavarian Braunau. Long before the French Revolution and early German parliamentarianism the meeting was held on 21 December 1705 in an inn belonging to the Baron von Paumgarten; representatives met of the four estates in Bavaria: aristocracy, clergy, burghers and peasants. The Braunau Parliament  is the name of the congress on the defence of the state of Bavaria held at Braunau am Inn convened on 21 December 1705. Following the initial uprising in November 1705, there was little response from the Austrians for nearly two months. However, that changed following an attempt by the rebels to capture the Bavarian capital, Munich. Following their unsuccessful attack, the night of 25 December 1705 saw an Austrian column encounter the peasant army near Sendling outside of Munich.  The battle was known as Sendling's Night of Murder  or the Sendling Christmas Day Massacre. The insurgents from the Bavarian Oberland were defeated and completely routed by Emperor Joseph I's troops. The number of deaths on the <fact1>Bavarian side in this battle is estimated at around 1,100 men</fact1>, but the <fact2>Austrians lost only about 40</fact2>. Some of the insurgents were killed after they had already surrendered.  About two weeks later, on 8 January 1706, the Battle of Aidenbach ended with the utter defeat of the insurgents and about <fact3>4,000 casualties on the Bavarian side</fact3>. That led to the collapse of the uprising against Austria. what is the difference in casualty numbers between <fact4>Bavarian</fact4> and <fact5>Austrian</fact5>?

Answer: According to the passage, <fact1>the Bavarian side lost 1,100 men</fact1> and <fact3>4,000 casualties in another battle</fact3>, for a total of 1,100 + 4,000 = 5,100 casualties. <fact2>The Austrians lost 40 men</fact2>. The difference in casualty numbers between <fact4>Bavarian</fact4> and <fact5>Austrian</fact5> is 5,100 - 40 = 5,060. So the answer is {5,060}.",1060.0
history_241_0ac9c4ec-9ef4-429b-970a-9af43bdb672b,"The popular uprising included large areas of Lower Bavaria, the Innviertel and eastern Bavaria. The lands adjoining towns and strongholds were captured by the rebels and the peasant uprising spread to the Bavarian Forest, parts of the Upper Palatinate and Kelheim on the Danube. A Braunau Parliament meeting was held in December 1705 in the then-Bavarian Braunau. Long before the French Revolution and early German parliamentarianism the meeting was held on 21 December 1705 in an inn belonging to the Baron von Paumgarten; representatives met of the four estates in Bavaria: aristocracy, clergy, burghers and peasants. The Braunau Parliament  is the name of the congress on the defence of the state of Bavaria held at Braunau am Inn convened on 21 December 1705. Following the initial uprising in November 1705, there was little response from the Austrians for nearly two months. However, that changed following an attempt by the rebels to capture the Bavarian capital, Munich. Following their unsuccessful attack, the night of 25 December 1705 saw an Austrian column encounter the peasant army near Sendling outside of Munich.  The battle was known as Sendling's Night of Murder  or the Sendling Christmas Day Massacre. The insurgents from the Bavarian Oberland were defeated and completely routed by Emperor Joseph I's troops. The number of deaths on the Bavarian side in this battle is estimated at around 1,100 men, but the Austrians lost only about 40. Some of the insurgents were killed after they had already surrendered.  About two weeks later, on 8 January 1706, the Battle of Aidenbach ended with the utter defeat of the insurgents and about 4,000 casualties on the Bavarian side. That led to the collapse of the uprising against Austria. How many regions did the popular uprising start in?","Reformatted Question: The popular uprising included large areas of <fact1>Lower Bavaria</fact1>, <fact2>the Innviertel</fact2> and <fact3>eastern Bavaria</fact3>. The lands adjoining towns and strongholds were captured by the rebels and the peasant uprising spread to <fact4>the Bavarian Forest</fact4>, parts of <fact5>the Upper Palatinate</fact5> and <fact6>Kelheim on the Danube</fact6>. A Braunau Parliament meeting was held in December 1705 in the then-Bavarian Braunau. Long before the French Revolution and early German parliamentarianism the meeting was held on 21 December 1705 in an inn belonging to the Baron von Paumgarten; representatives met of the four estates in Bavaria: aristocracy, clergy, burghers and peasants. The Braunau Parliament  is the name of the congress on the defence of the state of Bavaria held at Braunau am Inn convened on 21 December 1705. Following the initial uprising in November 1705, there was little response from the Austrians for nearly two months. However, that changed following an attempt by the rebels to capture the Bavarian capital, Munich. Following their unsuccessful attack, the night of 25 December 1705 saw an Austrian column encounter the peasant army near Sendling outside of Munich.  The battle was known as Sendling's Night of Murder  or the Sendling Christmas Day Massacre. The insurgents from the Bavarian Oberland were defeated and completely routed by Emperor Joseph I's troops. The number of deaths on the Bavarian side in this battle is estimated at around 1,100 men, but the Austrians lost only about 40. Some of the insurgents were killed after they had already surrendered.  About two weeks later, on 8 January 1706, the Battle of Aidenbach ended with the utter defeat of the insurgents and about 4,000 casualties on the Bavarian side. That led to the collapse of the uprising against Austria. How many regions did the popular uprising start in?

Answer: According to the passage, the popular uprising started in <fact1>Lower Bavaria</fact1>, <fact2>the Innviertel</fact2>, and <fact3>eastern Bavaria</fact3> initially, then spread to <fact4>the Bavarian Forest</fact4>, <fact5>the Upper Palatinate</fact5>, and <fact6>Kelheim on the Danube</fact6>. So the answer is {6}.",3.0
history_1898_421eb770-cd50-489c-9c1c-f10688c05c3b,"There were 1,882 households of which 21.4% had children under the age of 18 living with them, 36.4% were Marriage living together, 9.7% had a female householder with no husband present, 3.6% had a male householder with no wife present, and 50.4% were non-families. 37.7% of all households were made up of individuals and 13% had someone living alone who was 65 years of age or older. The average household size was 2.20 and the average family size was 2.90. How many percent higher was the average family size compared to the average household size?","Reformatted Question: There were 1,882 households of which 21.4% had children under the age of 18 living with them, 36.4% were Marriage living together, 9.7% had a female householder with no husband present, 3.6% had a male householder with no wife present, and 50.4% were non-families. 37.7% of all households were made up of individuals and 13% had someone living alone who was 65 years of age or older. The <fact1>average household size was 2.20</fact1> and the <fact2>average family size was 2.90</fact2>. How many percent higher was the average family size compared to the average household size?

Answer: According to the passage, the <fact2>average family size was 2.90</fact2> and the <fact1>average household size was 2.20</fact1>. To find the percentage difference, we need to calculate ((<fact2>2.90</fact2> - <fact1>2.20</fact1>) / <fact1>2.20</fact1>) * 100. ((<fact2>2.90</fact2> - <fact1>2.20</fact1>) = 0.70, 0.70 / <fact1>2.20</fact1> = 0.31818, 0.31818 * 100 = 31.818). So the answer is {31.82}.",0.0
history_1298_65816218-01c4-4071-b10e-32018bf3555f,"Some sources state that three million Circassians were evicted from Circassia in a period lasting until 1911. Other sources cite upwards of two million Circassian refugees fleeing Circassia by 1914 and entering nations and regions such as the Balkans, Turkey, what was the Ottoman Empire in what was known as the Muhajir, Iran, the Qajar dynasty also as Muhajir, Syria, Lebanon, what is now Jordan, Kosovo, Egypt , Israel  and as far afield as upstate New York and New Jersey. Some 90 percent of people with Circassian descent now live in other countries, primarily in Turkey, Jordan and other countries of the Middle East, with only 300,000-400,000 remaining in what is now Russia. The depopulated Circassian lands were resettled by numerous ethnic groups, including Russians, Ukrainians and Georgians. Friction developed between the latter group and the remaining indigenous people in Abkhazia, a factor later contributing to friction between the two ethnic groups and the resulting War in Abkhazia. How many countries were Circassian refugees thought to be fleeing to?","Reformatted Question: Some sources state that three million Circassians were evicted from Circassia in a period lasting until 1911. Other sources cite upwards of two million Circassian refugees fleeing Circassia by 1914 and entering nations and regions such as <fact1>the Balkans</fact1>, <fact2>Turkey</fact2>, what was the <fact3>Ottoman Empire</fact3> in what was known as the Muhajir, <fact4>Iran</fact4>, the Qajar dynasty also as Muhajir, <fact5>Syria</fact5>, <fact6>Lebanon</fact6>, what is now <fact7>Jordan</fact7>, <fact8>Kosovo</fact8>, <fact9>Egypt</fact9>, <fact10>Israel</fact10> and as far afield as upstate <fact11>New York</fact11> and <fact12>New Jersey</fact12>. Some 90 percent of people with Circassian descent now live in other countries, primarily in <fact2>Turkey</fact2>, <fact7>Jordan</fact7> and other countries of the Middle East, with only 300,000-400,000 remaining in what is now Russia. The depopulated Circassian lands were resettled by numerous ethnic groups, including Russians, Ukrainians and Georgians. Friction developed between the latter group and the remaining indigenous people in Abkhazia, a factor later contributing to friction between the two ethnic groups and the resulting War in Abkhazia. How many countries were Circassian refugees thought to be fleeing to?

Answer: According to the passage, Circassian refugees were fleeing to <fact1>the Balkans</fact1>, <fact2>Turkey</fact2>, <fact3>the Ottoman Empire</fact3>, <fact4>Iran</fact4>, <fact5>Syria</fact5>, <fact6>Lebanon</fact6>, <fact7>Jordan</fact7>, <fact8>Kosovo</fact8>, <fact9>Egypt</fact9>, <fact10>Israel</fact10>, <fact11>New York</fact11> in the United States, and <fact12>New Jersey</fact12> in the United States. However, note that the <fact3>Ottoman Empire</fact3> is now part of <fact2>Turkey</fact2>, and <fact11>New York</fact11> and <fact12>New Jersey</fact12> are not countries but states in the United States. Also, <fact1>the Balkans</fact1> is a region, not a country, and <fact8>Kosovo</fact8> was not fully recognized as a country at the time of the migration, though it is now partially recognized. Therefore, the actual countries that were fled to are <fact2>Turkey</fact2>, <fact4>Iran</fact4>, <fact5>Syria</fact5>, <fact6>Lebanon</fact6>, <fact7>Jordan</fact7>, <fact9>Egypt</fact9>, <fact10>Israel</fact10>, and the United States. So the answer is {8}.",12.0
history_1002_d8ee2dcc-91d9-4e9b-914c-f1dbd2b504e0,"After the fall of Pegu in December 1599, Lower Burma was in utter chaos, and politically fragmented among Toungoo, Prome, Arakanese/Portuguese Syriam and Siamese Martaban. In Upper Burma, however, Nyaungyan, viceroy of Ava, had been quietly consolidating his holdings since 1597. Though nominally loyal to Nanda, Nyaungyan provided no support to his overlord. In October 1599, just as Toungoo and Arakanese were laying siege on Pegu, Nyaungyan sent a force to reclaim Mohnyin, Mogaung, and Bhamo. After Pegu fell, Nyaungyan declared himself king on 25 February 1600. Nyaungyan then systematically reacquired nearer Shan states. He captured Nyaungshwe in February 1601, and the large strategic Shan state of Mone in July 1603, bringing his realm to the border of Siamese Lan Na. In response, Naresuan of Siam marched in early 1605 to attack Mone but died at the border in April after which Siam ceased to be a military concern to Burma. In early 1606, his 7,000-strong forces took Theinni, Thibaw and Momeik but the king died during the campaign on 3 March 1606. How many years after Pegu fell did the king die?","Reformatted Question: After the fall of <fact1>Pegu in December 1599</fact1>, Lower Burma was in utter chaos, and politically fragmented among Toungoo, Prome, Arakanese/Portuguese Syriam and Siamese Martaban. In Upper Burma, however, Nyaungyan, viceroy of Ava, had been quietly consolidating his holdings since 1597. Though nominally loyal to Nanda, Nyaungyan provided no support to his overlord. In October 1599, just as Toungoo and Arakanese were laying siege on Pegu, Nyaungyan sent a force to reclaim Mohnyin, Mogaung, and Bhamo. After <fact1>Pegu fell</fact1>, Nyaungyan declared himself king on 25 February 1600. Nyaungyan then systematically reacquired nearer Shan states. He captured Nyaungshwe in February 1601, and the large strategic Shan state of Mone in July 1603, bringing his realm to the border of Siamese Lan Na. In response, Naresuan of Siam marched in early 1605 to attack Mone but died at the border in April after which Siam ceased to be a military concern to Burma. In early 1606, his 7,000-strong forces took Theinni, Thibaw and Momeik but <fact2>the king died during the campaign on 3 March 1606</fact2>. How many years after <fact1>Pegu fell</fact1> did <fact2>the king die</fact2>?

Answer: According to the passage, <fact1>Pegu fell in December 1599</fact1> and <fact2>the king died in 1606</fact2>. <fact2>1606</fact2> - <fact1>1599</fact1> = 7. So the answer is {6}.",7.0
