id,question,gt,isTrue,isTagged,dataset,unique_id
43,"Reformatted Question: Benjamin went to their orchard to pick some strawberries and found nine times as many caterpillars as ladybugs in the garden. If there were 99 ladybugs, calculate the total number of insects in the garden.

Answer: Since there are nine times as many caterpillars as ladybugs, the number of caterpillars is 9 * 99 ladybugs = 891 caterpillars. The total number of insects in the garden is the sum of the number of ladybugs and caterpillars, which is 99 ladybugs + 891 caterpillars = 990 insects.
The answer is {990}.",990.0,1,0,symbolic,2196
28,"Reformatted Question: A medical center has a capacity of 1600 wards with 1/10 occupied. Due to the major accident, 35 patients are admitted into the medical center each day. Calculate the total number of unoccupied wards in the medical center after 4 weeks.

Answer: The number of occupied wards initially is 1600 wards * 1/10 = 160 wards. 
The number of unoccupied wards initially is 1600 wards - 160 wards = 1440 wards.
There are 4 weeks * 7 days/week = 28 days in 4 weeks.
The number of patients admitted in 4 weeks is 35 patients/day * 28 days = 980 patients.
Assuming each patient occupies one ward, the number of occupied wards after 4 weeks is 160 wards + 980 wards = 1140 wards.
The number of unoccupied wards after 4 weeks is 1600 wards - 1140 wards = 460 wards.
The answer is {460}.",460.0,1,0,symbolic,1449
43,"Reformatted Question: Thiago went to their orchard to pick some strawberries and found 2/3 as many grasshoppers as wasps in the garden. If there were 144 wasps, calculate the total number of insects in the garden.

Answer: To find the number of grasshoppers, we need to multiply the number of wasps by 2/3. So, the number of grasshoppers is 144 * 2/3 = 96. The total number of insects in the garden is the sum of the number of wasps and grasshoppers, which is 144 + 96 = 240.
The answer is {240}.",240.0,1,0,symbolic,2164
8,"Reformatted Question: A juggler can juggle 960 balls. An eighth of the balls are tennis balls, and 1/5 of the tennis balls are indigo. How many indigo tennis balls are there?

Answer: First, we need to find out how many tennis balls there are. Since an eighth of the balls are tennis balls, we can calculate the number of tennis balls by dividing the total number of balls by 8. So, the number of tennis balls is 960 / 8 = 120. 

Next, we need to find out how many of these tennis balls are indigo. Since 1/5 of the tennis balls are indigo, we can calculate the number of indigo tennis balls by dividing the number of tennis balls by 5 and then multiplying by 1. So, the number of indigo tennis balls is 120 / 5 = 24.

The answer is {24}.",24.0,1,0,symbolic,412
62,"Reformatted Question: In a set of chef's cards, there are 25 yellow cards, and 76% more orange cards. Green cards are as many as the sum of yellow and orange cards. How many cards of all mentioned colors are there?

Answer: First, we need to find the number of orange cards. Since there are 76% more orange cards than yellow cards, we can calculate the number of orange cards by finding 76% of the number of yellow cards and adding it to the number of yellow cards. 76% of 25 yellow cards is 0.76 * 25 = 19. So, there are 25 + 19 = 44 orange cards.

Now, we know that green cards are as many as the sum of yellow and orange cards. Therefore, the number of green cards is 25 yellow cards + 44 orange cards = 69 green cards.

To find the total number of cards of all mentioned colors, we add the number of yellow, orange, and green cards: 25 yellow cards + 44 orange cards + 69 green cards = 138 cards.

The answer is {138}.",138.0,1,0,symbolic,3131
8,"Reformatted Question: A juggler can juggle 680 balls. Half of the balls are golf balls, and 1/5 of the golf balls are green. How many green golf balls are there?

Answer: First, we need to find out how many golf balls there are. Since half of the balls are golf balls, we can calculate the number of golf balls by dividing the total number of balls by 2. So, the number of golf balls is 680 / 2 = 340.

Next, we need to find out how many of these golf balls are green. Since 1/5 of the golf balls are green, we can calculate the number of green golf balls by multiplying the number of golf balls by 1/5. So, the number of green golf balls is 340 * 1/5 = 68.

The answer is {68}.",68.0,1,0,symbolic,410
57,"Reformatted Question: Diego has 18 tubes of black paint and 19 tubes of magenta paint. Umar has two-sixths as many tubes of black paint as Diego, and six times as many tubes of magenta paint as Diego. How many tubes of paint does Umar have?

Answer: Umar has two-sixths as many tubes of black paint as Diego, so Umar has (18 tubes of black paint)*(2/6) = 6 tubes of black paint. Umar also has six times as many tubes of magenta paint as Diego, so Umar has (19 tubes of magenta paint)*6 = 114 tubes of magenta paint. Therefore, Umar has 6 + 114 = 120 tubes of paint.
The answer is {120}.",120.0,1,0,symbolic,2896
23,"Reformatted Question: Valeria is knitting winter wear for her 4 grandchildren. They're quadruplets, so they're all the same size. She wants to make a shawl, vest, hat, socks, and leg warmers for each of them. It takes 9 skeins of wool to make a shawl, 16 for a vest, 15 for a hat, 4 for a pair of socks, and 17 for a pair of leg warmers. How many skeins of wool will she need to buy?

Answer: Valeria needs to make a set of shawl, vest, hat, socks, and leg warmers for each of her 4 grandchildren. For each set, she needs 9 skeins of wool for a shawl + 16 skeins for a vest + 15 skeins for a hat + 4 skeins for a pair of socks + 17 skeins for a pair of leg warmers = 9 + 16 + 15 + 4 + 17 = 61 skeins of wool. Since she needs to make 4 sets, she will need 61 * 4 = 244 skeins of wool.
The answer is {244}.",244.0,1,0,symbolic,1172
26,"Reformatted Question: A father eats 7 sushi rolls per day, his wife eats 4 sushi rolls per day, and their daughter eats 3 sushi rolls per day. How many sushi rolls does this family eat in one month?

Answer: To find the total number of sushi rolls the family eats in one month, we need to calculate the total number of sushi rolls each person eats in a month and then add them together. 

Since there are approximately 30 days in one month, the father eats 7 sushi rolls per day * 30 days = 210 sushi rolls per month. 

The wife eats 4 sushi rolls per day * 30 days = 120 sushi rolls per month. 

The daughter eats 3 sushi rolls per day * 30 days = 90 sushi rolls per month. 

Therefore, the total number of sushi rolls the family eats in one month is 210 + 120 + 90 = 420 sushi rolls.

The answer is {420}.",420.0,1,0,symbolic,1346
79,"Reformatted Question: Gabriel finished two-thirds of a 294 piece puzzle, and then started and finished another 358 piece puzzle within an hour. How many puzzle pieces did Gabriel place during that hour?

Answer: Gabriel finished two-thirds of a 294 piece puzzle, which is (2/3) * 294 = 196 pieces. Then he finished a 358 piece puzzle. So in total, he placed 196 + 358 = 554 pieces. 
The answer is {554}.",554.0,1,0,symbolic,3962
75,"Reformatted Question: There are currently 3 pink balls, 16 orange balls, and 35 green balls in the shop. Pink balls cost ₺6, green balls cost ₺7, and orange balls cost ₺5. How much will the shop have received after all the balls are sold?

Answer: The shop will receive 3 * ₺6 = ₺18 from the pink balls, 16 * ₺5 = ₺80 from the orange balls, and 35 * ₺7 = ₺245 from the green balls. Therefore, the total amount the shop will receive is ₺18 + ₺80 + ₺245 = ₺343.
The answer is {343}.",343.0,1,0,symbolic,3774
50,"Reformatted Question: The area of Noah's rectangular kitchen is 810 square meters. If the length of his room is 6 meters, what is the perimeter of the room in meters?

Answer: To find the perimeter of the room, we need to find the width of the room first. Since the area of the room is given as 810 square meters and the area of a rectangle is calculated as length times width, we can set up the equation: 6 meters * width = 810 square meters. Solving for width, we get width = 810 square meters / 6 meters = 135 meters. Now that we have the length and width, we can calculate the perimeter of the room using the formula: perimeter = 2 * (length + width). Plugging in the values, we get perimeter = 2 * (6 meters + 135 meters) = 2 * 141 meters = 282 meters.
The answer is {282}.",282.0,1,0,symbolic,2538
55,"Reformatted Question: Tara is learning to write and decides to keep re-writing the Farsi alphabet (with 32 letters) until she knows it. She writes it in full four times, writes one-fourth of it once, then re-writes everything she has already written. How many letters has Tara written in total?

Answer: Tara first writes the alphabet in full four times, which is 32 letters * 4 = 128 letters. Then she writes one-fourth of the alphabet, which is 32 letters / 4 = 8 letters. So far, she has written 128 + 8 = 136 letters. Then she re-writes everything she has already written, which is another 136 letters. In total, Tara has written 136 + 136 = 272 letters.
The answer is {272}.",272.0,1,0,symbolic,2758
41,"Reformatted Question: A stack is made out of 2 green tiles, seven times as many orange tiles, and an unknown number of black tiles. If there are 46 tiles in the stack in total, how many black tiles are there?

Answer: There are 2 green tiles. Since there are seven times as many orange tiles as green tiles, there are 7 * 2 = 14 orange tiles. We know that there are 46 tiles in total, so the number of black tiles is 46 - 2 - 14 = 30.
The answer is {30}.",30.0,1,0,symbolic,2063
26,"Reformatted Question: A grandfather eats 7 burritos per day, his partner eats 7 burritos per day, and their son eats 7 burritos per day. How many burritos does this family eat in one week?

Answer: The total number of burritos the family eats per day is 7 + 7 + 7 = 21. Since there are 7 days in one week, the family eats a total of 21 * 7 = 147 burritos in one week.
The answer is {147}.",147.0,1,0,symbolic,1342
68,"Reformatted Question: It takes Aisha 16 minutes to finish a word puzzle and 10 minutes to finish a brain teaser. Over the day off she solved 6 word puzzles and 14 brain teasers. How much time did she spend playing these games?

Answer: Aisha spent 16 minutes per word puzzle * 6 word puzzles = 96 minutes on word puzzles. She also spent 10 minutes per brain teaser * 14 brain teasers = 140 minutes on brain teasers. Therefore, she spent a total of 96 + 140 = 236 minutes playing these games.
The answer is {236}.",236.0,1,0,symbolic,3430
44,"Reformatted Question: There are 15 girls in the playground. If there are 3/5 the number of boys in the playground, how many kids are in the playground?

Answer: To find the number of boys, we need to calculate 3/5 of the number of girls. Since there are 15 girls, we multiply 15 by 3/5. 
3/5 * 15 = (3 * 15) / 5 = 45 / 5 = 9. 
So, there are 9 boys in the playground. 
The total number of kids in the playground is the sum of the number of girls and boys, which is 15 + 9 = 24.
The answer is {24}.",24.0,1,0,symbolic,2209
23,"Reformatted Question: Winnie is knitting winter wear for her 3 grandchildren. They're triplets, so they're all the same size. She wants to make a poncho, sweater, vest, leg warmers, and socks for each of them. It takes 5 skeins of wool to make a poncho, 18 for a sweater, 9 for a vest, 6 for a pair of leg warmers, and 4 for a pair of socks. How many skeins of wool will she need to buy?

Answer: To determine how many skeins of wool Winnie will need, we must first calculate how many skeins of wool are needed for one set of winter wear. One set of winter wear includes a poncho, sweater, vest, leg warmers, and socks. So, one set of winter wear requires 5 skeins of wool + 18 skeins of wool + 9 skeins of wool + 6 skeins of wool + 4 skeins of wool = 42 skeins of wool. Since Winnie has 3 grandchildren, she will need 3 x 42 = 126 skeins of wool.
The answer is {126}.",126.0,1,0,symbolic,1179
57,"Reformatted Question: Benjamin has 18 tubes of blue paint and 18 tubes of cyan paint. Deshawn has 2/4 as many tubes of blue paint as Benjamin, and twice as many tubes of cyan paint as Benjamin. How many tubes of paint does DeShawn have?

Answer: Deshawn has 2/4 as many tubes of blue paint as Benjamin, so he has 18 * 2/4 = 9 tubes of blue paint. Deshawn also has twice as many tubes of cyan paint as Benjamin, so he has 18 * 2 = 36 tubes of cyan paint. Therefore, Deshawn has 9 + 36 = 45 tubes of paint.

The answer is {45}.",45.0,1,0,symbolic,2861
89,"Reformatted Question: Liam hires a luxury car from 3 PM to 9 PM. He gets 1 hour free. The first paid hour is $13 and each hour after that is twice the cost. How much did he pay?

Answer: First, we need to calculate the total number of hours Liam hired the car. He hired it from 3 PM to 9 PM, which is 6 hours. Since he gets 1 hour free, he only needs to pay for 6 - 1 = 5 hours. The first paid hour is $13. For the remaining 4 hours, each hour after that is twice the cost, so each hour costs $13 * 2 = $26. Therefore, the total cost is $13 + ($26 * 4) = $13 + $104 = $117.

The answer is {117}.",117.0,1,0,symbolic,4471
13,"Reformatted Question: Yara is an avid gardener. Last week, she received 38 new potted plants from her favorite plant nursery. She already has 11 potted plants on each of the 51 window ledges of her large country home. Feeling generous, she has decided that she will give 6 potted plants from each ledge to friends and family tomorrow. How many potted plants will Yara remain with?

Answer: Yara originally had 11 potted plants on each of the 51 window ledges, so she had 11 * 51 = 561 potted plants. She then received 38 new potted plants, bringing her total to 561 + 38 = 599 potted plants. She then gave away 6 potted plants from each ledge, so she gave away 6 * 51 = 306 potted plants. Therefore, Yara will remain with 599 - 306 = 293 potted plants.
The answer is {293}.",293.0,1,0,symbolic,699
97,"Reformatted Question: Haruka operates the cash register exactly eight times as fast as her less-experienced colleague Yara. Daily, Yara processes 90 customers. What is the total weekly production for the two if they work all days of the week?

Answer: Since Haruka operates the cash register eight times as fast as Yara, she processes 8 * 90 customers = 720 customers per day. Together, they process 90 customers + 720 customers = 810 customers per day. Since they work all days of the week, which is 7 days, their total weekly production is 810 customers/day * 7 days = 5670 customers.
The answer is {5670}.",5670.0,1,0,symbolic,4866
56,"Reformatted Question: A bottle of lemonade is 12 ounces of lemonade. Mateo drinks 3 bottles of lemonade. If lemonade has 4 calories per ounce how many calories did he consume?

Answer: Mateo consumed 3 bottles of lemonade * 12 ounces of lemonade = 36 ounces of lemonade. Since lemonade has 4 calories per ounce, Mateo consumed 36 ounces * 4 calories per ounce = 144 calories.
The answer is {144}.",144.0,1,0,symbolic,2833
97,"Reformatted Question: Mia operates the cash register exactly two times as fast as her less-experienced colleague Haruka. Daily, Haruka processes 63 customers. What is the total weekly production for the two if they work all days of the week?

Answer: Since Mia operates the cash register two times as fast as Haruka, Mia processes 2 * 63 customers = 126 customers daily. Together, they process 63 customers + 126 customers = 189 customers daily. Since they work all days of the week, which is 7 days, their total weekly production is 189 customers/day * 7 days = 1323 customers.
The answer is {1323}.",1323.0,1,0,symbolic,4889
12,"Reformatted Question: Andre places bananas on some baskets. Each basket can hold 20 bananas. If he has 326 bananas and 8 baskets, how many bananas won't he be able to place on the basket?

Answer: To find out how many bananas Andre can place on the baskets, we need to multiply the number of baskets by the capacity of each basket. So, 8 baskets * 20 bananas per basket = 160 bananas. Since Andre has 326 bananas, we subtract the number of bananas he can place on the baskets from the total number of bananas: 326 bananas - 160 bananas = 166 bananas. Therefore, Andre won't be able to place 166 bananas on the baskets.

The answer is {166}.",166.0,1,0,symbolic,629
50,"Reformatted Question: The area of Santiago's rectangular study is 600 square meters. If the length of his room is 5 meters, what is the perimeter of the room in meters?

Answer: To find the perimeter of the room, we need to know the width of the room. We can find the width by dividing the area of the room by the length. The area of the room is 600 square meters and the length is 5 meters, so the width is 600 / 5 = 120 meters. The perimeter of a rectangle is given by the formula P = 2(l + w), where l is the length and w is the width. Plugging in the values, we get P = 2(5 + 120) = 2(125) = 250 meters.
The answer is {250}.",250.0,1,0,symbolic,2514
95,"Reformatted Question: There are 20 students playing badminton and thrice that number playing basketball. There are 17 boys and 20 girls playing volleyball. If each student only participates in one group, how many students are there in total?

Answer: There are 20 students playing badminton. Since there are thrice that number playing basketball, there are 3 * 20 = 60 students playing basketball. There are 17 boys and 20 girls playing volleyball, so there are 17 + 20 = 37 students playing volleyball. In total, there are 20 + 60 + 37 = 117 students.

The answer is {117}.",117.0,1,0,symbolic,4771
70,"Reformatted Question: A carpenter works for 3 weeks every month and for 6 days every week. If he gets paid ¥50 every day, how much does he earn if he works for a year?

Answer: Since the carpenter works for 3 weeks every month and there are approximately 4 weeks in a month, he works for approximately 3/4 of the month. Since he works for 6 days every week and there are 7 days in a week, he works for 6/7 of the week. Since there are 52 weeks in a year, he works for approximately (3/4) * (6/7) * 52 = 3 * 6 * 52 / (4 * 7) = 3 * 6 * 13 * 4 / 7 = 936 / 7 * 3 = 36 * 13 * 3 / 7 * 3 = 36 * 13 = 468 days in a year. Since he gets paid ¥50 every day, he earns 468 * 50 = ¥23400 in a year.
The answer is {23400}.",10800.0,0,0,symbolic,3520
70,"Reformatted Question: A plumber works for 3 weeks every month and for 6 days every week. If he gets paid $180 every day, how much does he earn if he works for a year?

Answer: Since the plumber works for 3 weeks every month and there are approximately 4 weeks in a month, he works for approximately 3/4 of the month. Since he works for 6 days every week and there are 7 days in a week, he works for 6/7 of the week. Since there are 52 weeks in a year, the plumber works for approximately (3/4) * (6/7) * 52 = 3 * 6 * 13/7 = 234/7 * 6 = 1404/7 = 200.57 weeks, or approximately 200.57 * (6/7) * 7 = 200.57 * 6 = 1203.42 days, in a year. Since he gets paid $180 every day, he earns approximately 1203.42 * 180 = 216,615.6 or $216,616 per year (rounding up from 216,615.6 to 216,616).",38880.0,0,0,symbolic,3543
83,"Reformatted Question: The Williams family is busy making cupcakes. So far, they've made 6075 cupcakes. They have 1833 vanilla cupcakes, 2596 blueberry cupcakes, and some peanut butter cupcakes. How many peanut butter cupcakes have they made?

Answer: To find the number of peanut butter cupcakes, we need to subtract the number of vanilla and blueberry cupcakes from the total number of cupcakes. The number of vanilla and blueberry cupcakes is 1833 + 2596 = 4430. Subtracting this from the total number of cupcakes, we get 6075 - 4430 = 1645. Therefore, the Williams family has made 1645 peanut butter cupcakes.
The answer is {1645}.",1646.0,0,0,symbolic,4179
83,"Reformatted Question: The Johnson family is busy making muffins. So far, they've made 6900 muffins. They have 2066 blueberry muffins, 1753 lemon muffins, and some strawberry muffins. How many strawberry muffins have they made?

Answer: To find the number of strawberry muffins, we need to subtract the number of blueberry and lemon muffins from the total number of muffins. The number of blueberry and lemon muffins is 2066 + 1753 = 3820. Subtracting this from the total number of muffins, we get 6900 - 3820 = 3080 strawberry muffins.
The answer is {3080}.",3081.0,0,0,symbolic,4183
89,"Reformatted Question: Luis hires a boat from 4 PM to 10 PM. He gets 2 hours free. The first paid hour is ₺12 and each hour after that is twice the cost. How much did he pay?

Answer: Luis hires the boat for 6 hours. Since he gets 2 hours free, he has to pay for 6 - 2 = 4 hours. The first paid hour is ₺12. Each hour after that is twice the cost, so the second paid hour is ₺12 * 2 = ₺24, the third paid hour is ₺24 * 2 = ₺48, and the fourth paid hour is ₺48 * 2 = ₺96. Therefore, the total amount Luis paid is ₺12 + ₺24 + ₺48 + ₺96 = ₺180.
The answer is {180}.",84.0,0,0,symbolic,4478
14,"Reformatted Question: Leilani and Mateo have 192 minutes to walk to the mall together starting from their home. It takes them 13 minutes to get to the corner where the gym is. It takes them another 42 minutes to get to the library. When they reach the library, they remember they forgot their wallets at home, so they have to return to pick up their wallets and then walk all the way back to the library again. Once they reach the library for the second time, how much longer do they have to get to the mall without being late?

Answer: It takes them 13 minutes + 42 minutes = 55 minutes to get to the library. Since they have to return home and then walk back to the library, they spend 55 * 2 = 110 minutes walking to the library and back. They have 192 minutes - 110 minutes = 82 minutes left to get to the mall without being late.
The answer is {82}.",27.0,0,0,symbolic,644
14,"Reformatted Question: Valeria and Luis have 182 minutes to walk to the library together starting from their home. It takes them 12 minutes to get to the corner where the park is. It takes them another 12 minutes to get to the grocery store. When they reach the grocery store, they remember they forgot their wallets at home, so they have to return to pick up their wallets and then walk all the way back to the grocery store again. Once they reach the grocery store for the second time, how much longer do they have to get to the library without being late?

Answer: To get to the grocery store, it takes Valeria and Luis 12 minutes + 12 minutes = 24 minutes. 
Since they have to return home and then go back to the grocery store, they spend 24 * 2 = 48 minutes to get to the grocery store and back home and then get back to the grocery store again. 
So far, they have spent 48 minutes, and they have 182 minutes - 48 minutes = 134 minutes left to get to the library without being late.
The answer is {134}.",110.0,0,0,symbolic,656
1,"Reformatted Question: A fog bank rolls in from the ocean to cover a city. It takes 241 minutes to cover every 5 miles of the city. If the city is 85 miles across from the oceanfront to the opposite inland edge, how many minutes will it take for the fog bank to cover the whole city?

Answer: To find the total time it will take for the fog bank to cover the whole city, we need to divide the total distance across the city by the distance covered in the given time and then multiply by the given time. The total distance across the city is 85 miles and the distance covered in the given time is 5 miles. So, the number of times the given distance fits into the total distance is 85/5 = 17. Now, we multiply this by the given time, which is 241 minutes. Therefore, the total time it will take for the fog bank to cover the whole city is 17 * 241 minutes = 4100 minutes, but since 85 is not perfectly divisible by 5, we should calculate the remaining distance and add the time it takes to cover that distance. The remaining distance is 85 - (17 * 5) = 0 miles, so we don't need to add any extra time.",4097.0,0,0,symbolic,99
2,"Reformatted Question: Hiroshi is rolling a d10 die. How much more likely is it (expressed as a percentage) that he rolls a number greater than 2 than that he rolls two odd numbers in a row?

Answer: The probability of rolling a number greater than 2 on a d10 die is 7/10, since there are 7 numbers greater than 2 (3, 4, 5, 6, 7, 8, 9, 10) out of a total of 10 possible outcomes.

The probability of rolling two odd numbers in a row is (5/10) * (5/10) = 25/100, since there are 5 odd numbers (1, 3, 5, 7, 9) out of a total of 10 possible outcomes, and the probability of rolling an odd number twice in a row is the product of the individual probabilities.

To find the difference in probability, subtract the probability of rolling two odd numbers in a row from the probability of rolling a number greater than 2: (7/10) - (25/100) = (70/100) - (25/100) = 45/100.

To express this difference as a percentage, multiply by 100: (45/100) * 100 = 45%.

The answer is {45}.",55.0,0,0,symbolic,102
35,"Reformatted Question: Ravi is raising money for a conference. He has applied for help from the local charity, which has decided to cover half of the cost of the conference. How much money is Ravi missing if he has ₣195 and the conference costs ₣980?

Answer: The charity will cover half of the cost of the conference, which is ₣980/2 = ₣490. Ravi has ₣195, so he is missing ₣490 + ₣195 = ₣685.",295.0,0,0,symbolic,1752
