id,question,gt,isTrue,isTagged,dataset,unique_id
35,"Reformatted Question: Arash is raising money for a music festival. He has applied for help from the youth club, which has decided to cover 1/5 of the cost of the music festival. How much money is Arash missing if he has ¥90 and the music festival costs ¥420?

Answer: The youth club will cover 1/5 of the cost of the music festival, which is 1/5 * ¥420 = ¥84. Arash has ¥90, so he has ¥90 - ¥84 = ¥6 more than the amount covered by the youth club. Since the music festival costs ¥420, Arash is missing ¥420 - ¥90 = ¥330.",246.0,0,0,symbolic,1755
35,"Reformatted Question: Jin is raising money for a conference. He has applied for help from the local charity, which has decided to cover half of the cost of the conference. How much money is Jin missing if he has ₣110 and the conference costs ₣980?

Answer: The charity will cover half of the cost of the conference, which is ₣980/2 = ₣490. Jin has ₣110, so he is missing ₣490 + ₣110 = ₣600.",380.0,0,0,symbolic,1787
44,"Reformatted Question: There are 45 girls in the park. If there are two-sixths the number of boys in the park, how many kids are in the park?

Answer: To find the number of boys, we need to calculate two-sixths of the number of girls. Two-sixths is equivalent to one-third, so we can calculate the number of boys as 45 / 3 = 15. Since there are two-sixths the number of boys, we multiply 15 by 2 to get 30 boys. Therefore, the total number of kids in the park is 45 girls + 30 boys = 75 kids.",60.0,0,0,symbolic,2245
70,"Reformatted Question: A plumber works for 3 weeks every month and for 6 days every week. If he gets paid $110 every day, how much does he earn if he works for a year?

Answer: The plumber works 6 days every week and there are approximately 4 weeks in a month, so he works 6 * 3 * 4 = 72 days in a 4-week month. However, since the question asks about a year, we should use 52 weeks in a year. So, he works 6 * 3 * 52/4 = 6 * 3 * 13 = 234 days in a year. He earns $110 every day, so he earns $110 * 234 = $25,740 in a year.
The answer is {25740}.",23760.0,0,0,symbolic,3548
6,"Reformatted Question: Umar has 70 square meters of banana field. There are 31 bananas per square meter. Umar can harvest his bananas every 4 months. How many bananas can Umar harvest within a year?
Answer: Since Umar can harvest his bananas every 4 months, he can harvest bananas 4 times a year. Each time he harvests, he gets 31 bananas per square meter * 70 square meters = 2170 bananas. Therefore, Umar can harvest a total of 4 * 2170 = 8680 bananas within a year.",6510.0,0,0,symbolic,326
6,"Reformatted Question: Hiroshi has 20 square yards of banana field. There are 50 bananas per square yard. Hiroshi can harvest his bananas every 2 months. How many bananas can Hiroshi harvest within a year?
Answer: Since Hiroshi can harvest his bananas every 2 months, he can harvest 2 times per year. 
Each time he harvests, he gets 20 * 50 = 1000 bananas. 
Therefore, Hiroshi can harvest a total of 2 * 1000 = 2000 bananas within a year.",6000.0,0,0,symbolic,338
10,"Reformatted Question: To make a call from a hotel room phone, you must pay €0.6 for each minute of your call. After 30 minutes, that price drops to €0.5 per minute. How much would a 96-minute call cost?

Answer: The call is 96 minutes long, which is longer than 30 minutes. Therefore, the entire call will be charged at the rate of €0.5 per minute. The cost of the call is €0.5 * 96 = €48.",51.0,0,0,symbolic,504
14,"Reformatted Question: Mei and Diego have 97 minutes to walk to the cinema together. It takes them 27 minutes to get to the corner where the mall is. It takes them another 61 minutes to get to the bank. How much longer do they have to get to cinema without being late?
Answer: To find out how much longer Mei and Diego have to get to the cinema without being late, we need to subtract the time it takes them to get to the bank from the total time they have to walk to the cinema together. 

97 minutes is the total time they have to walk to the cinema together. 
27 minutes is the time it takes them to get to the corner where the mall is, but this time is not relevant to the calculation.
61 minutes is the time it takes them to get to the bank. 

So, we subtract 61 minutes from 97 minutes to find out how much longer Mei and Diego have to get to the cinema without being late. 
97 minutes - 61 minutes = 36 minutes 

Therefore, Mei and Diego have 36 minutes to get to the cinema without being late.",9.0,0,0,symbolic,746
14,"Reformatted Question: Liam and Camila have 126 minutes to walk to the mall together. It takes them 26 minutes to get to the corner where the cinema is and another 54 minutes to get to the bank. How much longer do they have to get to mall without being late?
Answer: To find out how much longer they have to get to the mall, we need to subtract the time it takes them to get to the corner and the bank from the total time they have. This can be calculated as 126 minutes - 26 minutes - 54 minutes = 126/26 - 26 - 54 = 100 - 26 - 54 = 20 minutes.",46.0,0,0,symbolic,749
18,"Reformatted Question: Mateo went to buy some school supplies. He bought 6 pencils which cost $5.0 each, 8 markers which cost $16.75 each, and a rim of bond paper which cost $13. How much did Mateo spend on everything?
Answer: To find out how much Mateo spent on everything, we need to calculate the total cost of the pencils, markers, and bond paper. First, we find the total cost of the pencils: 6 pencils * $5.0 each = $30. Next, we find the total cost of the markers: 8 markers * $16.75 each = $133.80. Then, we add the cost of the bond paper: $133.80 + $13 = $146.80. Therefore, Mateo spent a total of $146.80 on everything.

The answer is {146.80}.",177.0,0,0,symbolic,906
22,"Reformatted Question: Ananya was preparing for a lunch party at her house, where she intended to serve shrimp scampi. She noticed that she was out of plastic plates, so she bought a new package of plates. Later, her husband also bought a package of 17 new plates and gave them to Ananya. While Ananya was making the shrimp scampi, she used seven of the plates to sample her shrimp scampi. Later, when she went to set the table, she had a total of 31 plates. How many plates were in the package that Ananya bought?

Answer: Ananya had a total of 31 plates at the end. She used 7 of the plates to sample her shrimp scampi. So, the number of plates she had left is 31 - 7 = 24 plates.
She got 17 new plates from her husband. So, the number of plates she bought originally is 24 - 17 = 7 plates.
The answer is {7}.",21.0,0,0,symbolic,1108
22,"Reformatted Question: Fatima was preparing for a birthday party at her house, where she intended to serve shrimp scampi. She noticed that she was out of plastic spoons, so she bought a new package of spoons. Later, her husband also bought a package of 8 new spoons and gave them to Fatima. While Fatima was making the shrimp scampi, she used ten of the spoons to sample her shrimp scampi. Later, when she went to set the table, she had a total of 27 spoons. How many spoons were in the package that Fatima bought?
Answer: Fatima initially had 27 spoons after using 10 spoons to sample her shrimp scampi. This means she had 27 + 10 = 37 spoons in total before using any spoons. Her husband gave her 8 spoons, so before using any spoons, she had 8 + 27 = 35 spoons. This means that the package that Fatima bought initially had 35 - 27 = 8 spoons.",29.0,0,0,symbolic,1113
26,"Reformatted Question: A grandfather eats 7 burritos per day, his partner eats 7 burritos per day, and their son eats 7 burritos per day. How many burritos does this family eat in one week?
Answer: Since there are 7 days in a week, the family eats 7 burritos per day * 7 days = 49 burritos per week.",147.0,0,0,symbolic,1342
28,"Reformatted Question: A medical center has a capacity of 1600 wards with 1/10 occupied. Due to the major accident, 35 patients are admitted into the medical center each day. Calculate the total number of unoccupied wards in the medical center after 4 weeks.
Answer: Since the medical center has 1600 wards and 1/10 of them are occupied, the number of occupied wards is 1600 * 1/10 = 160 wards. The number of unoccupied wards is 1600 - 160 = 1440 wards. 

Since 35 patients are admitted into the medical center each day, the number of patients admitted in 4 weeks is 35 * 7 * 4 = 980 patients. 

However, since the medical center has a capacity of 1600 wards and only 1/10 of them are occupied, the medical center can accommodate more than 160 patients. Therefore, the medical center will not run out of space after 4 weeks, and the number of unoccupied wards remains the same, which is 1440 wards.

The answer is {1440}.",460.0,0,0,symbolic,1449
39,"Reformatted Question: A cleaner has to clean a hospital with 160 rooms. They have 8 days to get it done. It takes them 15 minutes per room. If they work 10 hours each day, what percentage of their day, on average, is spent cleaning rooms?
Answer: The cleaner has 8 days to clean 160 rooms. Since it takes them 15 minutes per room, they will need 160 * 15 = 2400 minutes to clean all the rooms.
Since they work 10 hours each day, they work 10 * 60 = 600 minutes per day.
To find the percentage of their day spent cleaning rooms, we need to divide the total minutes spent cleaning rooms by the total minutes worked per day and multiply by 100. This gives us (2400 / 600) * 100 = 400%.
The answer is {400}.",50.0,0,0,symbolic,1954
39,"Reformatted Question: A maintenance worker has to clean a university with 135 rooms. They have 5 days to get it done. It takes them 20 minutes per room. If they work 10 hours each day, what percentage of their day, on average, is spent cleaning rooms?

Answer: The total number of minutes they have to work each day is 10 hours * 60 minutes per hour = 600 minutes.
The total number of minutes they spend cleaning rooms each day is 135 rooms * 20 minutes per room = 2700 minutes.
The percentage of their day spent cleaning rooms is (2700 minutes / 600 minutes) * 100% = 450%.
The answer is {450}.",90.0,0,0,symbolic,1963
41,"Reformatted Question: A stack is made out of 2 green tiles, seven times as many orange tiles, and an unknown number of black tiles. If there are 46 tiles in the total, how many black tiles are there?
Answer: Let's denote the number of orange tiles as 7x, where x is a positive integer. The total number of tiles in the stack is the sum of the green tiles, orange tiles, and black tiles. We can write an equation to represent this: 2 + 7x + black tiles = 46. Since we don't know the number of black tiles, we can represent it as black tiles = 46 - 2 - 7x. We can simplify this expression to black tiles = 44 - 7x. Since the number of black tiles must be a non-negative integer, we can set up the inequality 44 - 7x ≥ 0. Solving for x, we get x ≤ 44 / 7 ≈ 6.29. Since x must be a positive integer, the largest possible value of x is 6. Substituting x = 6 into the expression for the number of black tiles, we get black tiles = 44 - 7 * 6 = 44 - 42 = 2. Therefore, there are 2 black tiles in the stack.",30.0,0,0,symbolic,2063
42,"Reformatted Question: Arash goes to the store to buy some rice. The normal brand of rice he buys costs €5 per kg. He had to buy a more expensive brand that costs 40% more since his favorite brand was sold out. He decides to buy a week's worth of rice and he uses 2 kg of rice per day. He also decided to buy himself a bagel for €2. How much did everything cost?
Answer: First, we need to find out how much the more expensive brand of rice costs. To do this, we need to find 40% of the normal brand's price and add it to the normal brand's price. 40% of €5 is 40% * €5 = 40% * €5 / 100% = €2. So, the more expensive brand of rice costs €5 + €2 = €7 per kg. Arash needs 2 kg of rice per day for a week, so he needs 2 kg * 7 days = 14 kg of rice. The normal brand of rice would cost €5 * 14 kg = €70. The more expensive brand of rice would cost €7 * 14 kg = €98. So, the total cost of the rice is €70 + €98 = €168. Finally, Arash also bought a bagel for €2, so the total cost of everything is €168 + €2 = €170.",100.0,0,0,symbolic,2126
44,"Reformatted Question: There are 44 girls in the field. If there are 1/4 the number of boys in the field, how many kids are in the field?
Answer: Since there are 1/4 the number of boys in the field as there are girls, there must be 44 * 4 = 176 boys in the field. To find the total number of kids, we need to add the number of girls and the number of boys. So, the total number of kids is 44 + 176 = 220 kids.",55.0,0,0,symbolic,2237
7,"Reformatted Question: A farmer is buying feed for his cows. He buys eight 3-pound boxes of apples for the whole stable. He buys fourteen 9-pound bags of cucumbers. He buys thirty-three 36-pound packs of wheats. He buys seventeen 16-pound sacks of oats.  His farm truck can carry 230 pounds at a time. How many trips does the farmer need to transport all the feed?

Answer: First, let's calculate the total weight of each type of feed:

* **Apples:** eight 3-pound boxes = 8 * 3 = 24 pounds
* **Cucumbers:** fourteen 9-pound bags = 14 * 9 = 126 pounds
* **Wheats:** thirty-three 36-pound packs = 33 * 36 = 1188 pounds
* **Oats:** seventeen 16-pound sacks = 17 * 16 = 272 pounds

Now, let's find the total weight of all the feed: 24 + 126 + 1188 + 272 = 1610 pounds.

Since his farm truck can carry 230 pounds at a time, we need to divide the total weight by the truck's capacity to determine the number of trips: 1610 pounds / 230 pounds/trip = 7.0 trips.

Because we can't make a partial trip, the farmer needs to make a total of 8 trips to transport all the feed.

Therefore, the answer is {8}.
",7.0,0,0,symbolic,359
