id,question,answer
0,Is it common to see frost during some college commencements?,"Reformatted Question: Is it common to see <fact1>frost</fact1> during some <fact2>college commencements</fact2>?

Answer: <fact2>College commencements</fact2> typically occur in late spring or early summer, around May or June, in many parts of the United States. However, in some regions, especially in northern areas or higher altitudes, <fact1>frost</fact1> can still occur during these months. Therefore, while it is not common, it is possible to see <fact1>frost</fact1> during some <fact2>college commencements</fact2> depending on the location and weather conditions.

Final_Answer: {true}"
1,Hydrogen's atomic number squared exceeds number of Spice Girls?,"Reformatted Question: Does <fact1>Hydrogen's atomic number squared</fact1> exceed the <fact2>number of Spice Girls</fact2>?

Answer: The <fact1>atomic number of Hydrogen</fact1> is 1. Squaring this gives 1^2 = 1. The <fact2>number of Spice Girls</fact2> is 5. 

Since 1 is not greater than 5, the answer is {false}. 

Final_Answer: {false}"
2,Would a pear sink in water?,"Reformatted Question: Would a <fact1>pear</fact1> sink in <fact2>water</fact2>?

Answer: The density of <fact2>water</fact2> is approximately 1 gram per cubic centimeter. A <fact1>pear</fact1> typically has a density less than that of <fact2>water</fact2>, which means it will float. 

Final_Answer: {false}"
3,Do hamsters provide food for any animals?,"Reformatted Question: Do <fact1>hamsters</fact1> provide <fact2>food</fact2> for any <fact3>animals</fact3>?

Answer: <fact1>Hamsters</fact1> are small rodents that can be prey for larger animals. In the wild, they can be hunted by predators such as birds of prey, snakes, and other carnivorous mammals. Therefore, <fact1>hamsters</fact1> can indeed provide <fact2>food</fact2> for certain <fact3>animals</fact3>.

Final_Answer: {true}"
4,Are all limbs required for jujutsu?,"Reformatted Question: Are all <fact1>limbs</fact1> required for <fact2>jujutsu</fact2>?

Answer: <fact2>Jujutsu</fact2> is a martial art that involves techniques using various parts of the body, including <fact1>limbs</fact1>, for grappling, throwing, and striking. However, practitioners can adapt techniques to accommodate limitations or the absence of certain <fact1>limbs</fact1>. Therefore, while having all <fact1>limbs</fact1> can be advantageous, it is not strictly required to practice <fact2>jujutsu</fact2>.

Final_Answer: {false}"
5,Could a llama birth twice during War in Vietnam (1945-46)?,"Reformatted Question: Could a <fact1>llama</fact1> birth <fact2>twice</fact2> during the <fact3>War in Vietnam (1945-46)</fact3>?

Answer: The gestation period for a <fact1>llama</fact1> is approximately 11 months. Therefore, a <fact1>llama</fact1> could potentially give birth once every 11 months. The <fact3>War in Vietnam (1945-46)</fact3> lasted for about one year. Given this timeframe, it is unlikely for a <fact1>llama</fact1> to birth <fact2>twice</fact2> during the <fact3>War in Vietnam (1945-46)</fact3>.

Final_Answer: {false}"
6,Does Linus Torvalds make money off of DirectX?,"Reformatted Question: Does <fact1>Linus Torvalds</fact1> make money off of <fact2>DirectX</fact2>?

Answer: <fact1>Linus Torvalds</fact1> is the creator of the Linux kernel and is primarily associated with open-source software development. <fact2>DirectX</fact2> is a collection of application programming interfaces (APIs) for handling tasks related to multimedia, especially game programming and video, on Microsoft platforms. <fact2>DirectX</fact2> is developed by Microsoft, a company that operates on a proprietary software model, which is different from the open-source model that <fact1>Linus Torvalds</fact1> is known for. There is no direct connection between <fact1>Linus Torvalds</fact1> and <fact2>DirectX</fact2> in terms of financial gain.

So the answer is {false}."
7,Could Brooke Shields succeed at University of Pennsylvania?,"Reformatted Question: Could <fact1>Brooke Shields</fact1> succeed at <fact2>University of Pennsylvania</fact2>?

Answer: <fact1>Brooke Shields</fact1> is an accomplished actress and model, known for her intelligence and dedication. She attended Princeton University, an Ivy League institution, and graduated with a degree in French literature, demonstrating her academic capabilities. The <fact2>University of Pennsylvania</fact2> is also an Ivy League institution, known for its rigorous academic programs. Given <fact1>Brooke Shields</fact1>'s successful academic background at a similar level of institution, it is reasonable to conclude that she could succeed at the <fact2>University of Pennsylvania</fact2>.

Final_Answer: {true}"
8,Could a silverfish reach the top of the Empire State Building?,"Reformatted Question: Could a <fact1>silverfish</fact1> reach the top of the <fact2>Empire State Building</fact2>?

Answer: A <fact1>silverfish</fact1> is a small, wingless insect known for its ability to crawl and climb on various surfaces. The <fact2>Empire State Building</fact2> is a tall skyscraper in New York City, standing at 1,454 feet (including its antenna). While a <fact1>silverfish</fact1> can climb surfaces, the height and structure of the <fact2>Empire State Building</fact2> would make it extremely challenging for such a small insect to reach the top. Additionally, the environmental conditions and lack of food sources at such heights would likely prevent a <fact1>silverfish</fact1> from surviving the journey.

Final_Answer: {false}"
9,Are the majority of Reddit users familiar with the Pledge of Allegiance?,"Reformatted Question: Are the majority of <fact1>Reddit users</fact1> familiar with the <fact2>Pledge of Allegiance</fact2>?

Answer: <fact1>Reddit users</fact1> are a diverse group of individuals from around the world, with a significant portion being from the United States. The <fact2>Pledge of Allegiance</fact2> is a patriotic recitation that is commonly taught and recited in American schools. Therefore, it is likely that a significant portion of <fact1>Reddit users</fact1> from the United States are familiar with the <fact2>Pledge of Allegiance</fact2>. However, since <fact1>Reddit users</fact1> also include many international members, not all users may be familiar with it.

Final_Answer: {true}"
10,Do the anchors on Rede Globo speak Chinese?,"Reformatted Question: Do the <fact1>anchors on Rede Globo</fact1> speak <fact2>Chinese</fact2>?

Answer: <fact1>Rede Globo</fact1> is a major television network in Brazil, and its anchors primarily speak Portuguese, the official language of Brazil. There is no widely available information indicating that the <fact1>anchors on Rede Globo</fact1> are required to speak <fact2>Chinese</fact2> as part of their job. 

So the answer is {false}."
11,Can Reiki be stored in a bottle?,"Reformatted Question: Can <fact1>Reiki</fact1> be stored in a <fact2>bottle</fact2>?

Answer: <fact1>Reiki</fact1> is a form of energy healing that involves the transfer of universal energy through the palms of the practitioner to the patient. It is not a physical substance but rather a practice or technique. <fact2>A bottle</fact2> is a physical container used to store tangible substances. Since <fact1>Reiki</fact1> is not a physical substance, it cannot be stored in a <fact2>bottle</fact2>.

Final_Answer: {false}"
12,"While viewing ""Scary Movie"" is the viewer likely to experience an increase in adrenaline?","Reformatted Question: While viewing <fact1>""Scary Movie""</fact1> is the viewer likely to experience an increase in <fact2>adrenaline</fact2>?

Answer: <fact1>""Scary Movie""</fact1> is a film that falls under the horror-comedy genre. Horror films are known to evoke fear and suspense, which can lead to an increase in <fact2>adrenaline</fact2> levels in viewers. The body's natural response to fear or excitement is to release <fact2>adrenaline</fact2>, which prepares the body for a ""fight or flight"" response. 

So the answer is {true}."
13,Would Marvel's Gateway be envious of the Doctor (Doctor Who)'s TARDIS machine?,"Reformatted Question: Would <fact1>Marvel's Gateway</fact1> be envious of the <fact2>Doctor (Doctor Who)'s TARDIS machine</fact2>?

Answer: <fact1>Marvel's Gateway</fact1> is a mutant character with the ability to create teleportation portals, allowing him to transport himself and others across vast distances instantaneously. <fact2>The Doctor's TARDIS machine</fact2> is a time and space travel device that allows the Doctor to travel anywhere in time and space, with the added feature of being much larger on the inside than it appears on the outside. While both have the ability to transport across distances, the TARDIS offers the additional capability of time travel and has unique features like its vast internal space and advanced technology. Therefore, <fact1>Marvel's Gateway</fact1> might be envious of the additional capabilities and features of <fact2>the Doctor's TARDIS machine</fact2>.

Final_Answer: {true}"
14,Is material from an aloe plant sometimes enclosed in petroleum-derived products?,"Reformatted Question: Is material from an <fact1>aloe plant</fact1> sometimes enclosed in <fact2>petroleum-derived products</fact2>?

Answer: <fact1>Aloe plant material</fact1> is often used in skincare and cosmetic products for its soothing properties. These products can include lotions, creams, and gels. <fact2>Petroleum-derived products</fact2>, such as mineral oil and petrolatum, are commonly used in the cosmetic industry as bases or carriers for active ingredients. Therefore, it is possible for <fact1>aloe plant material</fact1> to be enclosed in <fact2>petroleum-derived products</fact2> in some formulations.

Final_Answer: {true}"
15,Could a bee hummingbird balance a scale with a single pea on it?,"Reformatted Question: Could a <fact1>bee hummingbird</fact1> balance a scale with a single <fact2>pea</fact2> on it?

Answer: The <fact1>bee hummingbird</fact1> is the smallest bird in the world, weighing approximately 1.6 to 2 grams. A single <fact2>pea</fact2> typically weighs around 0.1 to 0.36 grams. Since the weight of the <fact1>bee hummingbird</fact1> is greater than that of a single <fact2>pea</fact2>, it could balance the scale.

Final_Answer: {true}"
16,Would a broadcast from Spirit make the news in 2020?,"Reformatted Question: Would a <fact1>broadcast from Spirit</fact1> make the <fact2>news</fact2> in <fact3>2020</fact3>?

Answer: The <fact1>Spirit rover</fact1> was a robotic rover on Mars, part of NASA's Mars Exploration Rover Mission. It was active from 2004 until it ceased communication in 2010. By <fact3>2020</fact3>, the rover had not been operational for a decade. A <fact1>broadcast from Spirit</fact1> would be unexpected and significant, likely making the <fact2>news</fact2> due to its historical and scientific importance.

Final_Answer: {true}"
17,Would characters in Harry Potter and the Philosopher's Stone be persecuted as pagans?,"Reformatted Question: Would <fact1>characters in Harry Potter and the Philosopher's Stone</fact1> be persecuted as <fact2>pagans</fact2>?

Answer: The <fact1>characters in Harry Potter and the Philosopher's Stone</fact1> are fictional and belong to a fantasy world where magic is a central element. In the real world, some people have criticized the Harry Potter series for its portrayal of magic and witchcraft, associating it with <fact2>paganism</fact2> or other non-Christian beliefs. However, the series is primarily a work of fiction and entertainment, and the characters themselves are not real individuals who could be persecuted. 

Final_Answer: {false}"
18,Can music be used as a weapon?,"Reformatted Question: Can <fact1>music</fact1> be used as a <fact2>weapon</fact2>?

Answer: <fact1>Music</fact1> has been used in various contexts as a form of psychological warfare. It can be played at high volumes to cause discomfort or disorientation, which can be considered a form of a <fact2>weapon</fact2>. For example, loud music has been used in military operations and interrogations to induce stress or sleep deprivation.

Final_Answer: {true}"
19,Can Harry Potter book a flight on Asiana Airlines?,"Reformatted Question: Can <fact1>Harry Potter</fact1> book a flight on <fact2>Asiana Airlines</fact2>?

Answer: <fact1>Harry Potter</fact1> is a fictional character from a series of books written by J.K. Rowling. 
<fact2>Asiana Airlines</fact2> is a real airline company that operates flights for real people. 
Since <fact1>Harry Potter</fact1> is not a real person, he cannot perform real-world actions such as booking a flight. 

Final_Answer: {false}"
20,Karachi was a part of Alexander the Great's success?,"Reformatted Question: Was <fact1>Karachi</fact1> a part of <fact2>Alexander the Great's success</fact2>?

Answer: <fact2>Alexander the Great</fact2> was a Macedonian conqueror who created one of the largest empires in history.
<fact1>Karachi</fact1> is a city in present-day Pakistan.
<fact2>Alexander the Great</fact2> did campaign in the region that is now Pakistan, including the Indus Valley.
However, <fact1>Karachi</fact1> as a city did not exist during <fact2>Alexander the Great's</fact2> time.
So the answer is {false}."
21,Was Jackson Pollock trained by Leonardo da Vinci?,"Reformatted Question: Was <fact1>Jackson Pollock</fact1> trained by <fact2>Leonardo da Vinci</fact2>?

Answer: <fact1>Jackson Pollock</fact1> was an American painter and a major figure in the abstract expressionist movement, born in 1912. <fact2>Leonardo da Vinci</fact2> was an Italian polymath of the Renaissance, born in 1452 and died in 1519. The two lived in entirely different time periods, separated by several centuries. Therefore, it is not possible for <fact1>Jackson Pollock</fact1> to have been trained by <fact2>Leonardo da Vinci</fact2>.

Final_Answer: {false}"
22,Will The Exorcist stimulate limbic system?,"Reformatted Question: Will <fact1>The Exorcist</fact1> stimulate the <fact2>limbic system</fact2>?

Answer: <fact1>The Exorcist</fact1> is a horror film known for its intense and frightening scenes. The <fact2>limbic system</fact2> is a complex set of structures in the brain that deals with emotions and memory. Watching a horror film like <fact1>The Exorcist</fact1> can trigger emotional responses such as fear and anxiety, which are processed by the <fact2>limbic system</fact2>.

So the answer is {true}."
23,Would World War II have been the same without Alan Turing?,"Reformatted Question: Would <fact1>World War II</fact1> have been the same without <fact2>Alan Turing</fact2>?

Answer: <fact2>Alan Turing</fact2> was a key figure in the development of the Bombe, a machine used to decrypt the Enigma-encrypted messages used by the Germans during <fact1>World War II</fact1>. His work significantly contributed to the Allied forces' ability to intercept and understand German communications, which played a crucial role in several military operations. Many historians believe that Turing's contributions helped shorten the war and save countless lives. Without <fact2>Alan Turing</fact2>'s contributions, the course of <fact1>World War II</fact1> could have been significantly different, potentially prolonging the conflict and altering its outcome.

Final_Answer: {false}"
24,Would a sophist use an épée?,"Reformatted Question: Would a <fact1>sophist</fact1> use an <fact2>épée</fact2>?

Answer: A <fact1>sophist</fact1> is a term used to describe a specific kind of teacher in ancient Greece, known for their skill in philosophy and rhetoric. They were not typically associated with physical combat or the use of weapons. An <fact2>épée</fact2> is a type of sword used in the sport of fencing, which is a modern competitive sport. The historical role of a <fact1>sophist</fact1> does not involve the use of an <fact2>épée</fact2> or any other weapon.

So the answer is {false}."
25,Did Dale Jr hug his dad after their last Daytona 500 together?,"Reformatted Question: Did <fact1>Dale Jr</fact1> hug <fact2>his dad</fact2> after their last <fact3>Daytona 500</fact3> together?

Answer: <fact1>Dale Jr</fact1> is the son of <fact2>Dale Earnhardt Sr</fact2>, both of whom were NASCAR drivers. The <fact3>Daytona 500</fact3> is a significant race in NASCAR. The last <fact3>Daytona 500</fact3> that <fact2>Dale Earnhardt Sr</fact2> participated in was in 2001, during which he tragically passed away in a crash. Therefore, there was no opportunity for <fact1>Dale Jr</fact1> to hug <fact2>his dad</fact2> after that race.

Final_Answer: {No}"
26,Can citrus grow in Ulaanbaatar?,"Reformatted Question: Can <fact1>citrus</fact1> grow in <fact2>Ulaanbaatar</fact2>?

Answer: <fact1>Citrus</fact1> plants typically require a warm, subtropical to tropical climate to grow successfully. <fact2>Ulaanbaatar</fact2>, the capital of Mongolia, has a cold, continental climate with long, harsh winters and short, mild summers. The average temperature in <fact2>Ulaanbaatar</fact2> during winter can drop significantly below freezing, which is not suitable for <fact1>citrus</fact1> growth. Therefore, it is unlikely that <fact1>citrus</fact1> can grow naturally in <fact2>Ulaanbaatar</fact2> without controlled environments like greenhouses.

Final_Answer: {false}"
27,Does New York Harbor sit on a craton without volcanic activity?,"Reformatted Question: Does <fact1>New York Harbor</fact1> sit on a <fact2>craton</fact2> without <fact3>volcanic activity</fact3>?

Answer: A <fact2>craton</fact2> is a stable part of the Earth's crust that has not experienced significant tectonic activity for a long period. <fact1>New York Harbor</fact1> is located on the eastern edge of the North American craton. The region around <fact1>New York Harbor</fact1> is not known for <fact3>volcanic activity</fact3> as it is geologically stable.

So the answer is {true}."
28,Can the Palace of Westminster tell time in the dark?,"Reformatted Question: Can the <fact1>Palace of Westminster</fact1> tell <fact2>time</fact2> in the <fact3>dark</fact3>?

Answer: The <fact1>Palace of Westminster</fact1> is home to the famous clock tower known as Big Ben. The clock faces of Big Ben are illuminated, allowing it to display the <fact2>time</fact2> even in the <fact3>dark</fact3>.

Final_Answer: {true}"
29,"In teenagers and young adults with depression, are SSRI medications less safe than they are for adults?","Reformatted Question: In <fact1>teenagers and young adults with depression</fact1>, are <fact2>SSRI medications</fact2> less safe than they are for <fact3>adults</fact3>?

Answer: <fact2>SSRI medications</fact2> are commonly prescribed for depression in both <fact1>teenagers and young adults</fact1> and <fact3>adults</fact3>. However, there is evidence that <fact2>SSRI medications</fact2> may carry a higher risk of side effects, such as increased suicidal thoughts and behaviors, in <fact1>teenagers and young adults</fact1> compared to <fact3>adults</fact3>. This has led to warnings and careful monitoring when prescribing these medications to younger populations.

Final_Answer: {true}"
30,Does Marco Rubio have a close relationship with Allah?,"Reformatted Question: Does <fact1>Marco Rubio</fact1> have a close relationship with <fact2>Allah</fact2>?

Answer: <fact1>Marco Rubio</fact1> is a United States Senator from Florida and a practicing Roman Catholic. <fact2>Allah</fact2> is the Arabic word for God in Islam. There is no public information or evidence to suggest that <fact1>Marco Rubio</fact1> has a close relationship with <fact2>Allah</fact2> or practices Islam.

Final_Answer: {false}"
31,Would Persephone be a good consultant to a landscape architect?,"Reformatted Question: Would <fact1>Persephone</fact1> be a good consultant to a <fact2>landscape architect</fact2>?

Answer: <fact1>Persephone</fact1> is a figure from Greek mythology, known as the goddess of spring and vegetation. She is associated with the growth and renewal of plants and the changing of the seasons. 

A <fact2>landscape architect</fact2> is a professional who designs outdoor spaces, often incorporating plants and natural elements into their work. 

Given <fact1>Persephone's</fact1> association with vegetation and the natural world, she could provide valuable insights into plant growth and seasonal changes, which are relevant to the work of a <fact2>landscape architect</fact2>.

So the answer is {true}."
32,Is Argon near Neon on the periodic table of elements?,"Reformatted Question: Is <fact1>Argon</fact1> near <fact2>Neon</fact2> on the <fact3>periodic table of elements</fact3>?

Answer: On the <fact3>periodic table of elements</fact3>, elements are arranged in order of increasing atomic number. <fact2>Neon</fact2> has an atomic number of 10, and <fact1>Argon</fact1> has an atomic number of 18. Both <fact1>Argon</fact1> and <fact2>Neon</fact2> are noble gases and are located in Group 18 of the <fact3>periodic table of elements</fact3>. Although they are in the same group, there are other elements between them in terms of atomic number.

Final_Answer: {true}"
33,Did Thomas Greenhill's parents violate the concept of monogamy?,"Reformatted Question: Did <fact1>Thomas Greenhill's parents</fact1> violate the concept of <fact2>monogamy</fact2>?

Answer: To determine if <fact1>Thomas Greenhill's parents</fact1> violated the concept of <fact2>monogamy</fact2>, we would need specific historical or biographical information about their relationship. Monogamy refers to the practice of being married to or in a sexual relationship with one person at a time. Without specific evidence or historical records indicating that <fact1>Thomas Greenhill's parents</fact1> engaged in relationships outside of their marriage or committed to more than one partner simultaneously, it cannot be concluded that they violated the concept of <fact2>monogamy</fact2>.

Final_Answer: {Insufficient information to determine}"
34,Would it be uncommon for a high schooler to use the yellow pages?,"Reformatted Question: Would it be uncommon for a <fact1>high schooler</fact1> to use the <fact2>yellow pages</fact2>?

Answer: The <fact2>yellow pages</fact2> are a traditional printed directory of businesses and services, which have largely been replaced by online search engines and digital directories. 

<fact1>High schoolers</fact1> today are more accustomed to using digital technology and the internet for finding information. 

Therefore, it would be uncommon for a <fact1>high schooler</fact1> to use the <fact2>yellow pages</fact2> in the current digital age.

Final_Answer: {true}"
35,Could an escapee swim nonstop from Alcatraz island to Siberia?,"Reformatted Question: Could an <fact1>escapee</fact1> swim nonstop from <fact2>Alcatraz Island</fact2> to <fact3>Siberia</fact3>?

Answer: <fact2>Alcatraz Island</fact2> is located in the San Francisco Bay, California, USA. <fact3>Siberia</fact3> is a vast region in Russia, located across the Pacific Ocean from the United States. The distance between <fact2>Alcatraz Island</fact2> and <fact3>Siberia</fact3> is thousands of miles across the Pacific Ocean. It is not feasible for an <fact1>escapee</fact1> to swim nonstop over such a vast distance due to the physical limitations of human endurance and the harsh oceanic conditions.

Final_Answer: {false}"
36,Would the Titanic be well preserved at the bottom of the Gulf of Finland?,"Reformatted Question: Would the <fact1>Titanic</fact1> be well preserved at the bottom of the <fact2>Gulf of Finland</fact2>?

Answer: The <fact1>Titanic</fact1> sank in the North Atlantic Ocean, where it is currently located. The conditions in the North Atlantic, such as cold temperatures and high pressure, have contributed to the deterioration of the wreck over time. 

The <fact2>Gulf of Finland</fact2> is part of the Baltic Sea, which has different environmental conditions compared to the North Atlantic. The Baltic Sea is known for its low salinity and colder temperatures, which can contribute to better preservation of shipwrecks compared to more saline and warmer waters.

However, the <fact1>Titanic</fact1> is not located in the <fact2>Gulf of Finland</fact2>, so its preservation state is not directly influenced by the conditions there. 

Final_Answer: {false}"
37,Could a snowy owl survive in the Sonoran?,"Reformatted Question: Could a <fact1>snowy owl</fact1> survive in the <fact2>Sonoran Desert</fact2>?

Answer: The <fact1>snowy owl</fact1> is adapted to cold, Arctic environments and has a thick layer of feathers for insulation against cold temperatures. The <fact2>Sonoran Desert</fact2> is characterized by its hot, arid climate with extreme temperatures and limited water sources. These conditions are vastly different from the natural habitat of the <fact1>snowy owl</fact1>.

Final_Answer: {false}"
38,Would a rabbi worship martyrs Ranavalona I killed?,"Reformatted Question: Would a <fact1>rabbi</fact1> worship <fact2>martyrs</fact2> <fact3>Ranavalona I</fact3> killed?

Answer: A <fact1>rabbi</fact1> is a Jewish religious leader who follows the teachings and practices of Judaism. In Judaism, worship is directed towards God, and while martyrs may be honored or remembered, they are not objects of worship. <fact2>Martyrs</fact2> are individuals who have died for their faith or beliefs, but in Judaism, they are not worshipped. <fact3>Ranavalona I</fact3> was a queen of Madagascar known for her persecution of Christians, leading to the martyrdom of many. However, these martyrs would not be worshipped by a <fact1>rabbi</fact1> as it goes against Jewish religious practices.

So the answer is {false}."
