id,question,answer
78,Is it hard to get a BLT in Casablanca?,"Reformatted Question: Is it hard to get a <fact1>BLT</fact1> in <fact2>Casablanca</fact2>?

Answer: A <fact1>BLT</fact1> is a type of sandwich that typically contains bacon, lettuce, and tomato. <fact2>Casablanca</fact2> is a city in Morocco, a country where the majority of the population is Muslim, and dietary laws often restrict the consumption of pork products, such as bacon. Therefore, it might be challenging to find a traditional <fact1>BLT</fact1> in <fact2>Casablanca</fact2> due to these dietary restrictions.

Final_Answer: {true}"
79,Could largest ship from Voyages of Christopher Columbus haul Statue of Liberty?,"Reformatted Question: Could the <fact1>largest ship from the Voyages of Christopher Columbus</fact1> haul the <fact2>Statue of Liberty</fact2>?

Answer: The <fact1>largest ship from the Voyages of Christopher Columbus</fact1> was the Santa Maria. The Santa Maria was approximately 70 feet long and had a cargo capacity of about 100 tons. The <fact2>Statue of Liberty</fact2>, including its pedestal, weighs approximately 225 tons. 

Given the weight of the Statue of Liberty, the Santa Maria would not have been able to haul it due to its limited cargo capacity. 

So the answer is {false}."
80,Would Jolly Green Giant's largest monument look impressive next to Pyrenees?,"Reformatted Question: Would <fact1>Jolly Green Giant's largest monument</fact1> look impressive next to <fact2>Pyrenees</fact2>?

Answer: The <fact1>Jolly Green Giant's largest monument</fact1> is a statue located in Blue Earth, Minnesota, and stands at 55 feet tall. The <fact2>Pyrenees</fact2> are a mountain range between France and Spain, with peaks reaching over 11,000 feet. Compared to the vast and towering <fact2>Pyrenees</fact2>, the <fact1>Jolly Green Giant's largest monument</fact1> would not look particularly impressive due to the significant difference in scale.

Final_Answer: {false}"
81,Did Karl Marx influence the communist party of China?,"Reformatted Question: Did <fact1>Karl Marx</fact1> influence the <fact2>communist party of China</fact2>?

Answer: <fact1>Karl Marx</fact1> was a philosopher and economist known for his theories about capitalism and communism, which are foundational to Marxist ideology. The <fact2>communist party of China</fact2> was founded on Marxist-Leninist principles, which are directly influenced by the works of <fact1>Karl Marx</fact1>. The party's ideology and policies are heavily based on Marxist theory.

Final_Answer: {true}"
82,Does Soylent use Pea for their source of protein?,"Reformatted Question: Does <fact1>Soylent</fact1> use <fact2>Pea</fact2> for their source of <fact3>protein</fact3>?

Answer: <fact1>Soylent</fact1> is a meal replacement product that uses various sources for <fact3>protein</fact3>. One of the primary sources of <fact3>protein</fact3> in <fact1>Soylent</fact1> is <fact2>Pea protein</fact2>.

Final_Answer: {true}"
83,Do most religious people in Quebec refer to the Quran?,"Reformatted Question: Do most <fact1>religious people</fact1> in <fact2>Quebec</fact2> refer to the <fact3>Quran</fact3>?

Answer: <fact2>Quebec</fact2> is a province in Canada with a predominantly Christian population, primarily Roman Catholic. 
<fact1>Religious people</fact1> in <fact2>Quebec</fact2> are more likely to refer to the Bible than the <fact3>Quran</fact3>.
The <fact3>Quran</fact3> is the holy book of Islam, and while there is a Muslim population in <fact2>Quebec</fact2>, it is not the majority.
So the answer is {false}."
84,Does Family Guy take place on the American West Coast?,"Reformatted Question: Does <fact1>Family Guy</fact1> take place on the <fact2>American West Coast</fact2>?

Answer: <fact1>Family Guy</fact1> is an animated television show that takes place in the fictional town of Quahog, Rhode Island. Rhode Island is located on the East Coast of the United States. Therefore, <fact1>Family Guy</fact1> does not take place on the <fact2>American West Coast</fact2>.

Final_Answer: {false}"
85,Are lengths measured in metres in the UK?,"Reformatted Question: Are lengths measured in <fact1>metres</fact1> in the <fact2>UK</fact2>?

Answer: The <fact1>metre</fact1> is the standard unit of length in the metric system, which is used in many countries around the world, including the <fact2>UK</fact2>. While the <fact2>UK</fact2> uses both the metric and imperial systems, the metric system, including <fact1>metres</fact1>, is commonly used for scientific, engineering, and many everyday purposes.

Final_Answer: {true}"
86,Did the first Duke of Valentinois play a key role in the Hundred Years' War?,"Reformatted Question: Did the <fact1>first Duke of Valentinois</fact1> play a key role in the <fact2>Hundred Years' War</fact2>?

Answer: The <fact2>Hundred Years' War</fact2> was a series of conflicts waged from 1337 to 1453 between the Kingdom of England and the Kingdom of France. The title of <fact1>Duke of Valentinois</fact1> was first granted to Cesare Borgia in 1498, which is after the end of the <fact2>Hundred Years' War</fact2>. Therefore, the <fact1>first Duke of Valentinois</fact1> could not have played a key role in the <fact2>Hundred Years' War</fact2>.

Final_Answer: {false}"
87,Do gorillas fight with panda bears?,"Reformatted Question: Do <fact1>gorillas</fact1> fight with <fact2>panda bears</fact2>?

Answer: <fact1>Gorillas</fact1> are native to the forests of central Sub-Saharan Africa, while <fact2>panda bears</fact2> are native to the mountain ranges of central China. These two species inhabit different continents and ecosystems, making encounters between them in the wild highly unlikely. Additionally, both <fact1>gorillas</fact1> and <fact2>panda bears</fact2> are generally not aggressive towards other species unless threatened. 

So the answer is {false}."
88,Was Christina Aguilera born in the forgotten borough?,"Reformatted Question: Was <fact1>Christina Aguilera</fact1> born in the <fact2>forgotten borough</fact2>?

Answer: The <fact2>forgotten borough</fact2> is a nickname for Staten Island, one of the five boroughs of New York City. <fact1>Christina Aguilera</fact1> was born in Staten Island, New York. 

So the answer is {true}."
89,Is H's most common two letter pair partner a freebie in Wheel of Fortune bonus round?,"Reformatted Question: Is <fact1>H's most common two letter pair partner</fact1> a <fact2>freebie in Wheel of Fortune bonus round</fact2>?

Answer: In the English language, the most common two-letter pair partner with <fact1>H</fact1> is ""TH.""
In the <fact2>Wheel of Fortune bonus round</fact2>, the letters R, S, T, L, N, and E are given as freebies.
The letter ""T"" is included in the freebies.
So the answer is {true}."
90,Can a quarter fit inside of a human kidney?,"Reformatted Question: Can a <fact1>quarter</fact1> fit inside of a <fact2>human kidney</fact2>?

Answer: A <fact1>quarter</fact1> is a coin with a diameter of approximately 24.26 mm and a thickness of 1.75 mm. A <fact2>human kidney</fact2> is typically about 10-12 cm in length, 5-7 cm in width, and 3-4 cm in thickness. Given these dimensions, a <fact1>quarter</fact1> could physically fit inside a <fact2>human kidney</fact2> based on size alone. However, this does not account for the biological and medical implications of such an action.

Final_Answer: {true}"
91,Does James Webb Space Telescope fail astronomer in locating planet Krypton?,"Reformatted Question: Does the <fact1>James Webb Space Telescope</fact1> fail <fact2>astronomer</fact2> in locating <fact3>planet Krypton</fact3>?

Answer: The <fact1>James Webb Space Telescope</fact1> is a powerful space telescope designed to observe distant galaxies, stars, and planets. However, <fact3>planet Krypton</fact3> is a fictional planet from the Superman comic book series and does not exist in reality. Therefore, no <fact2>astronomer</fact2> can locate a non-existent planet using any telescope, including the <fact1>James Webb Space Telescope</fact1>.

Final_Answer: {false}"
92,Was P. G. Wodehouse's favorite book The Hunger Games?,"Reformatted Question: Was <fact1>P. G. Wodehouse's</fact1> favorite book <fact2>The Hunger Games</fact2>?

Answer: <fact1>P. G. Wodehouse</fact1> was an English author who lived from 1881 to 1975. 
<fact2>The Hunger Games</fact2> is a novel by Suzanne Collins, published in 2008. 
<fact1>P. G. Wodehouse</fact1> passed away long before <fact2>The Hunger Games</fact2> was published. 
Therefore, it is not possible for <fact1>P. G. Wodehouse</fact1> to have read or favored <fact2>The Hunger Games</fact2>.

Final_Answer: {false}"
93,Should a finished website have lorem ipsum paragraphs?,"Reformatted Question: Should a <fact1>finished website</fact1> have <fact2>lorem ipsum paragraphs</fact2>?

Answer: A <fact1>finished website</fact1> is expected to have complete and meaningful content for its users. <fact2>Lorem ipsum paragraphs</fact2> are placeholder text used during the design and development stages to visualize the layout and typography of a website. They are not intended to be part of the final content. Therefore, a <fact1>finished website</fact1> should not have <fact2>lorem ipsum paragraphs</fact2> as they do not provide any meaningful information to the users.

Final_Answer: {false}"
94,Did William Shaespeare read the Daily Mirror?,"Reformatted Question: Did <fact1>William Shakespeare</fact1> read the <fact2>Daily Mirror</fact2>?

Answer: <fact1>William Shakespeare</fact1> lived from 1564 to 1616.  
The <fact2>Daily Mirror</fact2> is a British newspaper that was first published in 1903.  
Since <fact1>William Shakespeare</fact1> died long before the <fact2>Daily Mirror</fact2> was established, he could not have read it.  

Final_Answer: {false}"
95,Will more people go in and out of Taco Bell than a Roy Rogers each year?,"Reformatted Question: Will more people go in and out of <fact1>Taco Bell</fact1> than a <fact2>Roy Rogers</fact2> each year?

Answer: <fact1>Taco Bell</fact1> is a widely recognized fast-food chain with thousands of locations across the United States and internationally. It is known for its Mexican-inspired menu and has a large customer base.

<fact2>Roy Rogers</fact2> is a smaller fast-food chain with fewer locations, primarily concentrated in the Mid-Atlantic region of the United States. It offers a menu that includes burgers, chicken, and roast beef sandwiches.

Given the larger number of locations and the widespread popularity of <fact1>Taco Bell</fact1>, it is likely that more people visit <fact1>Taco Bell</fact1> than <fact2>Roy Rogers</fact2> each year.

Final_Answer: {true}"
96,Is it safe to wear sandals in snow?,"Reformatted Question: Is it safe to wear <fact1>sandals</fact1> in <fact2>snow</fact2>?

Answer: <fact1>Sandals</fact1> are open-toed footwear that do not provide adequate insulation or protection against cold temperatures. <fact2>Snow</fact2> is associated with cold weather conditions, which can lead to frostbite or hypothermia if proper footwear is not worn. Therefore, wearing <fact1>sandals</fact1> in <fact2>snow</fact2> is not safe.

Final_Answer: {false}"
97,Was Nikola Tesla's home country involved in the American Civil War?,"Reformatted Question: Was <fact1>Nikola Tesla's home country</fact1> involved in the <fact2>American Civil War</fact2>?

Answer: <fact1>Nikola Tesla</fact1> was born in Smiljan, which was part of the Austrian Empire at the time of his birth in 1856. Today, Smiljan is located in Croatia. The <fact2>American Civil War</fact2> took place from 1861 to 1865, primarily involving the Northern and Southern states of the United States. The Austrian Empire, which included Tesla's birthplace, was not involved in the <fact2>American Civil War</fact2>.

Final_Answer: {false}"
98,Did Ada Lovelace die tragically young for her era?,"Reformatted Question: Did <fact1>Ada Lovelace</fact1> die <fact2>tragically young</fact2> for her era?

Answer: <fact1>Ada Lovelace</fact1> was born in 1815 and died in 1852 at the age of 36. During the 19th century, the average life expectancy was significantly lower than it is today, but many individuals did live into their 50s and beyond. Dying at the age of 36 would be considered <fact2>tragically young</fact2> even for her era, especially for someone of her social standing.

Final_Answer: {true}"
99,Can an Asian black bear use chopsticks?,"Reformatted Question: Can an <fact1>Asian black bear</fact1> use <fact2>chopsticks</fact2>?

Answer: <fact1>Asian black bears</fact1> are wild animals and do not possess the dexterity or cognitive ability to use tools like <fact2>chopsticks</fact2>, which require fine motor skills and coordination typically found in humans. 

So the answer is {false}."
100,Can someone sell their time through the Toronto Star?,"Reformatted Question: Can someone sell their <fact1>time</fact1> through the <fact2>Toronto Star</fact2>?

Answer: The <fact2>Toronto Star</fact2> is a Canadian newspaper that primarily focuses on delivering news, stories, and advertisements. It is not a platform designed for individuals to sell personal services or <fact1>time</fact1> directly. While the newspaper may contain classified ads or listings where services are advertised, the actual transaction of selling <fact1>time</fact1> would not occur through the newspaper itself but rather through direct contact between the service provider and the client.

Final_Answer: {false}"
101,Were deaths from Apollo 13 mission eclipsed by other space missions?,"Reformatted Question: Were <fact1>deaths from Apollo 13 mission</fact1> eclipsed by <fact2>other space missions</fact2>?

Answer: The <fact1>Apollo 13 mission</fact1> did not result in any deaths. The mission was a ""successful failure"" as the crew returned safely to Earth despite a critical in-flight incident. Therefore, there were no <fact1>deaths from Apollo 13 mission</fact1> to be eclipsed by <fact2>other space missions</fact2>.

Final_Answer: {false}"
102,Can you purchase a dish with injera at Taco Bell?,"Reformatted Question: Can you purchase a dish with <fact1>injera</fact1> at <fact2>Taco Bell</fact2>?

Answer: <fact1>Injera</fact1> is a traditional Ethiopian flatbread made from teff flour, commonly used in Ethiopian cuisine.  
<fact2>Taco Bell</fact2> is a fast-food chain known for its Mexican-inspired menu items, such as tacos, burritos, and quesadillas.  
<fact2>Taco Bell</fact2> does not offer Ethiopian cuisine or dishes that include <fact1>injera</fact1> on its menu.  

So the answer is {false}."
103,Is xenophobia hypothetically unimportant between Saladin and Ali Askari?,"Reformatted Question: Is <fact1>xenophobia</fact1> hypothetically unimportant between <fact2>Saladin</fact2> and <fact3>Ali Askari</fact3>?

Answer: <fact1>Xenophobia</fact1> refers to the fear or hatred of strangers or foreigners. 
<fact2>Saladin</fact2> was a Muslim military leader known for his role in the Crusades and his efforts to unite Muslim territories.
<fact3>Ali Askari</fact3> is not a widely recognized historical figure, and there is limited information available about him.
Without specific historical context or evidence of interactions between <fact2>Saladin</fact2> and <fact3>Ali Askari</fact3>, it is difficult to assess the importance of <fact1>xenophobia</fact1> in their relationship.
So the answer is {unknown}."
104,Does Sockington enjoy onions?,"Reformatted Question: Does <fact1>Sockington</fact1> enjoy <fact2>onions</fact2>?

Answer: <fact1>Sockington</fact1> is a famous cat on social media. Cats generally do not enjoy <fact2>onions</fact2> and onions are toxic to them. Therefore, it is unlikely that <fact1>Sockington</fact1> would enjoy <fact2>onions</fact2>.

Final_Answer: {false}"
105,Was Raphael's paintings influenced by the country of Guam?,"Reformatted Question: Was <fact1>Raphael's paintings</fact1> influenced by the country of <fact2>Guam</fact2>?

Answer: <fact1>Raphael</fact1> was an Italian painter and architect of the High Renaissance, active in the early 16th century. <fact2>Guam</fact2> is an island in the Pacific Ocean that was not known to Europeans until the 16th century, after Raphael's death in 1520. There is no historical evidence or record of <fact1>Raphael</fact1> having any contact with or influence from <fact2>Guam</fact2>.

So the answer is {false}."
106,Could Oscar Wilde have operated a motor vehicle?,"Reformatted Question: Could <fact1>Oscar Wilde</fact1> have operated a <fact2>motor vehicle</fact2>?

Answer: <fact1>Oscar Wilde</fact1> was born in 1854 and died in 1900. The first practical automobile was invented in the late 19th century, with the Benz Patent-Motorwagen being built in 1885-1886. However, widespread use and operation of <fact2>motor vehicles</fact2> did not occur until the early 20th century, after <fact1>Oscar Wilde</fact1>'s death. 

So the answer is {false}."
107,Does ontology require a scalpel?,"Reformatted Question: Does <fact1>ontology</fact1> require a <fact2>scalpel</fact2>?

Answer: <fact1>Ontology</fact1> is a branch of metaphysics dealing with the nature of being and existence. It is a philosophical study and does not involve physical procedures or tools. A <fact2>scalpel</fact2> is a small and sharp surgical instrument used for cutting during medical procedures. Since <fact1>ontology</fact1> is a theoretical and conceptual field, it does not require a <fact2>scalpel</fact2> or any physical tools.

Final_Answer: {no}"
108,Was King Arthur at the beheading of Anne Boleyn?,"Reformatted Question: Was <fact1>King Arthur</fact1> at the beheading of <fact2>Anne Boleyn</fact2>?

Answer: <fact1>King Arthur</fact1> is a legendary figure who is said to have lived in the late 5th and early 6th centuries. <fact2>Anne Boleyn</fact2> was beheaded in 1536. The timelines of <fact1>King Arthur</fact1> and <fact2>Anne Boleyn</fact2> do not overlap, as <fact1>King Arthur</fact1> is a figure from the medieval period, while <fact2>Anne Boleyn</fact2> lived during the Tudor period. 

Final_Answer: {false}"
109,Would Alexander Graham Bell hypothetically support Nazi eugenics?,"Reformatted Question: Would <fact1>Alexander Graham Bell</fact1> hypothetically support <fact2>Nazi eugenics</fact2>?

Answer: <fact1>Alexander Graham Bell</fact1> was a proponent of eugenics, advocating for the improvement of the human race through selective breeding. He was involved in the eugenics movement in the early 20th century, which aimed to prevent certain individuals from reproducing. 

<fact2>Nazi eugenics</fact2> was an extreme form of eugenics practiced by the Nazi regime, which included forced sterilizations and genocide to achieve a ""racially pure"" society. While <fact1>Alexander Graham Bell</fact1> supported eugenics, it is not clear if he would have supported the extreme measures taken by the Nazis.

Final_Answer: {true}"
110,Was Harry Truman's presidency unaffected by the twenty-third Amendment to the US Constitution?,"Reformatted Question: Was <fact1>Harry Truman's presidency</fact1> unaffected by the <fact2>twenty-third Amendment to the US Constitution</fact2>?

Answer: The <fact2>twenty-third Amendment to the US Constitution</fact2> was ratified in 1961. It grants residents of Washington D.C. the right to vote for the President and Vice President. <fact1>Harry Truman's presidency</fact1> lasted from 1945 to 1953. Since the amendment was ratified after <fact1>Harry Truman's presidency</fact1> had ended, it did not affect his presidency.

Final_Answer: {true}"
111,"Would the trees in Auburn, New York be changing colors in September?","Reformatted Question: Would the <fact1>trees in Auburn, New York</fact1> be changing colors in <fact2>September</fact2>?

Answer: The <fact1>trees in Auburn, New York</fact1> are located in a region that experiences seasonal changes, including autumn. During autumn, many deciduous trees change colors as part of their natural cycle. <fact2>September</fact2> is typically the beginning of the autumn season in the Northern Hemisphere, when trees start to change colors.

Final_Answer: {true}"
112,Is Black Lives Matter connected with capsaicin?,"Reformatted Question: Is <fact1>Black Lives Matter</fact1> connected with <fact2>capsaicin</fact2>?

Answer: <fact1>Black Lives Matter</fact1> is a social movement advocating for racial equality and justice. It focuses on issues such as police brutality, systemic racism, and social justice reforms. <fact2>Capsaicin</fact2> is a compound found in chili peppers that is responsible for their heat and is used in various applications, including culinary and medicinal purposes. There is no direct connection between the goals or activities of the <fact1>Black Lives Matter</fact1> movement and <fact2>capsaicin</fact2>.

Final_Answer: {false}"
113,Was Achilles a direct descendent of Gaia?,"Reformatted Question: Was <fact1>Achilles</fact1> a direct descendant of <fact2>Gaia</fact2>?

Answer: In Greek mythology, <fact1>Achilles</fact1> was the son of Peleus and Thetis. Thetis was a sea nymph and not a direct descendant of <fact2>Gaia</fact2>. <fact2>Gaia</fact2> is considered the primordial Earth goddess and the mother of many gods and titans, but there is no direct lineage connecting <fact1>Achilles</fact1> to <fact2>Gaia</fact2>.

Final_Answer: {false}"
114,Does Jerry Seinfeld hang out at the Budweiser Party Deck?,"Reformatted Question: Does <fact1>Jerry Seinfeld</fact1> hang out at the <fact2>Budweiser Party Deck</fact2>?

Answer: <fact1>Jerry Seinfeld</fact1> is a well-known comedian and actor, famous for his television show ""Seinfeld."" There is no widely available public information or evidence to suggest that <fact1>Jerry Seinfeld</fact1> regularly hangs out at the <fact2>Budweiser Party Deck</fact2>. The <fact2>Budweiser Party Deck</fact2> is a venue typically associated with sports events and entertainment, but it is not specifically linked to <fact1>Jerry Seinfeld</fact1>.

Final_Answer: {false}"
115,Can you hide a basketball in a sand cat's ear?,"Reformatted Question: Can you hide a <fact1>basketball</fact1> in a <fact2>sand cat's ear</fact2>?

Answer: A <fact1>basketball</fact1> is a large spherical object with a standard diameter of about 9.5 inches (24 cm). A <fact2>sand cat's ear</fact2> is a small part of the sand cat's anatomy, which is much smaller than a basketball. The size of a sand cat's ear is not large enough to accommodate a basketball.

Final_Answer: {false}"
116,Could the Spice Girls compete against ŽRK Kumanovo?,"Reformatted Question: Could the <fact1>Spice Girls</fact1> compete against <fact2>ŽRK Kumanovo</fact2>?

Answer: The <fact1>Spice Girls</fact1> are a British pop girl group known for their music and performances. They are not athletes or a sports team. <fact2>ŽRK Kumanovo</fact2> is a women's handball club based in Kumanovo, North Macedonia. They compete in handball tournaments and leagues. Since the <fact1>Spice Girls</fact1> are not a sports team, they would not be able to compete in a handball match against <fact2>ŽRK Kumanovo</fact2>.

Final_Answer: {false}"
117,Does the swastika have positive uses?,"Reformatted Question: Does the <fact1>swastika</fact1> have <fact2>positive uses</fact2>?

Answer: The <fact1>swastika</fact1> is an ancient symbol used in various cultures around the world. In Hinduism, Buddhism, and Jainism, the <fact1>swastika</fact1> is considered a sacred symbol representing good fortune, prosperity, and auspiciousness. It has been used in religious and cultural contexts for thousands of years with <fact2>positive meanings</fact2>.

Final_Answer: {true}"
118,Was Black fly upstaged by another insect in Jeff Goldblum's 1986 film?,"Reformatted Question: Was <fact1>Black fly</fact1> upstaged by another <fact2>insect</fact2> in <fact3>Jeff Goldblum's 1986 film</fact3>?

Answer: <fact3>Jeff Goldblum's 1986 film</fact3> is ""The Fly,"" which is about a scientist who transforms into a fly due to a teleportation experiment gone wrong.
The main insect in <fact3>Jeff Goldblum's 1986 film</fact3> is a fly, not a <fact1>Black fly</fact1> specifically.
There is no mention of another <fact2>insect</fact2> upstaging the fly in the film.
So the answer is {false}."
119,Did Linnaeus edit Darwin's draft of Origin of Species?,"Reformatted Question: Did <fact1>Linnaeus</fact1> edit <fact2>Darwin's draft of Origin of Species</fact2>?

Answer: <fact1>Carl Linnaeus</fact1> was a Swedish botanist, physician, and zoologist who lived from 1707 to 1778. He is known for creating the system of naming, ranking, and classifying organisms that is still in wide use today (binomial nomenclature). 

<fact2>Charles Darwin's ""On the Origin of Species""</fact2> was published in 1859, long after Linnaeus's death. 

Therefore, it would have been impossible for <fact1>Linnaeus</fact1> to edit <fact2>Darwin's draft of Origin of Species</fact2>.

Final_Answer: {false}"
120,Do all cancer patients get disability?,"Reformatted Question: Do all <fact1>cancer patients</fact1> get <fact2>disability</fact2>?

Answer: Not all <fact1>cancer patients</fact1> automatically qualify for <fact2>disability</fact2> benefits. Eligibility for <fact2>disability</fact2> benefits depends on the severity of the condition and how it affects the individual's ability to work. The Social Security Administration evaluates each case individually to determine if the <fact1>cancer patient</fact1> meets the criteria for <fact2>disability</fact2> benefits.

Final_Answer: {false}"
