id,question,answer
39,Would an oil painter avoid reds from scale insects that live on a cactus?,"Reformatted Question: Would an <fact1>oil painter</fact1> avoid <fact2>reds from scale insects</fact2> that live on a <fact3>cactus</fact3>?

Answer: <fact2>Reds from scale insects</fact2> refer to carmine, a red pigment derived from cochineal insects, which are scale insects that live on <fact3>cacti</fact3>.
<fact1>Oil painters</fact1> often use a variety of pigments, including carmine, for its vibrant red color.
There is no inherent reason for an <fact1>oil painter</fact1> to avoid using <fact2>reds from scale insects</fact2> unless they have specific ethical or personal reasons, such as veganism or concerns about animal-derived products.

Final_Answer: {false}"
40,Was the Second Amendment to the United States Constitution written without consideration for black Americans?,"Reformatted Question: Was the <fact1>Second Amendment to the United States Constitution</fact1> written without consideration for <fact2>black Americans</fact2>?

Answer: The writers of the <fact1>Constitutional Amendments</fact1> did not view <fact2>black people</fact2> as legitimate human beings.  
The writers of the <fact1>Constitutional Amendments</fact1> believed that slavery benefited <fact2>black slaves</fact2>.  
The <fact1>Constitutional Amendments</fact1> were written for people that the writers considered human.  

Final_Answer: {true}"
41,Are all the elements plants need for photosynthesis present in atmosphere of Mars?,"Reformatted Question: Are all the elements <fact1>plants need for photosynthesis</fact1> present in the <fact2>atmosphere of Mars</fact2>?

Answer: 

- <fact1>Plants need carbon dioxide, water, and sunlight for photosynthesis</fact1>. They also require nutrients like nitrogen, phosphorus, and potassium, which are typically absorbed from the soil.
- The <fact2>atmosphere of Mars</fact2> is composed of about 95% carbon dioxide, which is sufficient for the carbon dioxide requirement of photosynthesis.
- However, the <fact2>atmosphere of Mars</fact2> is extremely thin and lacks sufficient water vapor, which is essential for photosynthesis.
- Additionally, the <fact2>atmosphere of Mars</fact2> does not provide the necessary nutrients like nitrogen, phosphorus, and potassium that plants typically absorb from the soil on Earth.

Final_Answer: {false}"
42,Can you find Bob Marley's face in most smoke shops?,"Reformatted Question: Can you find <fact1>Bob Marley's face</fact1> in most <fact2>smoke shops</fact2>?

Answer: <fact1>Bob Marley</fact1> is a cultural icon associated with reggae music and the Rastafarian movement, which often promotes the use of cannabis. <fact2>Smoke shops</fact2> frequently sell products related to cannabis culture, including items featuring <fact1>Bob Marley's face</fact1> such as posters, clothing, and accessories. Therefore, it is common to find <fact1>Bob Marley's face</fact1> in <fact2>smoke shops</fact2>.

Final_Answer: {true}"
43,Did Pablo Escobar's nickname collection outshine Robert Moses Grove's?,"Reformatted Question: Did <fact1>Pablo Escobar's nickname collection</fact1> outshine <fact2>Robert Moses Grove's</fact2>?

Answer: <fact1>Pablo Escobar</fact1> was a notorious Colombian drug lord known for his wealth and influence. He had several nicknames, including ""The King of Cocaine,"" ""El Patrón,"" and ""Don Pablo,"" reflecting his status and notoriety in the drug trade.

<fact2>Robert Moses Grove</fact2>, also known as Lefty Grove, was a famous American baseball pitcher. While he was a celebrated athlete, he was primarily known by the nickname ""Lefty"" due to his left-handed pitching style.

<fact1>Pablo Escobar's nickname collection</fact1> was more extensive and varied, reflecting his multifaceted persona and the impact he had on society, whereas <fact2>Robert Moses Grove's</fact2> nickname was more straightforward and related to his athletic prowess.

So the answer is {true}."
44,Has the Subway restaurant franchise had any connections with child abusers?,"Reformatted Question: Has the <fact1>Subway restaurant franchise</fact1> had any connections with <fact2>child abusers</fact2>?

Answer: The <fact1>Subway restaurant franchise</fact1> was associated with Jared Fogle, who was a spokesperson for the brand. Jared Fogle was convicted of <fact2>child pornography and child sex tourism</fact2> in 2015. This connection brought significant negative attention to the <fact1>Subway restaurant franchise</fact1>.

Final_Answer: {true}"
45,Does autopilot rely on fossil fuels?,"Reformatted Question: Does <fact1>autopilot</fact1> rely on <fact2>fossil fuels</fact2>?

Answer: <fact1>Autopilot</fact1> is a system used in vehicles, such as airplanes and cars, to control the vehicle without constant human intervention. The operation of <fact1>autopilot</fact1> systems themselves does not directly rely on <fact2>fossil fuels</fact2>. However, the vehicles that use <fact1>autopilot</fact1> systems, such as airplanes and many cars, often rely on <fact2>fossil fuels</fact2> for power. Therefore, while the <fact1>autopilot</fact1> system itself does not rely on <fact2>fossil fuels</fact2>, the vehicles it is used in typically do.

Final_Answer: {false}"
46,Are psychiatric patients welcome to join the United States Air Force?,"Reformatted Question: Are <fact1>psychiatric patients</fact1> welcome to join the <fact2>United States Air Force</fact2>?

Answer: The <fact2>United States Air Force</fact2> has strict medical and mental health standards for enlistment.
<fact1>Psychiatric patients</fact1> may face disqualification due to mental health conditions that could affect their ability to perform military duties.
The <fact2>United States Air Force</fact2> requires a thorough medical evaluation to determine eligibility.
So the answer is {false}."
47,Does Nicole Kidman know any Scientologists?,"Reformatted Question: Does <fact1>Nicole Kidman</fact1> know any <fact2>Scientologists</fact2>?

Answer: <fact1>Nicole Kidman</fact1> was married to Tom Cruise, a well-known <fact2>Scientologist</fact2>.
During her marriage to Tom Cruise, <fact1>Nicole Kidman</fact1> would have been in contact with other <fact2>Scientologists</fact2>.
So the answer is {true}."
48,Was John Lennon known to be a good friend to Sasha Obama?,"Reformatted Question: Was <fact1>John Lennon</fact1> known to be a good friend to <fact2>Sasha Obama</fact2>?

Answer: <fact1>John Lennon</fact1> was a member of The Beatles and was born in 1940. He was tragically killed in 1980. <fact2>Sasha Obama</fact2> was born in 2001, long after <fact1>John Lennon's</fact1> death. Therefore, it is not possible for <fact1>John Lennon</fact1> to have been a good friend to <fact2>Sasha Obama</fact2>.

Final_Answer: {false}"
49,Would the tunnels at CERN fit onto the High Speed 1 rails?,"Reformatted Question: Would the <fact1>tunnels at CERN</fact1> fit onto the <fact2>High Speed 1 rails</fact2>?

Answer: The <fact1>tunnels at CERN</fact1>, specifically the Large Hadron Collider (LHC) tunnel, have a diameter of approximately 3.8 meters. The <fact2>High Speed 1 rails</fact2>, which are part of the high-speed railway in the UK, are designed to accommodate standard gauge trains with a track gauge of 1.435 meters. The width of the trains that run on these rails is typically around 2.8 to 3.1 meters. 

The <fact1>tunnels at CERN</fact1> are circular and designed for housing particle accelerators, not for railway tracks. The dimensions and purpose of the <fact1>tunnels at CERN</fact1> are not compatible with the <fact2>High Speed 1 rails</fact2>, which are designed for high-speed train travel.

So the answer is {false}."
50,Could an elephant easily defeat a male macaque?,"Reformatted Question: Could an <fact1>elephant</fact1> easily defeat a <fact2>male macaque</fact2>?

Answer: An <fact1>elephant</fact1> is a large and powerful animal, significantly larger and stronger than a <fact2>male macaque</fact2>. The size and strength of an <fact1>elephant</fact1> would allow it to easily overpower a <fact2>male macaque</fact2> in a confrontation.

Final_Answer: {true}"
51,Do the Ubuntu people speak Ubuntu?,"Reformatted Question: Do the <fact1>Ubuntu people</fact1> speak <fact2>Ubuntu</fact2>?

Answer: The term <fact1>Ubuntu</fact1> refers to a philosophy or worldview originating from Southern Africa, emphasizing community, shared humanity, and mutual caring for all. It is not a language. The <fact2>Ubuntu</fact2> philosophy is often associated with the Nguni Bantu languages, which include Zulu, Xhosa, and others, but it is not a language itself. Therefore, the <fact1>Ubuntu people</fact1> do not speak <fact2>Ubuntu</fact2> as a language.

Final_Answer: {false}"
52,Is cycling a high-risk activity for pelvis fractures?,"Reformatted Question: Is <fact1>cycling</fact1> a high-risk activity for <fact2>pelvis fractures</fact2>?

Answer: <fact1>Cycling</fact1> is a physical activity that involves riding a bicycle. While it is generally considered a low-impact exercise, it can pose risks of injury, particularly in the event of falls or collisions. <fact2>Pelvis fractures</fact2> are serious injuries that can occur due to high-impact trauma or accidents. Although cycling is not typically classified as a high-risk activity for <fact2>pelvis fractures</fact2>, accidents during cycling, such as falls or collisions with vehicles, can potentially lead to such injuries.

Final_Answer: {false}"
53,Is a platypus immune from cholera?,"Reformatted Question: Is a <fact1>platypus</fact1> immune from <fact2>cholera</fact2>?

Answer: The <fact1>platypus</fact1> is a unique mammal native to Australia, known for its distinct features and semi-aquatic lifestyle. There is no specific evidence or scientific research indicating that the <fact1>platypus</fact1> is immune to <fact2>cholera</fact2>. <fact2>Cholera</fact2> is an infectious disease caused by the bacterium Vibrio cholerae, primarily affecting humans and some other animals. Immunity to diseases like <fact2>cholera</fact2> would typically require specific adaptations or resistance mechanisms, which have not been documented in <fact1>platypuses</fact1>.

Final_Answer: {false}"
54,Would a moose hypothetically be too much for a minotaur to devour whole?,"Reformatted Question: Would a <fact1>moose</fact1> hypothetically be too much for a <fact2>minotaur</fact2> to devour whole?

Answer: A <fact1>moose</fact1> is a large animal, with adult males weighing between 800 to 1,500 pounds. The <fact2>minotaur</fact2> is a mythical creature with the body of a man and the head of a bull, known for its strength and size. However, there is no specific information about the <fact2>minotaur</fact2>'s ability to consume large prey whole. Given the size of a <fact1>moose</fact1>, it is likely too large for even a <fact2>minotaur</fact2> to devour whole.

Final_Answer: {true}"
55,Are there bones in an anchovy pizza?,"Reformatted Question: Are there <fact1>bones</fact1> in an <fact2>anchovy pizza</fact2>?

Answer: <fact2>Anchovy pizza</fact2> typically includes anchovies as a topping. 
<fact1>Bones</fact1> in anchovies are small and soft, and they are often left in the fish when used as a topping. 
Therefore, it is common for <fact2>anchovy pizza</fact2> to contain <fact1>bones</fact1>.

Final_Answer: {true}"
56,Can a Bengal cat survive eating only pancakes?,"Reformatted Question: Can a <fact1>Bengal cat</fact1> survive eating only <fact2>pancakes</fact2>?

Answer: <fact1>Bengal cats</fact1> are obligate carnivores, meaning they require a diet primarily composed of meat to meet their nutritional needs. <fact2>Pancakes</fact2> are primarily made of flour, eggs, milk, and sugar, which do not provide the necessary nutrients such as taurine, protein, and certain vitamins and minerals that <fact1>cats</fact1> need to survive. A diet consisting only of <fact2>pancakes</fact2> would lead to malnutrition and health issues in a <fact1>Bengal cat</fact1>.

Final_Answer: {no}"
57,Can the original name of the zucchini be typed on the top row of a QWERTY keyboard?,"Reformatted Question: Can the original name of the <fact1>zucchini</fact1> be typed on the <fact2>top row of a QWERTY keyboard</fact2>?

Answer: The original name of the <fact1>zucchini</fact1> is ""courgette."" On a QWERTY keyboard, the <fact2>top row</fact2> consists of the letters Q, W, E, R, T, Y, U, I, O, P. The word ""courgette"" contains the letters C, O, U, R, G, E, T, T, E. All these letters except C and G can be found on the <fact2>top row of a QWERTY keyboard</fact2>.

Final_Answer: {false}"
58,Does The Hague border multiple bodies of water?,"Reformatted Question: Does <fact1>The Hague</fact1> border <fact2>multiple bodies of water</fact2>?

Answer: <fact1>The Hague</fact1> is a city in the Netherlands. It is located near the North Sea, which is a significant body of water. However, <fact1>The Hague</fact1> does not directly border any other major bodies of water. Therefore, it does not border <fact2>multiple bodies of water</fact2>.

Final_Answer: {false}"
59,Do people in middle school usually get breast exams?,"Reformatted Question: Do <fact1>people in middle school</fact1> usually get <fact2>breast exams</fact2>?

Answer: <fact1>People in middle school</fact1> are typically between the ages of 11 and 14.  
<fact2>Breast exams</fact2> are generally recommended for adults, particularly women over the age of 20, as part of routine health screenings.  
<fact2>Breast exams</fact2> are not typically part of routine health care for <fact1>people in middle school</fact1>.

Final_Answer: {false}"
60,Did people in Korea under Japanese Rule watch a lot of Iron Chef?,"Reformatted Question: Did people in <fact1>Korea under Japanese Rule</fact1> watch a lot of <fact2>Iron Chef</fact2>?

Answer: <fact1>Korea under Japanese Rule</fact1> refers to the period from 1910 to 1945 when Korea was under the control of Japan. <fact2>Iron Chef</fact2> is a Japanese cooking show that first aired in 1993. Since <fact2>Iron Chef</fact2> aired long after the end of <fact1>Japanese Rule in Korea</fact1>, it would not have been possible for people in Korea during that time to watch the show.

Final_Answer: {false}"
61,Would  bald eagle deliver an urgent message before B-52?,"Reformatted Question: Would a <fact1>bald eagle</fact1> deliver an urgent message before a <fact2>B-52</fact2>?

Answer: A <fact1>bald eagle</fact1> is a bird of prey known for its speed and agility in flight, but it is not used for delivering messages. The <fact2>B-52</fact2> is a long-range, subsonic, jet-powered strategic bomber used by the United States Air Force. It is capable of traveling at high speeds and over long distances, making it much faster than a <fact1>bald eagle</fact1> in delivering an urgent message. 

Final_Answer: {false}"
62,Does Snoopy look like Chance from Homeward Bound?,"Reformatted Question: Does <fact1>Snoopy</fact1> look like <fact2>Chance from Homeward Bound</fact2>?

Answer: <fact1>Snoopy</fact1> is a fictional beagle from the comic strip ""Peanuts"" created by Charles M. Schulz. He is characterized by his white body with black ears and a distinctive, imaginative personality. 

<fact2>Chance from Homeward Bound</fact2> is a character from the movie ""Homeward Bound: The Incredible Journey."" Chance is an American Bulldog, known for his white coat with brown patches and a playful, adventurous demeanor.

While both <fact1>Snoopy</fact1> and <fact2>Chance</fact2> are dogs, they are different breeds with distinct physical appearances. <fact1>Snoopy</fact1> is a beagle with a cartoonish design, while <fact2>Chance</fact2> is an American Bulldog depicted in a live-action film. 

So the answer is {false}."
63,Was Dioskourides a lapidary?,"Reformatted Question: Was <fact1>Dioskourides</fact1> a <fact2>lapidary</fact2>?

Answer: <fact1>Dioskourides</fact1>, also known as Pedanius Dioscorides, was a Greek physician, pharmacologist, and botanist. He is best known for his work ""De Materia Medica,"" which is a comprehensive text on herbal medicine and the properties of various plants and minerals. While he did write about minerals, his primary focus was on their medicinal properties rather than the art of cutting and engraving stones, which is what a <fact2>lapidary</fact2> does.

Final_Answer: {false}"
64,Do most middle class families have butlers?,"Reformatted Question: Do most <fact1>middle class families</fact1> have <fact2>butlers</fact2>?

Answer: <fact1>Middle class families</fact1> typically have an average income and lifestyle that does not include luxury services.  
<fact2>Butlers</fact2> are often associated with wealthier households that can afford full-time domestic staff.  
Therefore, it is uncommon for <fact1>middle class families</fact1> to employ <fact2>butlers</fact2>.

Final_Answer: {false}"
65,Was Hillary Clinton's deputy chief of staff in 2009 baptised?,"Reformatted Question: Was <fact1>Hillary Clinton's deputy chief of staff in 2009</fact1> <fact2>baptised</fact2>?

Answer: <fact1>Hillary Clinton's deputy chief of staff in 2009</fact1> was Huma Abedin.  
<fact1>Huma Abedin</fact1> was born to a Muslim family and raised in the Islamic faith.  
<fact2>Baptism</fact2> is a Christian sacrament and is not a practice in Islam.  
There is no public record or indication that <fact1>Huma Abedin</fact1> was <fact2>baptised</fact2>.

Final_Answer: {false}"
66,Does the New York Public Library sell Alpo products?,"Reformatted Question: Does the <fact1>New York Public Library</fact1> sell <fact2>Alpo products</fact2>?

Answer: The <fact1>New York Public Library</fact1> is a public library system in New York City, primarily focused on providing access to books, digital resources, and educational programs. It is not a retail establishment. <fact2>Alpo products</fact2> are a brand of dog food and pet products, typically sold in grocery stores, pet stores, and online retailers. Libraries do not sell commercial products like pet food.

Final_Answer: {false}"
67,Did Solomon make up bigger percentage of Islamic prophets than Kings of Judah?,"Reformatted Question: Did <fact1>Solomon</fact1> make up a bigger percentage of <fact2>Islamic prophets</fact2> than <fact3>Kings of Judah</fact3>?

Answer: 

1. <fact1>Solomon</fact1> is recognized as both an Islamic prophet and a King of Judah.
2. In the context of <fact2>Islamic prophets</fact2>, there are traditionally 25 prophets mentioned in the Quran, including Solomon.
3. In the context of <fact3>Kings of Judah</fact3>, there were 20 kings from the time of Rehoboam to Zedekiah, including Solomon.

To determine the percentage:

- Percentage of <fact1>Solomon</fact1> among <fact2>Islamic prophets</fact2> = (1/25) * 100 = 4%
- Percentage of <fact1>Solomon</fact1> among <fact3>Kings of Judah</fact3> = (1/20) * 100 = 5%

Final_Answer: {false}"
68,Would Taylor Swift refer to Snoopy as oppa?,"Reformatted Question: Would <fact1>Taylor Swift</fact1> refer to <fact2>Snoopy</fact2> as <fact3>oppa</fact3>?

Answer: The term <fact3>""oppa""</fact3> is a Korean word used by females to refer to an older brother or an older male friend. It is commonly used in Korean culture. <fact1>Taylor Swift</fact1> is an American singer-songwriter and does not have a known cultural or personal connection to using Korean terms in her public persona. <fact2>Snoopy</fact2> is a fictional beagle from the comic strip ""Peanuts"" and is not a person, nor is there any known relationship between <fact1>Taylor Swift</fact1> and <fact2>Snoopy</fact2> that would involve using such a term. 

So the answer is {false}."
69,Did Confederate States Army influence West Point fashion?,"Reformatted Question: Did the <fact1>Confederate States Army</fact1> influence <fact2>West Point fashion</fact2>?

Answer: The <fact1>Confederate States Army</fact1> was formed during the American Civil War by the secessionist Southern states. The United States Military Academy at West Point, known for its distinctive uniforms, has a long-standing tradition that predates the Civil War. The uniforms and fashion at <fact2>West Point</fact2> are influenced by military traditions and regulations that have evolved over time, but they are primarily based on the United States Army standards. There is no significant evidence to suggest that the <fact1>Confederate States Army</fact1> had a direct influence on <fact2>West Point fashion</fact2>.

Final_Answer: {false}"
70,Does conservatism repulse Blaire White?,"Reformatted Question: Does <fact1>conservatism</fact1> repulse <fact2>Blaire White</fact2>?

Answer: <fact2>Blaire White</fact2> is a well-known conservative political commentator and YouTuber. She often discusses topics from a conservative perspective and has expressed support for conservative values. Therefore, it is unlikely that <fact1>conservatism</fact1> repulses her.

Final_Answer: {false}"
71,Do all parts of the aloe vera plant taste good?,"Reformatted Question: Do all parts of the <fact1>aloe vera plant</fact1> taste <fact2>good</fact2>?

Answer: The <fact1>aloe vera plant</fact1> has different parts, including the gel and the latex. The gel is often used in foods and drinks and is generally considered to taste <fact2>good</fact2> or at least palatable. However, the latex, which is a yellowish substance found just under the skin, is known to have a bitter taste and is not considered to taste <fact2>good</fact2>.

Final_Answer: {false}"
72,Does an individual oceanographer study many sciences?,"Reformatted Question: Does an <fact1>individual oceanographer</fact1> study <fact2>many sciences</fact2>?

Answer: An <fact1>individual oceanographer</fact1> studies the ocean and its processes, which involves various scientific disciplines. These can include <fact2>marine biology</fact2>, <fact2>geology</fact2>, <fact2>chemistry</fact2>, <fact2>physics</fact2>, and <fact2>meteorology</fact2>. Therefore, an <fact1>individual oceanographer</fact1> does indeed study <fact2>many sciences</fact2>.

Final_Answer: {true}"
73,Did Kurt Cobain's music genre survive after his death?,"Reformatted Question: Did <fact1>Kurt Cobain's music genre</fact1> survive after <fact2>his death</fact2>?

Answer: <fact1>Kurt Cobain's music genre</fact1> is primarily associated with grunge, a subgenre of alternative rock that emerged in the late 1980s and early 1990s. <fact2>His death</fact2> in 1994 did not mark the end of grunge music. Many bands and artists continued to produce music in this genre, and it has influenced numerous musicians and bands since then. Grunge music remains popular and is still celebrated today.

Final_Answer: {true}"
74,Did Immanuel Kant ever meet the 14th president of the United States?,"Reformatted Question: Did <fact1>Immanuel Kant</fact1> ever meet the <fact2>14th president of the United States</fact2>?

Answer: <fact1>Immanuel Kant</fact1> was a German philosopher who lived from 1724 to 1804. The <fact2>14th president of the United States</fact2> was Franklin Pierce, who served from 1853 to 1857 and was born in 1804. Since <fact1>Immanuel Kant</fact1> died in the same year that <fact2>Franklin Pierce</fact2> was born, it would have been impossible for them to have met.

Final_Answer: {false}"
75,Would eliminating competition in the Japanese bulk carrier market be profitable for a steel company?,"Reformatted Question: Would eliminating <fact1>competition</fact1> in the <fact2>Japanese bulk carrier market</fact2> be profitable for a <fact3>steel company</fact3>?

Answer: 

1. Eliminating <fact1>competition</fact1> in a market can lead to a monopoly or reduced competition, which often allows the remaining companies to increase prices and potentially increase profits.

2. The <fact2>Japanese bulk carrier market</fact2> is a segment of the shipping industry that involves the transportation of bulk goods, such as raw materials, which are essential for industries like steel manufacturing.

3. A <fact3>steel company</fact3> relies on the transportation of raw materials, such as iron ore and coal, which are typically transported by bulk carriers. 

4. If a <fact3>steel company</fact3> can control or influence the <fact2>Japanese bulk carrier market</fact2> by eliminating <fact1>competition</fact1>, it may reduce its transportation costs or secure more favorable terms, potentially increasing its profitability.

Final_Answer: {true}"
76,Would a geographer use biochemistry in their work?,"Reformatted Question: Would a <fact1>geographer</fact1> use <fact2>biochemistry</fact2> in their work?

Answer: A <fact1>geographer</fact1> studies the Earth's landscapes, environments, and the relationships between people and their environments. Their work often involves physical geography, human geography, and geographic information systems (GIS). 

<fact2>Biochemistry</fact2> is the study of chemical processes within and relating to living organisms. It is more commonly associated with fields like biology, medicine, and environmental science.

While <fact1>geographers</fact1> may occasionally intersect with <fact2>biochemistry</fact2> in areas like environmental geography or when studying the impact of chemical processes on ecosystems, it is not a primary tool or focus in their work.

So the answer is {false}."
77,Is most coffee produced South of the Equator?,"Reformatted Question: Is most <fact1>coffee</fact1> produced <fact2>South of the Equator</fact2>?

Answer: The majority of <fact1>coffee</fact1> production occurs in countries located in the ""Coffee Belt,"" which is situated around the Equator. Major coffee-producing countries such as Brazil, Colombia, and Ethiopia are located <fact2>South of the Equator</fact2> or near it. Brazil, in particular, is the largest coffee producer in the world and is located <fact2>South of the Equator</fact2>.

Final_Answer: {true}"
