id,question,answer
121,Did the death of Helen Palmer have a significant effect on Dr. Seuss?,"Reformatted Question: Did the <fact1>death of Helen Palmer</fact1> have a significant effect on <fact2>Dr. Seuss</fact2>?

Answer: <fact1>Helen Palmer</fact1> was the wife of <fact2>Dr. Seuss</fact2>, whose real name was Theodor Seuss Geisel. Her death in 1967 had a profound impact on him. <fact1>Helen Palmer</fact1> had been a significant part of his life, both personally and professionally, as she supported and collaborated with him on his work. Her passing led to a period of depression for <fact2>Dr. Seuss</fact2>, affecting his personal life and work.

Final_Answer: {true}"
122,Can fish get Tonsillitis?,"Reformatted Question: Can <fact1>fish</fact1> get <fact2>tonsillitis</fact2>?

Answer: <fact2>Tonsillitis</fact2> is an inflammation of the tonsils, which are lymphoid tissues located in the throat of mammals. <fact1>Fish</fact1> do not have tonsils as they are not mammals and have a different anatomical structure. Therefore, <fact1>fish</fact1> cannot get <fact2>tonsillitis</fact2> because they lack the specific tissues that become inflamed in this condition.

Final_Answer: {false}"
123,Would it be impossible to get to Burning Man on the Mayflower?,"Reformatted Question: Would it be impossible to get to <fact1>Burning Man</fact1> on the <fact2>Mayflower</fact2>?

Answer: The <fact2>Mayflower</fact2> was a 17th-century ship that transported the Pilgrims from England to the New World in 1620. It is no longer in existence or operational. <fact1>Burning Man</fact1> is an annual event held in the Black Rock Desert of Nevada, USA, which began in 1986. Given that the <fact2>Mayflower</fact2> is not operational and the event <fact1>Burning Man</fact1> occurs in a landlocked desert, it would indeed be impossible to get to <fact1>Burning Man</fact1> on the <fact2>Mayflower</fact2>.

Final_Answer: {true}"
124,Does Lupita Nyongo have citizenship in paternal Family of Barack Obama's origin country?,"Reformatted Question: Does <fact1>Lupita Nyong'o</fact1> have citizenship in the paternal family of <fact2>Barack Obama's origin country</fact2>?

Answer: <fact1>Lupita Nyong'o</fact1> was born in Mexico City, Mexico, to Kenyan parents and holds dual citizenship in Kenya and Mexico. <fact2>Barack Obama's paternal family</fact2> is from Kenya. Therefore, <fact1>Lupita Nyong'o</fact1> has citizenship in <fact2>Kenya</fact2>, which is the origin country of <fact2>Barack Obama's paternal family</fact2>.

Final_Answer: {true}"
125,Are there enough Jonny Cash records in the world to give one to each French citizen?,"Reformatted Question: Are there enough <fact1>Johnny Cash records</fact1> in the world to give one to each <fact2>French citizen</fact2>?

Answer: To determine if there are enough <fact1>Johnny Cash records</fact1> to give one to each <fact2>French citizen</fact2>, we need to consider the number of records produced and the population of France. 

<fact1>Johnny Cash</fact1> was a prolific artist with numerous albums and singles released over his career. However, the exact number of records produced is not readily available. 

As of 2020, the population of France is approximately 67 million people. 

Without specific data on the total number of <fact1>Johnny Cash records</fact1> produced, it is difficult to definitively answer the question. However, it is unlikely that there are 67 million <fact1>Johnny Cash records</fact1> available worldwide, given typical production numbers for even popular artists.

Final_Answer: {false}"
126,Could someone mistake the smell of your brussels sprouts for a fart?,"Reformatted Question: Could someone mistake the smell of <fact1>your brussels sprouts</fact1> for a <fact2>fart</fact2>?

Answer: <fact1>Brussels sprouts</fact1> contain sulfur compounds, which can produce a strong odor when cooked. 
<fact2>Farts</fact2> also contain sulfur compounds, which are responsible for their distinctive smell. 
The similarity in sulfur compounds can lead to a similar odor between <fact1>brussels sprouts</fact1> and <fact2>farts</fact2>.

Final_Answer: {true}"
127,Can Stone Cold Steve Austin apply his finisher to a mule deer?,"Reformatted Question: Can <fact1>Stone Cold Steve Austin</fact1> apply his <fact2>finisher</fact2> to a <fact3>mule deer</fact3>?

Answer: <fact1>Stone Cold Steve Austin</fact1> is a professional wrestler known for his signature move, the Stone Cold Stunner, which is a wrestling maneuver performed on human opponents. 

A <fact3>mule deer</fact3> is a wild animal and not a human opponent. 

Wrestling moves like the <fact2>finisher</fact2> are designed for entertainment purposes and are typically performed in a controlled environment with trained participants. 

Applying a wrestling move to a <fact3>mule deer</fact3> would be impractical and potentially harmful to both the animal and the person attempting it. 

So the answer is {false}."
128,Is the Joker in a healthy romantic relationship?,"Reformatted Question: Is the <fact1>Joker</fact1> in a <fact2>healthy romantic relationship</fact2>?

Answer: The <fact1>Joker</fact1> is a fictional character known for his chaotic and violent behavior. In various portrayals, his relationship with Harley Quinn is depicted as abusive and manipulative, lacking mutual respect and support. This does not align with the characteristics of a <fact2>healthy romantic relationship</fact2>, which typically involves mutual respect, trust, and support.

Final_Answer: {false}"
129,Is the kayak a traditional boat in New Zealand?,"Reformatted Question: Is the <fact1>kayak</fact1> a traditional boat in <fact2>New Zealand</fact2>?

Answer: The <fact1>kayak</fact1> is traditionally associated with the indigenous peoples of the Arctic regions, such as the Inuit, and not with the indigenous Maori people of <fact2>New Zealand</fact2>. The traditional boats of the Maori are known as ""waka,"" which are canoes used for transportation and fishing.

Final_Answer: {false}"
130,Did Boris Yeltsin watch the 2008 Summer Olympics?,"Reformatted Question: Did <fact1>Boris Yeltsin</fact1> watch the <fact2>2008 Summer Olympics</fact2>?

Answer: <fact1>Boris Yeltsin</fact1> was the first President of the Russian Federation, serving from 1991 to 1999. He passed away on April 23, 2007. The <fact2>2008 Summer Olympics</fact2> took place in Beijing, China, from August 8 to August 24, 2008. Since <fact1>Boris Yeltsin</fact1> passed away before the <fact2>2008 Summer Olympics</fact2> occurred, he could not have watched them.

Final_Answer: {false}"
131,Did the swallow play a role in a famous film about King Arthur?,"Reformatted Question: Did the <fact1>swallow</fact1> play a role in a famous film about <fact2>King Arthur</fact2>?

Answer: The <fact1>swallow</fact1> is referenced in the famous film ""Monty Python and the Holy Grail,"" which is a comedic take on the legend of <fact2>King Arthur</fact2>. In the film, there is a humorous debate about the airspeed velocity of an unladen swallow, which becomes a recurring joke. 

So the answer is {true}."
132,Was Michael Crichton ever in danger of flunking out of Harvard as an undergraduate?,"Reformatted Question: Was <fact1>Michael Crichton</fact1> ever in danger of flunking out of <fact2>Harvard</fact2> as an <fact3>undergraduate</fact3>?

Answer: <fact1>Michael Crichton</fact1> attended <fact2>Harvard University</fact2> as an <fact3>undergraduate</fact3> student. During his time there, he faced academic challenges and was concerned about his grades. He even resorted to submitting an essay by George Orwell under his own name to test whether his professors were grading fairly, which indicates he was worried about his academic standing. This suggests that he was indeed in danger of flunking out at some point.

Final_Answer: {true}"
133,Was Surfing popular when pogs came out?,"Reformatted Question: Was <fact1>Surfing</fact1> popular when <fact2>pogs</fact2> came out?

Answer: <fact2>Pogs</fact2> became popular in the early 1990s.  
<fact1>Surfing</fact1> has been popular since the 1960s, especially in coastal areas like California and Hawaii.  
By the time <fact2>pogs</fact2> came out, <fact1>surfing</fact1> was already a well-established and popular sport.  

Final_Answer: {true}"
134,Could a student at the University of Houston see a caracal on campus?,"Reformatted Question: Could a <fact1>student at the University of Houston</fact1> see a <fact2>caracal</fact2> on campus?

Answer: The <fact2>caracal</fact2> is a wild cat native to Africa, the Middle East, Central Asia, and India. It is not a native species to the United States, including Texas, where the <fact1>University of Houston</fact1> is located. While it is possible for exotic animals to be kept as pets or in zoos, it is unlikely for a <fact2>caracal</fact2> to be seen roaming freely on a university campus. Therefore, a <fact1>student at the University of Houston</fact1> would not typically see a <fact2>caracal</fact2> on campus.

Final_Answer: {false}"
135,Did the Coen brothers ever collaborate with the Brothers Grimm?,"Reformatted Question: Did the <fact1>Coen brothers</fact1> ever collaborate with the <fact2>Brothers Grimm</fact2>?

Answer: The <fact1>Coen brothers</fact1> are American filmmakers known for their work in the film industry, including movies like ""Fargo"" and ""The Big Lebowski."" The <fact2>Brothers Grimm</fact2>, Jacob and Wilhelm Grimm, were German authors and philologists known for collecting and publishing folklore during the 19th century. The two sets of brothers are from different time periods and fields, with the <fact1>Coen brothers</fact1> being contemporary filmmakers and the <fact2>Brothers Grimm</fact2> being historical figures from the 19th century. Therefore, a collaboration between them is not possible.

Final_Answer: {false}"
136,Could a hundred thousand lolcats fit on a first generation iPhone?,"Reformatted Question: Could <fact1>a hundred thousand lolcats</fact1> fit on a <fact2>first generation iPhone</fact2>?

Answer: The <fact2>first generation iPhone</fact2> had a storage capacity of 4GB or 8GB. Assuming an average image size of a <fact1>lolcat</fact1> is around 50KB, a 4GB iPhone could store approximately 80,000 images, and an 8GB iPhone could store approximately 160,000 images. Therefore, a hundred thousand <fact1>lolcats</fact1> could fit on an 8GB <fact2>first generation iPhone</fact2> but not on a 4GB one.

Final_Answer: {true for 8GB, false for 4GB}"
137,Are monks forbidden from engaging in warfare?,"Reformatted Question: Are <fact1>monks</fact1> forbidden from engaging in <fact2>warfare</fact2>?

Answer: <fact1>Monks</fact1> are often associated with religious orders that emphasize peace, meditation, and non-violence. Many religious traditions, such as Buddhism and Christianity, have teachings that encourage <fact1>monks</fact1> to abstain from <fact2>violence</fact2> and <fact2>warfare</fact2>. In Buddhism, for example, the monastic code (Vinaya) prohibits <fact1>monks</fact1> from taking life or engaging in violent activities. Similarly, Christian monastic orders often emphasize vows of peace and non-violence.

Final_Answer: {true}"
138,Is the BBC World Service hosted in Europe?,"Reformatted Question: Is the <fact1>BBC World Service</fact1> hosted in <fact2>Europe</fact2>?

Answer: The <fact1>BBC World Service</fact1> is an international broadcaster that is part of the British Broadcasting Corporation (BBC).
The <fact1>BBC World Service</fact1> is headquartered in London, which is located in <fact2>Europe</fact2>.
So the answer is {true}."
139,Would 1996 leap year baby technically be 1 year old in 2000?,"Reformatted Question: Would a <fact1>1996 leap year baby</fact1> technically be <fact2>1 year old</fact2> in <fact3>2000</fact3>?

Answer: A <fact1>1996 leap year baby</fact1> is born on February 29, 1996. Leap years occur every four years, so the next leap year after 1996 is 2000. A <fact1>leap year baby</fact1> would have a birthday every four years. By <fact3>2000</fact3>, the baby would have experienced only one leap year birthday, making them technically <fact2>1 year old</fact2> in terms of leap year birthdays. However, in terms of actual age, they would be 4 years old.

Final_Answer: {false}"
140,Did Clark Gable marry more women once than Richard Burton?,"Reformatted Question: Did <fact1>Clark Gable</fact1> marry more women <fact2>once</fact2> than <fact3>Richard Burton</fact3>?

Answer: <fact1>Clark Gable</fact1> was married five times. 
<fact3>Richard Burton</fact3> was married five times, but he married Elizabeth Taylor twice, making it six marriages in total. 
Both <fact1>Clark Gable</fact1> and <fact3>Richard Burton</fact3> married the same number of women, which is five. 
So the answer is {false}."
141,Is one blast from double-barreled shotgun likely to kill all squid brains?,"Reformatted Question: Is one blast from a <fact1>double-barreled shotgun</fact1> likely to kill all <fact2>squid brains</fact2>?

Answer: A <fact1>double-barreled shotgun</fact1> is a firearm designed to shoot projectiles at high velocity. The effectiveness of a shotgun blast in killing depends on the range, spread, and size of the target. 

<fact2>Squid brains</fact2> are relatively small and are located within the squid's head. Squids have a decentralized nervous system, with a large portion of their neural tissue distributed throughout their body, not just in the brain.

Given the spread of a shotgun blast, it is possible that a single shot could damage or destroy the brain of a squid if aimed accurately. However, the term ""all squid brains"" implies multiple squids, and a single blast is unlikely to affect multiple squids unless they are in very close proximity.

So the answer is {false}."
142,Do women often need new shoes during their pregnancy?,"Reformatted Question: Do <fact1>women</fact1> often need <fact2>new shoes</fact2> during their <fact3>pregnancy</fact3>?

Answer: During <fact3>pregnancy</fact3>, <fact1>women</fact1> often experience changes in their body, including swelling of the feet due to increased fluid retention and weight gain. This can lead to a change in shoe size or the need for more comfortable footwear. As a result, <fact1>women</fact1> may often need <fact2>new shoes</fact2> to accommodate these changes.

Final_Answer: {true}"
143,Are some adherents to Christianity in China historic enemies of Catholic Church?,"Reformatted Question: Are some adherents to <fact1>Christianity in China</fact1> historic enemies of the <fact2>Catholic Church</fact2>?

Answer: The <fact1>Christianity in China</fact1> includes various denominations, including Protestant and Catholic groups. Historically, there have been tensions between different Christian denominations globally, including between Protestant groups and the <fact2>Catholic Church</fact2>. In China, the government has also played a role in shaping religious dynamics, sometimes favoring certain groups over others. Additionally, the Chinese Patriotic Catholic Association, which is state-sanctioned, has had conflicts with the Vatican, representing the <fact2>Catholic Church</fact2>. 

So the answer is {true}."
144,Is Chinese successor to Chevrolet Cruze name a town far from Milan?,"Reformatted Question: Is the <fact1>Chinese successor to Chevrolet Cruze</fact1> name a <fact2>town far from Milan</fact2>?

Answer: The <fact1>Chinese successor to Chevrolet Cruze</fact1> is the Chevrolet Monza. Monza is a city in Italy, located near Milan. Therefore, the name does not refer to a <fact2>town far from Milan</fact2>.

So the answer is {false}."
145,Could the Dominican Order hypothetically defeat Blessed Gerard's order?,"Reformatted Question: Could the <fact1>Dominican Order</fact1> hypothetically defeat <fact2>Blessed Gerard's order</fact2>?

Answer: The <fact1>Dominican Order</fact1>, also known as the Order of Preachers, is a Catholic religious order founded by Saint Dominic in the early 13th century. It is known for its focus on preaching, education, and theological scholarship. 

<fact2>Blessed Gerard's order</fact2> refers to the Order of Saint John, also known as the Knights Hospitaller, which was founded by Blessed Gerard in the 11th century. This order was initially established to provide care for sick and poor pilgrims in Jerusalem and later became a military order involved in the Crusades.

In a hypothetical scenario, the ability of the <fact1>Dominican Order</fact1> to ""defeat"" <fact2>Blessed Gerard's order</fact2> would depend on the context of the conflict. The Dominican Order is primarily a religious and educational order, while the Knights Hospitaller were a military order with experience in warfare. Therefore, in a military context, the Knights Hospitaller would likely have an advantage due to their military training and experience.

Final_Answer: {false}"
146,Is a pottery kiln inappropriate for use with glass blowing?,"Reformatted Question: Is a <fact1>pottery kiln</fact1> inappropriate for use with <fact2>glass blowing</fact2>?

Answer: A <fact1>pottery kiln</fact1> is designed to reach temperatures suitable for firing clay and ceramics. The temperature range and heating characteristics of a <fact1>pottery kiln</fact1> may not be suitable for <fact2>glass blowing</fact2>, which requires precise temperature control and often higher temperatures to properly shape and form glass. <fact2>Glass blowing</fact2> typically uses a glass furnace or glory hole specifically designed for the process.

Final_Answer: {true}"
147,Are there enough people in the Balkans to match the population of Japan?,"Reformatted Question: Are there enough people in the <fact1>Balkans</fact1> to match the population of <fact2>Japan</fact2>?

Answer: The <fact1>Balkans</fact1> is a region in Southeast Europe that includes countries such as Albania, Bosnia and Herzegovina, Bulgaria, Croatia, Kosovo, Montenegro, North Macedonia, Romania, Serbia, and Slovenia. The combined population of these countries is significantly less than the population of <fact2>Japan</fact2>.

<fact2>Japan</fact2> has a population of approximately 126 million people.

The combined population of the <fact1>Balkans</fact1> is much less than 126 million.

So the answer is {false}."
148,Could Steven Spielberg send emails as a child?,"Reformatted Question: Could <fact1>Steven Spielberg</fact1> send <fact2>emails</fact2> as a <fact3>child</fact3>?

Answer: <fact1>Steven Spielberg</fact1> was born in 1946. 
<fact2>Emails</fact2> were not widely available until the 1990s. 
As a <fact3>child</fact3>, <fact1>Steven Spielberg</fact1> would not have had access to <fact2>emails</fact2> because they did not exist during his childhood. 

Final_Answer: {false}"
149,Was Charles Manson's body unwanted?,"Reformatted Question: Was <fact1>Charles Manson's body</fact1> <fact2>unwanted</fact2>?

Answer: After <fact1>Charles Manson's death</fact1> in 2017, there was a legal battle over the rights to his remains. Multiple people, including his grandson, a pen pal, and a friend, claimed the rights to his body. This indicates that <fact1>Charles Manson's body</fact1> was not <fact2>unwanted</fact2>.

Final_Answer: {false}"
150,Would a Beaver's teeth rival that of a Smilodon?,"Reformatted Question: Would a <fact1>Beaver's teeth</fact1> rival that of a <fact2>Smilodon</fact2>?

Answer: <fact1>Beaver's teeth</fact1> are known for their ability to continuously grow and are used for gnawing through wood. They are strong and sharp, but relatively small in size compared to large predators.

<fact2>Smilodon</fact2>, commonly known as the saber-toothed tiger, had long, curved canine teeth that could reach lengths of up to 7 inches. These teeth were used for hunting and were much larger and more formidable than those of a beaver.

So the answer is {false}."
151,Is dysphoria around one's pelvis treatable without surgery?,"Reformatted Question: Is <fact1>dysphoria around one's pelvis</fact1> treatable <fact2>without surgery</fact2>?

Answer: <fact1>Dysphoria around one's pelvis</fact1> can be a component of gender dysphoria or body dysmorphic disorder, where individuals experience discomfort or distress with their pelvic area. 

<fact2>Non-surgical treatments</fact2> for such dysphoria can include therapy, such as cognitive-behavioral therapy (CBT), which helps individuals manage and reduce distress by changing negative thought patterns. 

Hormone therapy is another <fact2>non-surgical option</fact2> that can help alleviate dysphoria for transgender individuals by aligning physical characteristics more closely with their gender identity. 

Additionally, support groups and counseling can provide emotional support and coping strategies for managing <fact1>dysphoria</fact1>.

So the answer is {true}."
152,Would members of Blue Lives Matter support every element of Grand Theft Auto III?,"Reformatted Question: Would members of <fact1>Blue Lives Matter</fact1> support every element of <fact2>Grand Theft Auto III</fact2>?

Answer: The <fact1>Blue Lives Matter</fact1> movement is a pro-police advocacy group that supports law enforcement officers and their rights. 

<fact2>Grand Theft Auto III</fact2> is a video game known for its open-world gameplay, which includes criminal activities such as theft, violence, and interactions with law enforcement in a negative context.

The portrayal of police in <fact2>Grand Theft Auto III</fact2> often involves players engaging in illegal activities and evading or confronting law enforcement, which may not align with the values and support for police officers advocated by <fact1>Blue Lives Matter</fact1>.

So the answer is {false}."
153,Can the Dalai Lama fit in a car?,"Reformatted Question: Can the <fact1>Dalai Lama</fact1> fit in a <fact2>car</fact2>?

Answer: The <fact1>Dalai Lama</fact1> is a human being, and most <fact2>cars</fact2> are designed to accommodate human passengers. Therefore, it is reasonable to conclude that the <fact1>Dalai Lama</fact1> can fit in a <fact2>car</fact2>.

Final_Answer: {true}"
154,Can actress Dafne Keen win the Eurovision Song Contest finals in 2020?,"Reformatted Question: Can <fact1>actress Dafne Keen</fact1> win the <fact2>Eurovision Song Contest finals</fact2> in <fact3>2020</fact3>?

Answer: The <fact2>Eurovision Song Contest</fact2> is a competition for musical acts representing countries, not individual actors or actresses. <fact1>Dafne Keen</fact1> is an actress, not a musical performer representing a country in the contest. Additionally, the <fact2>Eurovision Song Contest</fact2> was canceled in <fact3>2020</fact3> due to the COVID-19 pandemic. 

Final_Answer: {false}"
155,Does United Airlines have a perfect operation record?,"Reformatted Question: Does <fact1>United Airlines</fact1> have a <fact2>perfect operation record</fact2>?

Answer: <fact1>United Airlines</fact1> is a major American airline that operates numerous flights daily. Like any large airline, it has experienced operational challenges, including delays, cancellations, and other issues. Therefore, it is unlikely for <fact1>United Airlines</fact1> to have a <fact2>perfect operation record</fact2>.

Final_Answer: {false}"
156,Can United States Secretary of State do crimes in U.K. without being arrested?,"Reformatted Question: Can the <fact1>United States Secretary of State</fact1> do <fact2>crimes</fact2> in the <fact3>U.K.</fact3> without being arrested?

Answer: The <fact1>United States Secretary of State</fact1> is a high-ranking government official and may have diplomatic immunity while on official duties. 

Diplomatic immunity can protect diplomats from being prosecuted for <fact2>crimes</fact2> in the host country, such as the <fact3>U.K.</fact3>.

However, diplomatic immunity does not mean that a diplomat can commit <fact2>crimes</fact2> without any consequences, as the host country can declare the diplomat persona non grata and expel them.

So the answer is {true}, but with limitations and potential consequences."
157,Is myocardial infarction a brain problem?,"Reformatted Question: Is <fact1>myocardial infarction</fact1> a <fact2>brain problem</fact2>?

Answer: A <fact1>myocardial infarction</fact1> is commonly known as a heart attack. It occurs when blood flow to a part of the heart is blocked, causing damage to the heart muscle. A <fact2>brain problem</fact2> typically refers to issues affecting the brain, such as a stroke or neurological disorders. Since a <fact1>myocardial infarction</fact1> affects the heart and not the brain, it is not considered a <fact2>brain problem</fact2>.

Final_Answer: {false}"
158,Will Chick Fil A be open on Halloween 2021?,"Reformatted Question: Will <fact1>Chick Fil A</fact1> be open on <fact2>Halloween 2021</fact2>?

Answer: <fact1>Chick Fil A</fact1> is a fast-food restaurant chain known for being closed on Sundays and certain holidays. However, <fact2>Halloween</fact2> is not typically a holiday on which businesses close. In 2021, <fact2>Halloween</fact2> fell on a Sunday, which means <fact1>Chick Fil A</fact1> would be closed due to its policy of not operating on Sundays.

Final_Answer: {false}"
159,Was  Godfrey of Bouillon an Islamaphobe?,"Reformatted Question: Was <fact1>Godfrey of Bouillon</fact1> an <fact2>Islamaphobe</fact2>?

Answer: <fact1>Godfrey of Bouillon</fact1> was a leader of the First Crusade, which was a military expedition by Western Christianity to reclaim the Holy Lands from Muslim control. The Crusades were marked by religious conflict between Christians and Muslims. 

The term <fact2>Islamaphobe</fact2> refers to a person who harbors irrational fear or hatred towards Islam and Muslims. While the concept of Islamophobia as understood today did not exist during Godfrey's time, his actions during the Crusades were driven by religious motivations against Muslims.

So the answer is {true}."
